[
    {
        "lng": "121.019",
        "lat": "14.7472",
        "date": "2017-01-02",
        "customdate": "Mon - Jan 2, 2017",
        "time": "02:00:00",
        "customtime": "2:00:AM",
        "crime": "ANTI-CARNAPPING ACT (R.A. 6539) MC",
        "location": "Barangay 171, Kalookan City, Ncr District 3 (Northern), NCR",
        "region": "130000000",
        "province": "137500000",
        "modus": "Swpu (Stolen While Parked)",
        "crimetype": "366",
        "station": "Police Station 01 Caloocan City",
        "moduscode": "mc86",
        "date_com": "2017-01-02",
        "datechar": "1/2/2017"
    },
    {
        "lng": "120.948",
        "lat": "14.656",
        "date": "2017-01-04",
        "customdate": "Wed - Jan 4, 2017",
        "time": "17:52:00",
        "customtime": "5:52:PM",
        "crime": "ANTI-CARNAPPING ACT (R.A. 6539) MC",
        "location": "Sipac-Almacen, Navotas, Ncr District 3 (Northern), NCR",
        "region": "130000000",
        "province": "137500000",
        "modus": "Swpu (Stolen While Parked)",
        "crimetype": "366",
        "station": "Police Station 03 Navotas",
        "moduscode": "mc86",
        "date_com": "2017-01-04",
        "datechar": "1/4/2017"
    },
    {
        "lng": "120.979",
        "lat": "14.657",
        "date": "2017-01-04",
        "customdate": "Wed - Jan 4, 2017",
        "time": "18:18:00",
        "customtime": "6:18:PM",
        "crime": "ANTI-CARNAPPING ACT (R.A. 6539) MC",
        "location": "Barangay 72, Kalookan City, Ncr District 3 (Northern), NCR",
        "region": "130000000",
        "province": "137500000",
        "modus": "Swpu (Stolen While Parked)",
        "crimetype": "366",
        "station": "Police Station 01 Caloocan City",
        "moduscode": "mc86",
        "date_com": "2017-01-04",
        "datechar": "1/4/2017"
    },
    {
        "lng": "121.028",
        "lat": "14.7739",
        "date": "2017-01-05",
        "customdate": "Thu - Jan 5, 2017",
        "time": "06:00:00",
        "customtime": "6:00:AM",
        "crime": "ANTI-CARNAPPING ACT (R.A. 6539) MC",
        "location": "Barangay 171, Kalookan City, Ncr District 3 (Northern), NCR",
        "region": "130000000",
        "province": "137500000",
        "modus": "Swpu (Stolen While Parked)",
        "crimetype": "366",
        "station": "Police Station 01 Caloocan City",
        "moduscode": "mc86",
        "date_com": "2017-01-05",
        "datechar": "1/5/2017"
    },
    {
        "lng": "120.955",
        "lat": "14.6433",
        "date": "2017-01-07",
        "customdate": "Sat - Jan 7, 2017",
        "time": "05:30:00",
        "customtime": "5:30:AM",
        "crime": "ANTI-CARNAPPING ACT (R.A. 6539) MC",
        "location": "North Bay Blvd., South, Navotas, Ncr District 3 (Northern), NCR",
        "region": "130000000",
        "province": "137500000",
        "modus": "Swpu (Stolen While Parked)",
        "crimetype": "366",
        "station": "Police Station 03 Navotas",
        "moduscode": "mc86",
        "date_com": "2017-01-07",
        "datechar": "1/7/2017"
    },
    {
        "lng": "120.953",
        "lat": "14.6541",
        "date": "2017-01-08",
        "customdate": "Sun - Jan 8, 2017",
        "time": "07:00:00",
        "customtime": "7:00:AM",
        "crime": "ANTI-CARNAPPING ACT (R.A. 6539) MC",
        "location": "Tañong (Pob.), Malabon City, Ncr District 3 (Northern), NCR",
        "region": "130000000",
        "province": "137500000",
        "modus": "Ftr (Failed to Return)",
        "crimetype": "366",
        "station": "Police Station 02 Malabon City",
        "moduscode": "mc84",
        "date_com": "2017-01-08",
        "datechar": "1/8/2017"
    },
    {
        "lng": "120.984",
        "lat": "14.6609",
        "date": "2017-01-14",
        "customdate": "Sat - Jan 14, 2017",
        "time": "23:30:00",
        "customtime": "11:30:PM",
        "crime": "ANTI-CARNAPPING ACT (R.A. 6539) MC",
        "location": "Potrero, Malabon City, Ncr District 3 (Northern), NCR",
        "region": "130000000",
        "province": "137500000",
        "modus": "Swpu (Stolen While Parked)",
        "crimetype": "366",
        "station": "Police Station 02 Malabon City",
        "moduscode": "mc86",
        "date_com": "2017-01-14",
        "datechar": "1/14/2017"
    },
    {
        "lng": "121.013",
        "lat": "14.7195",
        "date": "2017-01-17",
        "customdate": "Tue - Jan 17, 2017",
        "time": "21:00:00",
        "customtime": "9:00:PM",
        "crime": "ANTI-CARNAPPING ACT (R.A. 6539) MC",
        "location": "Barangay 166, Kalookan City, Ncr District 3 (Northern), NCR",
        "region": "130000000",
        "province": "137500000",
        "modus": "Forcibly Taken",
        "crimetype": "366",
        "station": "Police Station 01 Caloocan City",
        "moduscode": "mc87",
        "date_com": "2017-01-17",
        "datechar": "1/17/2017"
    },
    {
        "lng": "120.986",
        "lat": "14.6566",
        "date": "2017-01-23",
        "customdate": "Mon - Jan 23, 2017",
        "time": "07:05:00",
        "customtime": "7:05:AM",
        "crime": "ANTI-CARNAPPING ACT (R.A. 6539) MV",
        "location": "Barangay 86, Kalookan City, Ncr District 3 (Northern), NCR",
        "region": "130000000",
        "province": "137500000",
        "modus": "Swpu ( Stolen While Parked)",
        "crimetype": "27",
        "station": "Police Station 01 Caloocan City",
        "moduscode": "mc79",
        "date_com": "2017-01-23",
        "datechar": "1/23/2017"
    },
    {
        "lng": "120.958",
        "lat": "14.7187",
        "date": "2017-01-23",
        "customdate": "Mon - Jan 23, 2017",
        "time": "03:30:00",
        "customtime": "3:30:AM",
        "crime": "ANTI-CARNAPPING ACT (R.A. 6539) MC",
        "location": "Malanday, Valenzuela City, Ncr District 3 (Northern), NCR",
        "region": "130000000",
        "province": "137500000",
        "modus": "Swpu (Stolen While Parked)",
        "crimetype": "366",
        "station": "Police Station 04 Valenzuela City",
        "moduscode": "mc86",
        "date_com": "2017-01-23",
        "datechar": "1/23/2017"
    },
    {
        "lng": "121.035",
        "lat": "14.7808",
        "date": "2017-01-25",
        "customdate": "Wed - Jan 25, 2017",
        "time": "01:40:00",
        "customtime": "1:40:AM",
        "crime": "ANTI-CARNAPPING ACT (R.A. 6539) MC",
        "location": "Barangay 176, Kalookan City, Ncr District 3 (Northern), NCR",
        "region": "130000000",
        "province": "137500000",
        "modus": "Swpu (Stolen While Parked)",
        "crimetype": "366",
        "station": "Police Station 01 Caloocan City",
        "moduscode": "mc86",
        "date_com": "2017-01-25",
        "datechar": "1/25/2017"
    },
    {
        "lng": "121.056",
        "lat": "14.7557",
        "date": "2017-01-26",
        "customdate": "Thu - Jan 26, 2017",
        "time": "03:30:00",
        "customtime": "3:30:AM",
        "crime": "ANTI-CARNAPPING ACT (R.A. 6539) MC",
        "location": "Barangay 178, Kalookan City, Ncr District 3 (Northern), NCR",
        "region": "130000000",
        "province": "137500000",
        "modus": "Swpu (Stolen While Parked)",
        "crimetype": "366",
        "station": "Police Station 01 Caloocan City",
        "moduscode": "mc86",
        "date_com": "2017-01-26",
        "datechar": "1/26/2017"
    },
    {
        "lng": "121.035",
        "lat": "14.7702",
        "date": "2017-01-27",
        "customdate": "Fri - Jan 27, 2017",
        "time": "03:00:00",
        "customtime": "3:00:AM",
        "crime": "ANTI-CARNAPPING ACT (R.A. 6539) MC",
        "location": "Barangay 175, Kalookan City, Ncr District 3 (Northern), NCR",
        "region": "130000000",
        "province": "137500000",
        "modus": "Swpu (Stolen While Parked)",
        "crimetype": "366",
        "station": "Police Station 01 Caloocan City",
        "moduscode": "mc86",
        "date_com": "2017-01-27",
        "datechar": "1/27/2017"
    },
    {
        "lng": "121.052",
        "lat": "14.7747",
        "date": "2017-02-01",
        "customdate": "Wed - Feb 1, 2017",
        "time": "08:45:00",
        "customtime": "8:45:AM",
        "crime": "ANTI-CARNAPPING ACT (R.A. 6539) MC",
        "location": "Barangay 176, Kalookan City, Ncr District 3 (Northern), NCR",
        "region": "130000000",
        "province": "137500000",
        "modus": "Swpu (Stolen While Parked)",
        "crimetype": "366",
        "station": "Police Station 01 Caloocan City",
        "moduscode": "mc86",
        "date_com": "2017-02-01",
        "datechar": "2/1/2017"
    },
    {
        "lng": "121.034",
        "lat": "14.7801",
        "date": "2017-02-02",
        "customdate": "Thu - Feb 2, 2017",
        "time": "20:50:00",
        "customtime": "8:50:PM",
        "crime": "ANTI-CARNAPPING ACT (R.A. 6539) MC",
        "location": "Barangay 176, Kalookan City, Ncr District 3 (Northern), NCR",
        "region": "130000000",
        "province": "137500000",
        "modus": "Swpu (Stolen While Parked)",
        "crimetype": "366",
        "station": "Police Station 01 Caloocan City",
        "moduscode": "mc86",
        "date_com": "2017-02-02",
        "datechar": "2/2/2017"
    },
    {
        "lng": "120.972",
        "lat": "14.6693",
        "date": "2017-02-03",
        "customdate": "Fri - Feb 3, 2017",
        "time": "07:00:00",
        "customtime": "7:00:AM",
        "crime": "ANTI-CARNAPPING ACT (R.A. 6539) MC",
        "location": "Tinajeros, Malabon City, Ncr District 3 (Northern), NCR",
        "region": "130000000",
        "province": "137500000",
        "modus": "Swpu (Stolen While Parked)",
        "crimetype": "366",
        "station": "Police Station 02 Malabon City",
        "moduscode": "mc86",
        "date_com": "2017-02-03",
        "datechar": "2/3/2017"
    },
    {
        "lng": "121.051",
        "lat": "14.769",
        "date": "2017-02-04",
        "customdate": "Sat - Feb 4, 2017",
        "time": "07:20:00",
        "customtime": "7:20:AM",
        "crime": "ANTI-CARNAPPING ACT (R.A. 6539) MV",
        "location": "Barangay 176, Kalookan City, Ncr District 3 (Northern), NCR",
        "region": "130000000",
        "province": "137500000",
        "modus": "Swpu ( Stolen While Parked)",
        "crimetype": "27",
        "station": "Police Station 01 Caloocan City",
        "moduscode": "mc79",
        "date_com": "2017-02-04",
        "datechar": "2/4/2017"
    },
    {
        "lng": "121.013",
        "lat": "14.7111",
        "date": "2017-02-05",
        "customdate": "Sun - Feb 5, 2017",
        "time": "00:30:00",
        "customtime": "12:30:AM",
        "crime": "ANTI-CARNAPPING ACT (R.A. 6539) MC",
        "location": "Barangay 166, Kalookan City, Ncr District 3 (Northern), NCR",
        "region": "130000000",
        "province": "137500000",
        "modus": "Forcibly Taken",
        "crimetype": "366",
        "station": "Police Station 01 Caloocan City",
        "moduscode": "mc87",
        "date_com": "2017-02-05",
        "datechar": "2/5/2017"
    },
    {
        "lng": "121.06",
        "lat": "14.7563",
        "date": "2017-02-07",
        "customdate": "Tue - Feb 7, 2017",
        "time": "13:45:00",
        "customtime": "1:45:PM",
        "crime": "ANTI-CARNAPPING ACT (R.A. 6539) MC",
        "location": "Barangay 178, Kalookan City, Ncr District 3 (Northern), NCR",
        "region": "130000000",
        "province": "137500000",
        "modus": "Swpu (Stolen While Parked)",
        "crimetype": "366",
        "station": "Police Station 01 Caloocan City",
        "moduscode": "mc86",
        "date_com": "2017-02-07",
        "datechar": "2/7/2017"
    },
    {
        "lng": "120.978",
        "lat": "14.6846",
        "date": "2017-02-08",
        "customdate": "Wed - Feb 8, 2017",
        "time": "07:00:00",
        "customtime": "7:00:AM",
        "crime": "ANTI-CARNAPPING ACT (R.A. 6539) MV",
        "location": "Karuhatan, Valenzuela City, Ncr District 3 (Northern), NCR",
        "region": "130000000",
        "province": "137500000",
        "modus": "Ftr (Failed to Return)",
        "crimetype": "27",
        "station": "Police Station 04 Valenzuela City",
        "moduscode": "mc77",
        "date_com": "2017-02-08",
        "datechar": "2/8/2017"
    },
    {
        "lng": "120.952",
        "lat": "14.6563",
        "date": "2017-02-21",
        "customdate": "Tue - Feb 21, 2017",
        "time": "06:00:00",
        "customtime": "6:00:AM",
        "crime": "ANTI-CARNAPPING ACT (R.A. 6539) MC",
        "location": "Tañong (Pob.), Malabon City, Ncr District 3 (Northern), NCR",
        "region": "130000000",
        "province": "137500000",
        "modus": "Swpu (Stolen While Parked)",
        "crimetype": "366",
        "station": "Police Station 02 Malabon City",
        "moduscode": "mc86",
        "date_com": "2017-02-21",
        "datechar": "2/21/2017"
    },
    {
        "lng": "120.96",
        "lat": "14.7085",
        "date": "2017-02-23",
        "customdate": "Thu - Feb 23, 2017",
        "time": "15:30:00",
        "customtime": "3:30:PM",
        "crime": "ANTI-CARNAPPING ACT (R.A. 6539) MC",
        "location": "Dalandanan, Valenzuela City, Ncr District 3 (Northern), NCR",
        "region": "130000000",
        "province": "137500000",
        "modus": "Forcibly Taken",
        "crimetype": "366",
        "station": "Police Station 04 Valenzuela City",
        "moduscode": "mc87",
        "date_com": "2017-02-23",
        "datechar": "2/23/2017"
    },
    {
        "lng": "120.985",
        "lat": "14.6446",
        "date": "2017-02-26",
        "customdate": "Sun - Feb 26, 2017",
        "time": "04:00:00",
        "customtime": "4:00:AM",
        "crime": "ANTI-CARNAPPING ACT (R.A. 6539) MC",
        "location": "Barangay 115, Kalookan City, Ncr District 3 (Northern), NCR",
        "region": "130000000",
        "province": "137500000",
        "modus": "Swpu (Stolen While Parked)",
        "crimetype": "366",
        "station": "Police Station 01 Caloocan City",
        "moduscode": "mc86",
        "date_com": "2017-02-26",
        "datechar": "2/26/2017"
    },
    {
        "lng": "121.076",
        "lat": "14.7488",
        "date": "2017-03-01",
        "customdate": "Wed - Mar 1, 2017",
        "time": "16:48:00",
        "customtime": "4:48:PM",
        "crime": "ANTI-CARNAPPING ACT (R.A. 6539) MC",
        "location": "Barangay 179, Kalookan City, Ncr District 3 (Northern), NCR",
        "region": "130000000",
        "province": "137500000",
        "modus": "Swpu (Stolen While Parked)",
        "crimetype": "366",
        "station": "Police Station 01 Caloocan City",
        "moduscode": "mc86",
        "date_com": "2017-03-01",
        "datechar": "3/1/2017"
    },
    {
        "lng": "120.992",
        "lat": "14.674",
        "date": "2017-03-02",
        "customdate": "Thu - Mar 2, 2017",
        "time": "04:00:00",
        "customtime": "4:00:AM",
        "crime": "ANTI-CARNAPPING ACT (R.A. 6539) MV",
        "location": "Marulas, Valenzuela City, Ncr District 3 (Northern), NCR",
        "region": "130000000",
        "province": "137500000",
        "modus": "Taxi Hold-Up W/ Gun",
        "crimetype": "27",
        "station": "Police Station 04 Valenzuela City",
        "moduscode": "mc56",
        "date_com": "2017-03-02",
        "datechar": "3/2/2017"
    },
    {
        "lng": "120.992",
        "lat": "14.674",
        "date": "2017-03-02",
        "customdate": "Thu - Mar 2, 2017",
        "time": "04:00:00",
        "customtime": "4:00:AM",
        "crime": "ANTI-CARNAPPING ACT (R.A. 6539) MV",
        "location": "Marulas, Valenzuela City, Ncr District 3 (Northern), NCR",
        "region": "130000000",
        "province": "137500000",
        "modus": "Forcibly Taken",
        "crimetype": "27",
        "station": "Police Station 04 Valenzuela City",
        "moduscode": "mc83",
        "date_com": "2017-03-02",
        "datechar": "3/2/2017"
    },
    {
        "lng": "121.015",
        "lat": "14.6821",
        "date": "2017-03-05",
        "customdate": "Sun - Mar 5, 2017",
        "time": "01:00:00",
        "customtime": "1:00:AM",
        "crime": "ANTI-CARNAPPING ACT (R.A. 6539) MC",
        "location": "Barangay 163, Kalookan City, Ncr District 3 (Northern), NCR",
        "region": "130000000",
        "province": "137500000",
        "modus": "Swpu (Stolen While Parked)",
        "crimetype": "366",
        "station": "Police Station 01 Caloocan City",
        "moduscode": "mc86",
        "date_com": "2017-03-05",
        "datechar": "3/5/2017"
    },
    {
        "lng": "120.98",
        "lat": "14.6997",
        "date": "2017-03-05",
        "customdate": "Sun - Mar 5, 2017",
        "time": "15:47:00",
        "customtime": "3:47:PM",
        "crime": "ANTI-CARNAPPING ACT (R.A. 6539) MV",
        "location": "Hen. T. De Leon, Valenzuela City, Ncr District 3 (Northern), NCR",
        "region": "130000000",
        "province": "137500000",
        "modus": "Ftr (Failed to Return)",
        "crimetype": "27",
        "station": "Police Station 04 Valenzuela City",
        "moduscode": "mc77",
        "date_com": "2017-03-05",
        "datechar": "3/5/2017"
    },
    {
        "lng": "121.06",
        "lat": "14.7569",
        "date": "2017-03-08",
        "customdate": "Wed - Mar 8, 2017",
        "time": "15:40:00",
        "customtime": "3:40:PM",
        "crime": "ANTI-CARNAPPING ACT (R.A. 6539) MC",
        "location": "Barangay 178, Kalookan City, Ncr District 3 (Northern), NCR",
        "region": "130000000",
        "province": "137500000",
        "modus": "Swpu (Stolen While Parked)",
        "crimetype": "366",
        "station": "Police Station 01 Caloocan City",
        "moduscode": "mc86",
        "date_com": "2017-03-08",
        "datechar": "3/8/2017"
    },
    {
        "lng": "120.951",
        "lat": "14.6481",
        "date": "2017-03-13",
        "customdate": "Mon - Mar 13, 2017",
        "time": "00:25:00",
        "customtime": "12:25:AM",
        "crime": "ANTI-CARNAPPING ACT (R.A. 6539) MC",
        "location": "North Bay Blvd., South, Navotas, Ncr District 3 (Northern), NCR",
        "region": "130000000",
        "province": "137500000",
        "modus": "Swpu (Stolen While Parked)",
        "crimetype": "366",
        "station": "Police Station 03 Navotas",
        "moduscode": "mc86",
        "date_com": "2017-03-13",
        "datechar": "3/13/2017"
    },
    {
        "lng": "120.988",
        "lat": "14.6449",
        "date": "2017-03-14",
        "customdate": "Tue - Mar 14, 2017",
        "time": "01:00:00",
        "customtime": "1:00:AM",
        "crime": "ANTI-CARNAPPING ACT (R.A. 6539) MC",
        "location": "Barangay 84, Kalookan City, Ncr District 3 (Northern), NCR",
        "region": "130000000",
        "province": "137500000",
        "modus": "Swpu (Stolen While Parked)",
        "crimetype": "366",
        "station": "Police Station 01 Caloocan City",
        "moduscode": "mc86",
        "date_com": "2017-03-14",
        "datechar": "3/14/2017"
    },
    {
        "lng": "121.004",
        "lat": "14.7233",
        "date": "2017-03-14",
        "customdate": "Tue - Mar 14, 2017",
        "time": "00:45:00",
        "customtime": "12:45:AM",
        "crime": "ANTI-CARNAPPING ACT (R.A. 6539) MC",
        "location": "Barangay 167, Kalookan City, Ncr District 3 (Northern), NCR",
        "region": "130000000",
        "province": "137500000",
        "modus": "Swpu (Stolen While Parked)",
        "crimetype": "366",
        "station": "Police Station 01 Caloocan City",
        "moduscode": "mc86",
        "date_com": "2017-03-14",
        "datechar": "3/14/2017"
    },
    {
        "lng": "121.043",
        "lat": "14.7451",
        "date": "2017-03-22",
        "customdate": "Wed - Mar 22, 2017",
        "time": "10:15:00",
        "customtime": "10:15:AM",
        "crime": "ANTI-CARNAPPING ACT (R.A. 6539) MC",
        "location": "Barangay 172, Kalookan City, Ncr District 3 (Northern), NCR",
        "region": "130000000",
        "province": "137500000",
        "modus": "Swpu (Stolen While Parked)",
        "crimetype": "366",
        "station": "Police Station 01 Caloocan City",
        "moduscode": "mc86",
        "date_com": "2017-03-22",
        "datechar": "3/22/2017"
    },
    {
        "lng": "120.958",
        "lat": "14.6496",
        "date": "2017-03-24",
        "customdate": "Fri - Mar 24, 2017",
        "time": "07:30:00",
        "customtime": "7:30:AM",
        "crime": "ANTI-CARNAPPING ACT (R.A. 6539) MV",
        "location": "North Bay Blvd., South, Navotas, Ncr District 3 (Northern), NCR",
        "region": "130000000",
        "province": "137500000",
        "modus": "Swpu ( Stolen While Parked)",
        "crimetype": "27",
        "station": "Police Station 03 Navotas",
        "moduscode": "mc79",
        "date_com": "2017-03-24",
        "datechar": "3/24/2017"
    },
    {
        "lng": "120.994",
        "lat": "14.6555",
        "date": "2017-03-29",
        "customdate": "Wed - Mar 29, 2017",
        "time": "15:30:00",
        "customtime": "3:30:PM",
        "crime": "ANTI-CARNAPPING ACT (R.A. 6539) MV",
        "location": "Barangay 96, Kalookan City, Ncr District 3 (Northern), NCR",
        "region": "130000000",
        "province": "137500000",
        "modus": "Forcibly Taken",
        "crimetype": "27",
        "station": "Police Station 01 Caloocan City",
        "moduscode": "mc83",
        "date_com": "2017-03-29",
        "datechar": "3/29/2017"
    },
    {
        "lng": "120.982",
        "lat": "14.6792",
        "date": "2017-04-01",
        "customdate": "Sat - Apr 1, 2017",
        "time": "04:30:00",
        "customtime": "4:30:AM",
        "crime": "ANTI-CARNAPPING ACT (R.A. 6539) MV",
        "location": "Marulas, Valenzuela City, Ncr District 3 (Northern), NCR",
        "region": "130000000",
        "province": "137500000",
        "modus": "Ftr (Failed to Return)",
        "crimetype": "27",
        "station": "Police Station 04 Valenzuela City",
        "moduscode": "mc77",
        "date_com": null,
        "datechar": null
    },
    {
        "lng": "120.992",
        "lat": "14.728",
        "date": "2017-04-04",
        "customdate": "Tue - Apr 4, 2017",
        "time": "07:00:00",
        "customtime": "7:00:AM",
        "crime": "ANTI-CARNAPPING ACT (R.A. 6539) MC",
        "location": "Canumay, Valenzuela City, Ncr District 3 (Northern), NCR",
        "region": "130000000",
        "province": "137500000",
        "modus": "Swpu (Stolen While Parked)",
        "crimetype": "366",
        "station": "Police Station 04 Valenzuela City",
        "moduscode": "mc86",
        "date_com": null,
        "datechar": null
    },
    {
        "lng": "121.038",
        "lat": "14.7795",
        "date": "2017-04-07",
        "customdate": "Fri - Apr 7, 2017",
        "time": "02:00:00",
        "customtime": "2:00:AM",
        "crime": "ANTI-CARNAPPING ACT (R.A. 6539) MC",
        "location": "Barangay 176, Kalookan City, Ncr District 3 (Northern), NCR",
        "region": "130000000",
        "province": "137500000",
        "modus": "Swpu (Stolen While Parked)",
        "crimetype": "366",
        "station": "Police Station 01 Caloocan City",
        "moduscode": "mc86",
        "date_com": null,
        "datechar": null
    },
    {
        "lng": "121.001",
        "lat": "14.6808",
        "date": "2017-04-07",
        "customdate": "Fri - Apr 7, 2017",
        "time": "18:30:00",
        "customtime": "6:30:PM",
        "crime": "ANTI-CARNAPPING ACT (R.A. 6539) MC",
        "location": "Barangay 160, Kalookan City, Ncr District 3 (Northern), NCR",
        "region": "130000000",
        "province": "137500000",
        "modus": "Swpu (Stolen While Parked)",
        "crimetype": "366",
        "station": "Police Station 01 Caloocan City",
        "moduscode": "mc86",
        "date_com": null,
        "datechar": null
    },
    {
        "lng": "120.991",
        "lat": "14.6575",
        "date": "2017-04-07",
        "customdate": "Fri - Apr 7, 2017",
        "time": "09:30:00",
        "customtime": "9:30:AM",
        "crime": "ANTI-CARNAPPING ACT (R.A. 6539) MC",
        "location": "Barangay 135, Kalookan City, Ncr District 3 (Northern), NCR",
        "region": "130000000",
        "province": "137500000",
        "modus": "Swpu (Stolen While Parked)",
        "crimetype": "366",
        "station": "Police Station 01 Caloocan City",
        "moduscode": "mc86",
        "date_com": null,
        "datechar": null
    },
    {
        "lng": "120.939",
        "lat": "14.687",
        "date": "2017-04-09",
        "customdate": "Sun - Apr 9, 2017",
        "time": "22:30:00",
        "customtime": "10:30:PM",
        "crime": "ANTI-CARNAPPING ACT (R.A. 6539) MC",
        "location": "Dampalit, Malabon City, Ncr District 3 (Northern), NCR",
        "region": "130000000",
        "province": "137500000",
        "modus": "Swpu (Stolen While Parked)",
        "crimetype": "366",
        "station": "Police Station 02 Malabon City",
        "moduscode": "mc86",
        "date_com": null,
        "datechar": null
    },
    {
        "lng": "120.978",
        "lat": "14.7019",
        "date": "2017-04-09",
        "customdate": "Sun - Apr 9, 2017",
        "time": "06:00:00",
        "customtime": "6:00:AM",
        "crime": "ANTI-CARNAPPING ACT (R.A. 6539) MV",
        "location": "Karuhatan, Valenzuela City, Ncr District 3 (Northern), NCR",
        "region": "130000000",
        "province": "137500000",
        "modus": "Ftr (Failed to Return)",
        "crimetype": "27",
        "station": "Police Station 04 Valenzuela City",
        "moduscode": "mc77",
        "date_com": null,
        "datechar": null
    },
    {
        "lng": "121.08",
        "lat": "14.7616",
        "date": "2017-04-17",
        "customdate": "Mon - Apr 17, 2017",
        "time": "13:00:00",
        "customtime": "1:00:PM",
        "crime": "ANTI-CARNAPPING ACT (R.A. 6539) MC",
        "location": "Barangay 180, Kalookan City, Ncr District 3 (Northern), NCR",
        "region": "130000000",
        "province": "137500000",
        "modus": "Swpu (Stolen While Parked)",
        "crimetype": "366",
        "station": "Police Station 01 Caloocan City",
        "moduscode": "mc86",
        "date_com": null,
        "datechar": null
    },
    {
        "lng": "121.019",
        "lat": "14.7437",
        "date": "2017-04-18",
        "customdate": "Tue - Apr 18, 2017",
        "time": "04:30:00",
        "customtime": "4:30:AM",
        "crime": "ANTI-CARNAPPING ACT (R.A. 6539) MC",
        "location": "Barangay 171, Kalookan City, Ncr District 3 (Northern), NCR",
        "region": "130000000",
        "province": "137500000",
        "modus": "Swpu (Stolen While Parked)",
        "crimetype": "366",
        "station": "Police Station 01 Caloocan City",
        "moduscode": "mc86",
        "date_com": null,
        "datechar": null
    },
    {
        "lng": "120.989",
        "lat": "14.7003",
        "date": "2017-04-21",
        "customdate": "Fri - Apr 21, 2017",
        "time": "01:00:00",
        "customtime": "1:00:AM",
        "crime": "ANTI-CARNAPPING ACT (R.A. 6539) MV",
        "location": "Parada, Valenzuela City, Ncr District 3 (Northern), NCR",
        "region": "130000000",
        "province": "137500000",
        "modus": "Forcibly Taken",
        "crimetype": "27",
        "station": "Police Station 04 Valenzuela City",
        "moduscode": "mc83",
        "date_com": null,
        "datechar": null
    },
    {
        "lng": "120.989",
        "lat": "14.7003",
        "date": "2017-04-21",
        "customdate": "Fri - Apr 21, 2017",
        "time": "01:00:00",
        "customtime": "1:00:AM",
        "crime": "ANTI-CARNAPPING ACT (R.A. 6539) MV",
        "location": "Parada, Valenzuela City, Ncr District 3 (Northern), NCR",
        "region": "130000000",
        "province": "137500000",
        "modus": "Stabbing/Hacking",
        "crimetype": "27",
        "station": "Police Station 04 Valenzuela City",
        "moduscode": "mc94",
        "date_com": null,
        "datechar": null
    },
    {
        "lng": "120.989",
        "lat": "14.7003",
        "date": "2017-04-21",
        "customdate": "Fri - Apr 21, 2017",
        "time": "01:00:00",
        "customtime": "1:00:AM",
        "crime": "ANTI-CARNAPPING ACT (R.A. 6539) MV",
        "location": "Parada, Valenzuela City, Ncr District 3 (Northern), NCR",
        "region": "130000000",
        "province": "137500000",
        "modus": "Hold Up",
        "crimetype": "27",
        "station": "Police Station 04 Valenzuela City",
        "moduscode": "mc8",
        "date_com": null,
        "datechar": null
    },
    {
        "lng": "120.997",
        "lat": "14.6823",
        "date": "2017-04-21",
        "customdate": "Fri - Apr 21, 2017",
        "time": "03:45:00",
        "customtime": "3:45:AM",
        "crime": "ANTI-CARNAPPING ACT (R.A. 6539) MV",
        "location": "Hen. T. De Leon, Valenzuela City, Ncr District 3 (Northern), NCR",
        "region": "130000000",
        "province": "137500000",
        "modus": "Stabbing/Hacking",
        "crimetype": "27",
        "station": "Police Station 04 Valenzuela City",
        "moduscode": "mc90",
        "date_com": null,
        "datechar": null
    },
    {
        "lng": "120.997",
        "lat": "14.6823",
        "date": "2017-04-21",
        "customdate": "Fri - Apr 21, 2017",
        "time": "03:45:00",
        "customtime": "3:45:AM",
        "crime": "ANTI-CARNAPPING ACT (R.A. 6539) MV",
        "location": "Hen. T. De Leon, Valenzuela City, Ncr District 3 (Northern), NCR",
        "region": "130000000",
        "province": "137500000",
        "modus": "Forcibly Taken",
        "crimetype": "27",
        "station": "Police Station 04 Valenzuela City",
        "moduscode": "mc83",
        "date_com": null,
        "datechar": null
    },
    {
        "lng": "120.983",
        "lat": "14.6516",
        "date": "2017-04-21",
        "customdate": "Fri - Apr 21, 2017",
        "time": "12:40:00",
        "customtime": "12:40:PM",
        "crime": "ANTI-CARNAPPING ACT (R.A. 6539) MC",
        "location": "Barangay 62, Kalookan City, Ncr District 3 (Northern), NCR",
        "region": "130000000",
        "province": "137500000",
        "modus": "Swpu (Stolen While Parked)",
        "crimetype": "366",
        "station": "Police Station 01 Caloocan City",
        "moduscode": "mc86",
        "date_com": null,
        "datechar": null
    },
    {
        "lng": "121.03",
        "lat": "14.7726",
        "date": "2017-04-22",
        "customdate": "Sat - Apr 22, 2017",
        "time": "02:00:00",
        "customtime": "2:00:AM",
        "crime": "ANTI-CARNAPPING ACT (R.A. 6539) MC",
        "location": "Barangay 171, Kalookan City, Ncr District 3 (Northern), NCR",
        "region": "130000000",
        "province": "137500000",
        "modus": "Swpu (Stolen While Parked)",
        "crimetype": "366",
        "station": "Police Station 01 Caloocan City",
        "moduscode": "mc86",
        "date_com": null,
        "datechar": null
    },
    {
        "lng": "120.968",
        "lat": "14.663",
        "date": "2017-04-23",
        "customdate": "Sun - Apr 23, 2017",
        "time": "07:00:00",
        "customtime": "7:00:AM",
        "crime": "ANTI-CARNAPPING ACT (R.A. 6539) MC",
        "location": "Tugatog, Malabon City, Ncr District 3 (Northern), NCR",
        "region": "130000000",
        "province": "137500000",
        "modus": "Swpu (Stolen While Parked)",
        "crimetype": "366",
        "station": "Police Station 02 Malabon City",
        "moduscode": "mc86",
        "date_com": null,
        "datechar": null
    },
    {
        "lng": "121.063",
        "lat": "14.757",
        "date": "2017-04-27",
        "customdate": "Thu - Apr 27, 2017",
        "time": "00:50:00",
        "customtime": "12:50:AM",
        "crime": "ANTI-CARNAPPING ACT (R.A. 6539) MC",
        "location": "Barangay 178, Kalookan City, Ncr District 3 (Northern), NCR",
        "region": "130000000",
        "province": "137500000",
        "modus": "Swpu (Stolen While Parked)",
        "crimetype": "366",
        "station": "Police Station 01 Caloocan City",
        "moduscode": "mc86",
        "date_com": null,
        "datechar": null
    },
    {
        "lng": "120.972",
        "lat": "14.6425",
        "date": "2017-04-28",
        "customdate": "Fri - Apr 28, 2017",
        "time": "02:30:00",
        "customtime": "2:30:AM",
        "crime": "ANTI-CARNAPPING ACT (R.A. 6539) MC",
        "location": "Barangay 24, Kalookan City, Ncr District 3 (Northern), NCR",
        "region": "130000000",
        "province": "137500000",
        "modus": "Swpu (Stolen While Parked)",
        "crimetype": "366",
        "station": "Police Station 01 Caloocan City",
        "moduscode": "mc86",
        "date_com": null,
        "datechar": null
    },
    {
        "lng": "121.003",
        "lat": "14.6836",
        "date": "2017-04-28",
        "customdate": "Fri - Apr 28, 2017",
        "time": "01:00:00",
        "customtime": "1:00:AM",
        "crime": "ANTI-CARNAPPING ACT (R.A. 6539) MC",
        "location": "Barangay 164, Kalookan City, Ncr District 3 (Northern), NCR",
        "region": "130000000",
        "province": "137500000",
        "modus": "Swpu (Stolen While Parked)",
        "crimetype": "366",
        "station": "Police Station 01 Caloocan City",
        "moduscode": "mc86",
        "date_com": null,
        "datechar": null
    },
    {
        "lng": "120.992",
        "lat": "14.6423",
        "date": "2017-04-29",
        "customdate": "Sat - Apr 29, 2017",
        "time": "08:00:00",
        "customtime": "8:00:AM",
        "crime": "ANTI-CARNAPPING ACT (R.A. 6539) MC",
        "location": "Barangay 126, Kalookan City, Ncr District 3 (Northern), NCR",
        "region": "130000000",
        "province": "137500000",
        "modus": "Swpu (Stolen While Parked)",
        "crimetype": "366",
        "station": "Police Station 01 Caloocan City",
        "moduscode": "mc86",
        "date_com": null,
        "datechar": null
    },
    {
        "lng": "120.962",
        "lat": "14.6477",
        "date": "2017-05-01",
        "customdate": "Mon - May 1, 2017",
        "time": "04:00:00",
        "customtime": "4:00:AM",
        "crime": "ANTI-CARNAPPING ACT (R.A. 6539) MC",
        "location": "Barangay 14, Kalookan City, Ncr District 3 (Northern), NCR",
        "region": "130000000",
        "province": "137500000",
        "modus": "Swpu (Stolen While Parked)",
        "crimetype": "366",
        "station": "Police Station 01 Caloocan City",
        "moduscode": "mc86",
        "date_com": "2017-05-01",
        "datechar": "5/1/2017"
    },
    {
        "lng": "120.961",
        "lat": "14.6669",
        "date": "2017-05-02",
        "customdate": "Tue - May 2, 2017",
        "time": "16:30:00",
        "customtime": "4:30:PM",
        "crime": "ANTI-CARNAPPING ACT (R.A. 6539) MC",
        "location": "Catmon, Malabon City, Ncr District 3 (Northern), NCR",
        "region": "130000000",
        "province": "137500000",
        "modus": "Forcibly Taken",
        "crimetype": "366",
        "station": "Police Station 02 Malabon City",
        "moduscode": "mc87",
        "date_com": "2017-05-02",
        "datechar": "5/2/2017"
    },
    {
        "lng": "121.056",
        "lat": "14.7558",
        "date": "2017-05-03",
        "customdate": "Wed - May 3, 2017",
        "time": "04:00:00",
        "customtime": "4:00:AM",
        "crime": "ANTI-CARNAPPING ACT (R.A. 6539) MC",
        "location": "Barangay 178, Kalookan City, Ncr District 3 (Northern), NCR",
        "region": "130000000",
        "province": "137500000",
        "modus": "Swpu (Stolen While Parked)",
        "crimetype": "366",
        "station": "Police Station 01 Caloocan City",
        "moduscode": "mc86",
        "date_com": "2017-05-03",
        "datechar": "5/3/2017"
    },
    {
        "lng": "120.952",
        "lat": "14.6596",
        "date": "2017-05-03",
        "customdate": "Wed - May 3, 2017",
        "time": "19:00:00",
        "customtime": "7:00:PM",
        "crime": "ANTI-CARNAPPING ACT (R.A. 6539) MC",
        "location": "San Agustin, Malabon City, Ncr District 3 (Northern), NCR",
        "region": "130000000",
        "province": "137500000",
        "modus": "Forcibly Taken",
        "crimetype": "366",
        "station": "Police Station 02 Malabon City",
        "moduscode": "mc87",
        "date_com": "2017-05-03",
        "datechar": "5/3/2017"
    },
    {
        "lng": "120.957",
        "lat": "14.6869",
        "date": "2017-05-04",
        "customdate": "Thu - May 4, 2017",
        "time": "20:00:00",
        "customtime": "8:00:PM",
        "crime": "ANTI-CARNAPPING ACT (R.A. 6539) MV",
        "location": "Panghulo, Malabon City, Ncr District 3 (Northern), NCR",
        "region": "130000000",
        "province": "137500000",
        "modus": "Ftr (Failed to Return)",
        "crimetype": "27",
        "station": "Police Station 02 Malabon City",
        "moduscode": "mc77",
        "date_com": "2017-05-04",
        "datechar": "5/4/2017"
    },
    {
        "lng": "120.967",
        "lat": "14.65",
        "date": "2017-05-12",
        "customdate": "Fri - May 12, 2017",
        "time": "06:45:00",
        "customtime": "6:45:AM",
        "crime": "ANTI-CARNAPPING ACT (R.A. 6539) MC",
        "location": "Barangay 178, Kalookan City, Ncr District 3 (Northern), NCR",
        "region": "130000000",
        "province": "137500000",
        "modus": "Swpu (Stolen While Parked)",
        "crimetype": "366",
        "station": "Police Station 01 Caloocan City",
        "moduscode": "mc86",
        "date_com": "2017-05-12",
        "datechar": "5/12/2017"
    },
    {
        "lng": "121.018",
        "lat": "14.7305",
        "date": "2017-05-13",
        "customdate": "Sat - May 13, 2017",
        "time": "03:00:00",
        "customtime": "3:00:AM",
        "crime": "ANTI-CARNAPPING ACT (R.A. 6539) MC",
        "location": "Barangay 167, Kalookan City, Ncr District 3 (Northern), NCR",
        "region": "130000000",
        "province": "137500000",
        "modus": "Swpu (Stolen While Parked)",
        "crimetype": "366",
        "station": "Police Station 01 Caloocan City",
        "moduscode": "mc86",
        "date_com": "2017-05-13",
        "datechar": "5/13/2017"
    },
    {
        "lng": "121.074",
        "lat": "14.7466",
        "date": "2017-05-14",
        "customdate": "Sun - May 14, 2017",
        "time": "17:00:00",
        "customtime": "5:00:PM",
        "crime": "ANTI-CARNAPPING ACT (R.A. 6539) MC",
        "location": "Barangay 179, Kalookan City, Ncr District 3 (Northern), NCR",
        "region": "130000000",
        "province": "137500000",
        "modus": "Swpu (Stolen While Parked)",
        "crimetype": "366",
        "station": "Police Station 01 Caloocan City",
        "moduscode": "mc86",
        "date_com": "2017-05-14",
        "datechar": "5/14/2017"
    },
    {
        "lng": "121.048",
        "lat": "14.7758",
        "date": "2017-05-15",
        "customdate": "Mon - May 15, 2017",
        "time": "00:30:00",
        "customtime": "12:30:AM",
        "crime": "ANTI-CARNAPPING ACT (R.A. 6539) MC",
        "location": "Barangay 176, Kalookan City, Ncr District 3 (Northern), NCR",
        "region": "130000000",
        "province": "137500000",
        "modus": "Swpu (Stolen While Parked)",
        "crimetype": "366",
        "station": "Police Station 01 Caloocan City",
        "moduscode": "mc86",
        "date_com": "2017-05-15",
        "datechar": "5/15/2017"
    },
    {
        "lng": "120.949",
        "lat": "14.6524",
        "date": "2017-05-16",
        "customdate": "Tue - May 16, 2017",
        "time": "11:00:00",
        "customtime": "11:00:AM",
        "crime": "ANTI-CARNAPPING ACT (R.A. 6539) MC",
        "location": "Bagumbayan North, Navotas, Ncr District 3 (Northern), NCR",
        "region": "130000000",
        "province": "137500000",
        "modus": "Swpu (Stolen While Parked)",
        "crimetype": "366",
        "station": "Police Station 03 Navotas",
        "moduscode": "mc86",
        "date_com": "2017-05-16",
        "datechar": "5/16/2017"
    },
    {
        "lng": "121.06",
        "lat": "14.7473",
        "date": "2017-05-17",
        "customdate": "Wed - May 17, 2017",
        "time": "19:30:00",
        "customtime": "7:30:PM",
        "crime": "ANTI-CARNAPPING ACT (R.A. 6539) MV",
        "location": "Barangay 177, Kalookan City, Ncr District 3 (Northern), NCR",
        "region": "130000000",
        "province": "137500000",
        "modus": "Forcibly Taken",
        "crimetype": "27",
        "station": "Police Station 01 Caloocan City",
        "moduscode": "mc83",
        "date_com": "2017-05-17",
        "datechar": "5/17/2017"
    },
    {
        "lng": "120.981",
        "lat": "14.6591",
        "date": "2017-05-19",
        "customdate": "Fri - May 19, 2017",
        "time": "07:00:00",
        "customtime": "7:00:AM",
        "crime": "ANTI-CARNAPPING ACT (R.A. 6539) MC",
        "location": "Potrero, Malabon City, Ncr District 3 (Northern), NCR",
        "region": "130000000",
        "province": "137500000",
        "modus": "Swpu (Stolen While Parked)",
        "crimetype": "366",
        "station": "Police Station 02 Malabon City",
        "moduscode": "mc86",
        "date_com": "2017-05-19",
        "datechar": "5/19/2017"
    },
    {
        "lng": "121.06",
        "lat": "14.7444",
        "date": "2017-05-19",
        "customdate": "Fri - May 19, 2017",
        "time": "05:30:00",
        "customtime": "5:30:AM",
        "crime": "ANTI-CARNAPPING ACT (R.A. 6539) MC",
        "location": "Barangay 177, Kalookan City, Ncr District 3 (Northern), NCR",
        "region": "130000000",
        "province": "137500000",
        "modus": "Swpu (Stolen While Parked)",
        "crimetype": "366",
        "station": "Police Station 01 Caloocan City",
        "moduscode": "mc86",
        "date_com": "2017-05-19",
        "datechar": "5/19/2017"
    },
    {
        "lng": "121.057",
        "lat": "14.757",
        "date": "2017-05-19",
        "customdate": "Fri - May 19, 2017",
        "time": "06:00:00",
        "customtime": "6:00:AM",
        "crime": "ANTI-CARNAPPING ACT (R.A. 6539) MC",
        "location": "Barangay 178, Kalookan City, Ncr District 3 (Northern), NCR",
        "region": "130000000",
        "province": "137500000",
        "modus": "Swpu (Stolen While Parked)",
        "crimetype": "366",
        "station": "Police Station 01 Caloocan City",
        "moduscode": "mc86",
        "date_com": "2017-05-19",
        "datechar": "5/19/2017"
    },
    {
        "lng": "121.019",
        "lat": "14.6952",
        "date": "2017-05-21",
        "customdate": "Sun - May 21, 2017",
        "time": "21:00:00",
        "customtime": "9:00:PM",
        "crime": "ANTI-CARNAPPING ACT (R.A. 6539) MC",
        "location": "Ugong, Valenzuela City, Ncr District 3 (Northern), NCR",
        "region": "130000000",
        "province": "137500000",
        "modus": "Swpu (Stolen While Parked)",
        "crimetype": "366",
        "station": "Police Station 04 Valenzuela City",
        "moduscode": "mc86",
        "date_com": "2017-05-21",
        "datechar": "5/21/2017"
    },
    {
        "lng": "121.022",
        "lat": "14.7423",
        "date": "2017-05-22",
        "customdate": "Mon - May 22, 2017",
        "time": "04:00:00",
        "customtime": "4:00:AM",
        "crime": "ANTI-CARNAPPING ACT (R.A. 6539) MC",
        "location": "Barangay 168, Kalookan City, Ncr District 3 (Northern), NCR",
        "region": "130000000",
        "province": "137500000",
        "modus": "Swpu (Stolen While Parked)",
        "crimetype": "366",
        "station": "Police Station 01 Caloocan City",
        "moduscode": "mc86",
        "date_com": "2017-05-22",
        "datechar": "5/22/2017"
    },
    {
        "lng": "121.006",
        "lat": "14.7175",
        "date": "2017-05-22",
        "customdate": "Mon - May 22, 2017",
        "time": "20:30:00",
        "customtime": "8:30:PM",
        "crime": "ANTI-CARNAPPING ACT (R.A. 6539) MC",
        "location": "Barangay 165, Kalookan City, Ncr District 3 (Northern), NCR",
        "region": "130000000",
        "province": "137500000",
        "modus": "Swpu (Stolen While Parked)",
        "crimetype": "366",
        "station": "Police Station 01 Caloocan City",
        "moduscode": "mc86",
        "date_com": "2017-05-22",
        "datechar": "5/22/2017"
    },
    {
        "lng": "120.962",
        "lat": "14.6533",
        "date": "2017-05-24",
        "customdate": "Wed - May 24, 2017",
        "time": "06:00:00",
        "customtime": "6:00:AM",
        "crime": "ANTI-CARNAPPING ACT (R.A. 6539) MC",
        "location": "Longos, Malabon City, Ncr District 3 (Northern), NCR",
        "region": "130000000",
        "province": "137500000",
        "modus": "Swpu (Stolen While Parked)",
        "crimetype": "366",
        "station": "Police Station 02 Malabon City",
        "moduscode": "mc86",
        "date_com": "2017-05-24",
        "datechar": "5/24/2017"
    },
    {
        "lng": "120.997",
        "lat": "14.6896",
        "date": "2017-05-24",
        "customdate": "Wed - May 24, 2017",
        "time": "19:30:00",
        "customtime": "7:30:PM",
        "crime": "ANTI-CARNAPPING ACT (R.A. 6539) MC",
        "location": "Hen. T. De Leon, Valenzuela City, Ncr District 3 (Northern), NCR",
        "region": "130000000",
        "province": "137500000",
        "modus": "Forcibly Taken",
        "crimetype": "366",
        "station": "Police Station 04 Valenzuela City",
        "moduscode": "mc87",
        "date_com": "2017-05-24",
        "datechar": "5/24/2017"
    },
    {
        "lng": "120.99",
        "lat": "14.6568",
        "date": "2017-05-29",
        "customdate": "Mon - May 29, 2017",
        "time": "12:00:00",
        "customtime": "12:00:PM",
        "crime": "ANTI-CARNAPPING ACT (R.A. 6539) MV",
        "location": "Barangay 87, Kalookan City, Ncr District 3 (Northern), NCR",
        "region": "130000000",
        "province": "137500000",
        "modus": "Ftr (Failed to Return)",
        "crimetype": "27",
        "station": "Police Station 01 Caloocan City",
        "moduscode": "mc77",
        "date_com": "2017-05-29",
        "datechar": "5/29/2017"
    },
    {
        "lng": "121.019",
        "lat": "14.6949",
        "date": "2017-05-30",
        "customdate": "Tue - May 30, 2017",
        "time": "05:00:00",
        "customtime": "5:00:AM",
        "crime": "ANTI-CARNAPPING ACT (R.A. 6539) MC",
        "location": "Ugong, Valenzuela City, Ncr District 3 (Northern), NCR",
        "region": "130000000",
        "province": "137500000",
        "modus": "Ftr (Failed to Return)",
        "crimetype": "366",
        "station": "Police Station 04 Valenzuela City",
        "moduscode": "mc84",
        "date_com": "2017-05-30",
        "datechar": "5/30/2017"
    },
    {
        "lng": "121.016",
        "lat": "14.7303",
        "date": "2017-05-31",
        "customdate": "Wed - May 31, 2017",
        "time": "04:00:00",
        "customtime": "4:00:AM",
        "crime": "ANTI-CARNAPPING ACT (R.A. 6539) MC",
        "location": "Barangay 167, Kalookan City, Ncr District 3 (Northern), NCR",
        "region": "130000000",
        "province": "137500000",
        "modus": "Swpu (Stolen While Parked)",
        "crimetype": "366",
        "station": "Police Station 01 Caloocan City",
        "moduscode": "mc86",
        "date_com": "2017-05-31",
        "datechar": "5/31/2017"
    },
    {
        "lng": "121.011",
        "lat": "14.6901",
        "date": "2017-06-01",
        "customdate": "Thu - Jun 1, 2017",
        "time": "11:00:00",
        "customtime": "11:00:AM",
        "crime": "ANTI-CARNAPPING ACT (R.A. 6539) MC",
        "location": "Barangay 164, Kalookan City, Ncr District 3 (Northern), NCR",
        "region": "130000000",
        "province": "137500000",
        "modus": "Swpu (Stolen While Parked)",
        "crimetype": "366",
        "station": "Police Station 01 Caloocan City",
        "moduscode": "mc86",
        "date_com": "2017-06-01",
        "datechar": "6/1/2017"
    },
    {
        "lng": "121",
        "lat": "14.6656",
        "date": "2017-06-01",
        "customdate": "Thu - Jun 1, 2017",
        "time": "03:00:00",
        "customtime": "3:00:AM",
        "crime": "ANTI-CARNAPPING ACT (R.A. 6539) MV",
        "location": "Barangay 139, Kalookan City, Ncr District 3 (Northern), NCR",
        "region": "130000000",
        "province": "137500000",
        "modus": "Swpu ( Stolen While Parked)",
        "crimetype": "27",
        "station": "Police Station 01 Caloocan City",
        "moduscode": "mc79",
        "date_com": "2017-06-01",
        "datechar": "6/1/2017"
    },
    {
        "lng": "120.971",
        "lat": "14.6393",
        "date": "2017-06-03",
        "customdate": "Sat - Jun 3, 2017",
        "time": "00:30:00",
        "customtime": "12:30:AM",
        "crime": "ANTI-CARNAPPING ACT (R.A. 6539) MC",
        "location": "Barangay 35, Kalookan City, Ncr District 3 (Northern), NCR",
        "region": "130000000",
        "province": "137500000",
        "modus": "Swpu (Stolen While Parked)",
        "crimetype": "366",
        "station": "Police Station 01 Caloocan City",
        "moduscode": "mc86",
        "date_com": "2017-06-03",
        "datechar": "6/3/2017"
    },
    {
        "lng": "121.066",
        "lat": "14.7519",
        "date": "2017-06-07",
        "customdate": "Wed - Jun 7, 2017",
        "time": "15:30:00",
        "customtime": "3:30:PM",
        "crime": "ANTI-CARNAPPING ACT (R.A. 6539) MC",
        "location": "Barangay 178, Kalookan City, Ncr District 3 (Northern), NCR",
        "region": "130000000",
        "province": "137500000",
        "modus": "Swpu (Stolen While Parked)",
        "crimetype": "366",
        "station": "Police Station 01 Caloocan City",
        "moduscode": "mc86",
        "date_com": "2017-06-07",
        "datechar": "6/7/2017"
    },
    {
        "lng": "121.014",
        "lat": "14.7225",
        "date": "2017-06-09",
        "customdate": "Fri - Jun 9, 2017",
        "time": "02:30:00",
        "customtime": "2:30:AM",
        "crime": "ANTI-CARNAPPING ACT (R.A. 6539) MC",
        "location": "Barangay 166, Kalookan City, Ncr District 3 (Northern), NCR",
        "region": "130000000",
        "province": "137500000",
        "modus": "Swpu (Stolen While Parked)",
        "crimetype": "366",
        "station": "Police Station 01 Caloocan City",
        "moduscode": "mc86",
        "date_com": "2017-06-09",
        "datechar": "6/9/2017"
    },
    {
        "lng": "120.982",
        "lat": "14.6537",
        "date": "2017-06-10",
        "customdate": "Sat - Jun 10, 2017",
        "time": "03:39:00",
        "customtime": "3:39:AM",
        "crime": "ANTI-CARNAPPING ACT (R.A. 6539) MC",
        "location": "Barangay 67, Kalookan City, Ncr District 3 (Northern), NCR",
        "region": "130000000",
        "province": "137500000",
        "modus": "Swpu (Stolen While Parked)",
        "crimetype": "366",
        "station": "Police Station 01 Caloocan City",
        "moduscode": "mc86",
        "date_com": "2017-06-10",
        "datechar": "6/10/2017"
    },
    {
        "lng": "120.994",
        "lat": "14.6485",
        "date": "2017-06-11",
        "customdate": "Sun - Jun 11, 2017",
        "time": "17:00:00",
        "customtime": "5:00:PM",
        "crime": "ANTI-CARNAPPING ACT (R.A. 6539) MC",
        "location": "Barangay 102, Kalookan City, Ncr District 3 (Northern), NCR",
        "region": "130000000",
        "province": "137500000",
        "modus": "Swpu (Stolen While Parked)",
        "crimetype": "366",
        "station": "Police Station 01 Caloocan City",
        "moduscode": "mc86",
        "date_com": "2017-06-11",
        "datechar": "6/11/2017"
    },
    {
        "lng": "121.016",
        "lat": "14.7517",
        "date": "2017-06-14",
        "customdate": "Wed - Jun 14, 2017",
        "time": "02:00:00",
        "customtime": "2:00:AM",
        "crime": "ANTI-CARNAPPING ACT (R.A. 6539) MC",
        "location": "Barangay 171, Kalookan City, Ncr District 3 (Northern), NCR",
        "region": "130000000",
        "province": "137500000",
        "modus": "Swpu (Stolen While Parked)",
        "crimetype": "366",
        "station": "Police Station 01 Caloocan City",
        "moduscode": "mc86",
        "date_com": "2017-06-14",
        "datechar": "6/14/2017"
    },
    {
        "lng": "121.018",
        "lat": "14.696",
        "date": "2017-06-14",
        "customdate": "Wed - Jun 14, 2017",
        "time": "16:30:00",
        "customtime": "4:30:PM",
        "crime": "ANTI-CARNAPPING ACT (R.A. 6539) MC",
        "location": "Ugong, Valenzuela City, Ncr District 3 (Northern), NCR",
        "region": "130000000",
        "province": "137500000",
        "modus": "Ftr (Failed to Return)",
        "crimetype": "366",
        "station": "Police Station 04 Valenzuela City",
        "moduscode": "mc84",
        "date_com": "2017-06-14",
        "datechar": "6/14/2017"
    },
    {
        "lng": "120.991",
        "lat": "14.6531",
        "date": "2017-06-17",
        "customdate": "Sat - Jun 17, 2017",
        "time": "22:00:00",
        "customtime": "10:00:PM",
        "crime": "ANTI-CARNAPPING ACT (R.A. 6539) MC",
        "location": "Barangay 92, Kalookan City, Ncr District 3 (Northern), NCR",
        "region": "130000000",
        "province": "137500000",
        "modus": "Forcibly Taken",
        "crimetype": "366",
        "station": "Police Station 01 Caloocan City",
        "moduscode": "mc87",
        "date_com": "2017-06-17",
        "datechar": "6/17/2017"
    },
    {
        "lng": "120.986",
        "lat": "14.6415",
        "date": "2017-06-20",
        "customdate": "Tue - Jun 20, 2017",
        "time": "20:30:00",
        "customtime": "8:30:PM",
        "crime": "ANTI-CARNAPPING ACT (R.A. 6539) MC",
        "location": "Barangay 118, Kalookan City, Ncr District 3 (Northern), NCR",
        "region": "130000000",
        "province": "137500000",
        "modus": "Forcibly Taken",
        "crimetype": "366",
        "station": "Police Station 01 Caloocan City",
        "moduscode": "mc87",
        "date_com": "2017-06-20",
        "datechar": "6/20/2017"
    },
    {
        "lng": "120.968",
        "lat": "14.6643",
        "date": "2017-06-22",
        "customdate": "Thu - Jun 22, 2017",
        "time": "01:30:00",
        "customtime": "1:30:AM",
        "crime": "ANTI-CARNAPPING ACT (R.A. 6539) MC",
        "location": "Tugatog, Malabon City, Ncr District 3 (Northern), NCR",
        "region": "130000000",
        "province": "137500000",
        "modus": "Forcibly Taken",
        "crimetype": "366",
        "station": "Police Station 02 Malabon City",
        "moduscode": "mc87",
        "date_com": "2017-06-22",
        "datechar": "6/22/2017"
    },
    {
        "lng": "120.992",
        "lat": "14.6528",
        "date": "2017-06-23",
        "customdate": "Fri - Jun 23, 2017",
        "time": "22:00:00",
        "customtime": "10:00:PM",
        "crime": "ANTI-CARNAPPING ACT (R.A. 6539) MC",
        "location": "Barangay 94, Kalookan City, Ncr District 3 (Northern), NCR",
        "region": "130000000",
        "province": "137500000",
        "modus": "Forcibly Taken",
        "crimetype": "366",
        "station": "Police Station 01 Caloocan City",
        "moduscode": "mc87",
        "date_com": "2017-06-23",
        "datechar": "6/23/2017"
    },
    {
        "lng": "120.957",
        "lat": "14.6401",
        "date": "2017-06-23",
        "customdate": "Fri - Jun 23, 2017",
        "time": "10:30:00",
        "customtime": "10:30:AM",
        "crime": "ANTI-CARNAPPING ACT (R.A. 6539) MC",
        "location": "North Bay Blvd., South, Navotas, Ncr District 3 (Northern), NCR",
        "region": "130000000",
        "province": "137500000",
        "modus": "Swpu (Stolen While Parked)",
        "crimetype": "366",
        "station": "Police Station 03 Navotas",
        "moduscode": "mc86",
        "date_com": "2017-06-23",
        "datechar": "6/23/2017"
    },
    {
        "lng": "121.011",
        "lat": "14.751",
        "date": "2017-06-24",
        "customdate": "Sat - Jun 24, 2017",
        "time": "07:00:00",
        "customtime": "7:00:AM",
        "crime": "ANTI-CARNAPPING ACT (R.A. 6539) MC",
        "location": "Barangay 171, Kalookan City, Ncr District 3 (Northern), NCR",
        "region": "130000000",
        "province": "137500000",
        "modus": "Swpu (Stolen While Parked)",
        "crimetype": "366",
        "station": "Police Station 01 Caloocan City",
        "moduscode": "mc86",
        "date_com": "2017-06-24",
        "datechar": "6/24/2017"
    },
    {
        "lng": "120.995",
        "lat": "14.6678",
        "date": "2017-06-26",
        "customdate": "Mon - Jun 26, 2017",
        "time": "04:00:00",
        "customtime": "4:00:AM",
        "crime": "ANTI-CARNAPPING ACT (R.A. 6539) MC",
        "location": "Barangay 149, Kalookan City, Ncr District 3 (Northern), NCR",
        "region": "130000000",
        "province": "137500000",
        "modus": "Swpu (Stolen While Parked)",
        "crimetype": "366",
        "station": "Police Station 01 Caloocan City",
        "moduscode": "mc86",
        "date_com": "2017-06-26",
        "datechar": "6/26/2017"
    },
    {
        "lng": "120.954",
        "lat": "14.6444",
        "date": "2017-06-27",
        "customdate": "Tue - Jun 27, 2017",
        "time": "05:00:00",
        "customtime": "5:00:AM",
        "crime": "ANTI-CARNAPPING ACT (R.A. 6539) MC",
        "location": "North Bay Blvd., North, Navotas, Ncr District 3 (Northern), NCR",
        "region": "130000000",
        "province": "137500000",
        "modus": "Swpu (Stolen While Parked)",
        "crimetype": "366",
        "station": "Police Station 03 Navotas",
        "moduscode": "mc86",
        "date_com": "2017-06-27",
        "datechar": "6/27/2017"
    },
    {
        "lng": "120.982",
        "lat": "14.6565",
        "date": "2017-06-28",
        "customdate": "Wed - Jun 28, 2017",
        "time": "19:40:00",
        "customtime": "7:40:PM",
        "crime": "ANTI-CARNAPPING ACT (R.A. 6539) MC",
        "location": "Barangay 76, Kalookan City, Ncr District 3 (Northern), NCR",
        "region": "130000000",
        "province": "137500000",
        "modus": "Swpu (Stolen While Parked)",
        "crimetype": "366",
        "station": "Police Station 01 Caloocan City",
        "moduscode": "mc86",
        "date_com": "2017-06-28",
        "datechar": "6/28/2017"
    },
    {
        "lng": "120.973",
        "lat": "14.6901",
        "date": "2017-07-02",
        "customdate": "Sun - Jul 2, 2017",
        "time": "00:00:00",
        "customtime": "12:00:AM",
        "crime": "ANTI-CARNAPPING ACT (R.A. 6539) MC",
        "location": "Ugong, Valenzuela City, Ncr District 3 (Northern), NCR",
        "region": "130000000",
        "province": "137500000",
        "modus": "Forcibly Taken",
        "crimetype": "366",
        "station": "Police Station 04 Valenzuela City",
        "moduscode": "mc87",
        "date_com": "2017-07-02",
        "datechar": "7/2/2017"
    },
    {
        "lng": "120.981",
        "lat": "14.6485",
        "date": "2017-07-02",
        "customdate": "Sun - Jul 2, 2017",
        "time": "01:00:00",
        "customtime": "1:00:AM",
        "crime": "ANTI-CARNAPPING ACT (R.A. 6539) MV",
        "location": "Barangay 61, Kalookan City, Ncr District 3 (Northern), NCR",
        "region": "130000000",
        "province": "137500000",
        "modus": "Ftr (Failed to Return)",
        "crimetype": "27",
        "station": "Police Station 01 Caloocan City",
        "moduscode": "mc77",
        "date_com": "2017-07-02",
        "datechar": "7/2/2017"
    },
    {
        "lng": "120.996",
        "lat": "14.7108",
        "date": "2017-07-04",
        "customdate": "Tue - Jul 4, 2017",
        "time": "04:30:00",
        "customtime": "4:30:AM",
        "crime": "ANTI-CARNAPPING ACT (R.A. 6539) MC",
        "location": "Canumay, Valenzuela City, Ncr District 3 (Northern), NCR",
        "region": "130000000",
        "province": "137500000",
        "modus": "Swpu (Stolen While Parked)",
        "crimetype": "366",
        "station": "Police Station 04 Valenzuela City",
        "moduscode": "mc86",
        "date_com": "2017-07-04",
        "datechar": "7/4/2017"
    },
    {
        "lng": "121.013",
        "lat": "14.7194",
        "date": "2017-07-07",
        "customdate": "Fri - Jul 7, 2017",
        "time": "06:30:00",
        "customtime": "6:30:AM",
        "crime": "ANTI-CARNAPPING ACT (R.A. 6539) MC",
        "location": "Barangay 166, Kalookan City, Ncr District 3 (Northern), NCR",
        "region": "130000000",
        "province": "137500000",
        "modus": "Swpu (Stolen While Parked)",
        "crimetype": "366",
        "station": "Police Station 01 Caloocan City",
        "moduscode": "mc86",
        "date_com": "2017-07-07",
        "datechar": "7/7/2017"
    },
    {
        "lng": "120.965",
        "lat": "14.6509",
        "date": "2017-07-07",
        "customdate": "Fri - Jul 7, 2017",
        "time": "18:30:00",
        "customtime": "6:30:PM",
        "crime": "ANTI-CARNAPPING ACT (R.A. 6539) MC",
        "location": "Barangay 14, Kalookan City, Ncr District 3 (Northern), NCR",
        "region": "130000000",
        "province": "137500000",
        "modus": "Swpu (Stolen While Parked)",
        "crimetype": "366",
        "station": "Police Station 01 Caloocan City",
        "moduscode": "mc86",
        "date_com": "2017-07-07",
        "datechar": "7/7/2017"
    },
    {
        "lng": "120.98",
        "lat": "14.6512",
        "date": "2017-07-09",
        "customdate": "Sun - Jul 9, 2017",
        "time": "23:20:00",
        "customtime": "11:20:PM",
        "crime": "ANTI-CARNAPPING ACT (R.A. 6539) MC",
        "location": "Barangay 60, Kalookan City, Ncr District 3 (Northern), NCR",
        "region": "130000000",
        "province": "137500000",
        "modus": "Forcibly Taken",
        "crimetype": "366",
        "station": "Police Station 01 Caloocan City",
        "moduscode": "mc87",
        "date_com": "2017-07-09",
        "datechar": "7/9/2017"
    },
    {
        "lng": "121.011",
        "lat": "14.7292",
        "date": "2017-07-11",
        "customdate": "Tue - Jul 11, 2017",
        "time": "05:30:00",
        "customtime": "5:30:AM",
        "crime": "ANTI-CARNAPPING ACT (R.A. 6539) MC",
        "location": "Barangay 167, Kalookan City, Ncr District 3 (Northern), NCR",
        "region": "130000000",
        "province": "137500000",
        "modus": "Swpu (Stolen While Parked)",
        "crimetype": "366",
        "station": "Police Station 01 Caloocan City",
        "moduscode": "mc86",
        "date_com": "2017-07-11",
        "datechar": "7/11/2017"
    },
    {
        "lng": "121.008",
        "lat": "14.6821",
        "date": "2017-07-11",
        "customdate": "Tue - Jul 11, 2017",
        "time": "02:50:00",
        "customtime": "2:50:AM",
        "crime": "ANTI-CARNAPPING ACT (R.A. 6539) MC",
        "location": "Barangay 163, Kalookan City, Ncr District 3 (Northern), NCR",
        "region": "130000000",
        "province": "137500000",
        "modus": "Swpu (Stolen While Parked)",
        "crimetype": "366",
        "station": "Police Station 01 Caloocan City",
        "moduscode": "mc86",
        "date_com": "2017-07-11",
        "datechar": "7/11/2017"
    },
    {
        "lng": "120.993",
        "lat": "14.6637",
        "date": "2017-07-11",
        "customdate": "Tue - Jul 11, 2017",
        "time": "23:00:00",
        "customtime": "11:00:PM",
        "crime": "ANTI-CARNAPPING ACT (R.A. 6539) MC",
        "location": "Barangay 142, Kalookan City, Ncr District 3 (Northern), NCR",
        "region": "130000000",
        "province": "137500000",
        "modus": "Swpu (Stolen While Parked)",
        "crimetype": "366",
        "station": "Police Station 01 Caloocan City",
        "moduscode": "mc86",
        "date_com": "2017-07-11",
        "datechar": "7/11/2017"
    },
    {
        "lng": "120.952",
        "lat": "14.6565",
        "date": "2017-07-14",
        "customdate": "Fri - Jul 14, 2017",
        "time": "07:15:00",
        "customtime": "7:15:AM",
        "crime": "ANTI-CARNAPPING ACT (R.A. 6539) MC",
        "location": "Tañong (Pob.), Malabon City, Ncr District 3 (Northern), NCR",
        "region": "130000000",
        "province": "137500000",
        "modus": "Swpu (Stolen While Parked)",
        "crimetype": "366",
        "station": "Police Station 02 Malabon City",
        "moduscode": "mc86",
        "date_com": "2017-07-14",
        "datechar": "7/14/2017"
    },
    {
        "lng": "121.069",
        "lat": "14.7612",
        "date": "2017-07-15",
        "customdate": "Sat - Jul 15, 2017",
        "time": "22:00:00",
        "customtime": "10:00:PM",
        "crime": "ANTI-CARNAPPING ACT (R.A. 6539) MC",
        "location": "Barangay 186, Kalookan City, Ncr District 3 (Northern), NCR",
        "region": "130000000",
        "province": "137500000",
        "modus": "Swpu (Stolen While Parked)",
        "crimetype": "366",
        "station": "Police Station 01 Caloocan City",
        "moduscode": "mc86",
        "date_com": "2017-07-15",
        "datechar": "7/15/2017"
    },
    {
        "lng": "120.992",
        "lat": "14.6428",
        "date": "2017-07-15",
        "customdate": "Sat - Jul 15, 2017",
        "time": "22:30:00",
        "customtime": "10:30:PM",
        "crime": "ANTI-CARNAPPING ACT (R.A. 6539) MC",
        "location": "Barangay 126, Kalookan City, Ncr District 3 (Northern), NCR",
        "region": "130000000",
        "province": "137500000",
        "modus": "Forcibly Taken",
        "crimetype": "366",
        "station": "Police Station 01 Caloocan City",
        "moduscode": "mc87",
        "date_com": "2017-07-15",
        "datechar": "7/15/2017"
    },
    {
        "lng": "120.964",
        "lat": "14.6786",
        "date": "2017-07-16",
        "customdate": "Sun - Jul 16, 2017",
        "time": "05:30:00",
        "customtime": "5:30:AM",
        "crime": "ANTI-CARNAPPING ACT (R.A. 6539) MC",
        "location": "Maysilo, Malabon City, Ncr District 3 (Northern), NCR",
        "region": "130000000",
        "province": "137500000",
        "modus": "Swpu (Stolen While Parked)",
        "crimetype": "366",
        "station": "Police Station 02 Malabon City",
        "moduscode": "mc86",
        "date_com": "2017-07-16",
        "datechar": "7/16/2017"
    },
    {
        "lng": "121.001",
        "lat": "14.6762",
        "date": "2017-07-17",
        "customdate": "Mon - Jul 17, 2017",
        "time": "06:00:00",
        "customtime": "6:00:AM",
        "crime": "ANTI-CARNAPPING ACT (R.A. 6539) MC",
        "location": "Barangay 161, Kalookan City, Ncr District 3 (Northern), NCR",
        "region": "130000000",
        "province": "137500000",
        "modus": "Swpu (Stolen While Parked)",
        "crimetype": "366",
        "station": "Police Station 01 Caloocan City",
        "moduscode": "mc86",
        "date_com": "2017-07-17",
        "datechar": "7/17/2017"
    },
    {
        "lng": "121.016",
        "lat": "14.7518",
        "date": "2017-07-21",
        "customdate": "Fri - Jul 21, 2017",
        "time": "22:50:00",
        "customtime": "10:50:PM",
        "crime": "ANTI-CARNAPPING ACT (R.A. 6539) MC",
        "location": "Barangay 171, Kalookan City, Ncr District 3 (Northern), NCR",
        "region": "130000000",
        "province": "137500000",
        "modus": "Swpu (Stolen While Parked)",
        "crimetype": "366",
        "station": "Police Station 01 Caloocan City",
        "moduscode": "mc86",
        "date_com": "2017-07-21",
        "datechar": "7/21/2017"
    },
    {
        "lng": "120.952",
        "lat": "14.7093",
        "date": "2017-07-21",
        "customdate": "Fri - Jul 21, 2017",
        "time": "05:30:00",
        "customtime": "5:30:AM",
        "crime": "ANTI-CARNAPPING ACT (R.A. 6539) MC",
        "location": "Pasolo, Valenzuela City, Ncr District 3 (Northern), NCR",
        "region": "130000000",
        "province": "137500000",
        "modus": "Swpu (Stolen While Parked)",
        "crimetype": "366",
        "station": "Police Station 04 Valenzuela City",
        "moduscode": "mc86",
        "date_com": "2017-07-21",
        "datechar": "7/21/2017"
    },
    {
        "lng": "121.013",
        "lat": "14.7512",
        "date": "2017-07-23",
        "customdate": "Sun - Jul 23, 2017",
        "time": "05:00:00",
        "customtime": "5:00:AM",
        "crime": "ANTI-CARNAPPING ACT (R.A. 6539) MC",
        "location": "Barangay 171, Kalookan City, Ncr District 3 (Northern), NCR",
        "region": "130000000",
        "province": "137500000",
        "modus": "Swpu (Stolen While Parked)",
        "crimetype": "366",
        "station": "Police Station 01 Caloocan City",
        "moduscode": "mc86",
        "date_com": "2017-07-23",
        "datechar": "7/23/2017"
    },
    {
        "lng": "120.973",
        "lat": "14.6382",
        "date": "2017-07-23",
        "customdate": "Sun - Jul 23, 2017",
        "time": "18:30:00",
        "customtime": "6:30:PM",
        "crime": "ANTI-CARNAPPING ACT (R.A. 6539) MC",
        "location": "Barangay 34, Kalookan City, Ncr District 3 (Northern), NCR",
        "region": "130000000",
        "province": "137500000",
        "modus": "Swpu (Stolen While Parked)",
        "crimetype": "366",
        "station": "Police Station 01 Caloocan City",
        "moduscode": "mc86",
        "date_com": "2017-07-23",
        "datechar": "7/23/2017"
    },
    {
        "lng": "121.075",
        "lat": "14.77",
        "date": "2017-07-24",
        "customdate": "Mon - Jul 24, 2017",
        "time": "04:20:00",
        "customtime": "4:20:AM",
        "crime": "ANTI-CARNAPPING ACT (R.A. 6539) MC",
        "location": "Barangay 185, Kalookan City, Ncr District 3 (Northern), NCR",
        "region": "130000000",
        "province": "137500000",
        "modus": "Swpu (Stolen While Parked)",
        "crimetype": "366",
        "station": "Police Station 01 Caloocan City",
        "moduscode": "mc86",
        "date_com": "2017-07-24",
        "datechar": "7/24/2017"
    },
    {
        "lng": "121.003",
        "lat": "14.7059",
        "date": "2017-07-24",
        "customdate": "Mon - Jul 24, 2017",
        "time": "02:00:00",
        "customtime": "2:00:AM",
        "crime": "ANTI-CARNAPPING ACT (R.A. 6539) MV",
        "location": "Mapulang Lupa, Valenzuela City, Ncr District 3 (Northern), NCR",
        "region": "130000000",
        "province": "137500000",
        "modus": "Ftr (Failed to Return)",
        "crimetype": "27",
        "station": "Police Station 04 Valenzuela City",
        "moduscode": "mc77",
        "date_com": "2017-07-24",
        "datechar": "7/24/2017"
    },
    {
        "lng": "120.948",
        "lat": "14.656",
        "date": "2017-07-25",
        "customdate": "Tue - Jul 25, 2017",
        "time": "23:30:00",
        "customtime": "11:30:PM",
        "crime": "ANTI-CARNAPPING ACT (R.A. 6539) MC",
        "location": "Sipac-Almacen, Navotas, Ncr District 3 (Northern), NCR",
        "region": "130000000",
        "province": "137500000",
        "modus": "Swpu (Stolen While Parked)",
        "crimetype": "366",
        "station": "Police Station 03 Navotas",
        "moduscode": "mc86",
        "date_com": "2017-07-25",
        "datechar": "7/25/2017"
    },
    {
        "lng": "121.077",
        "lat": "14.7672",
        "date": "2017-07-26",
        "customdate": "Wed - Jul 26, 2017",
        "time": "06:00:00",
        "customtime": "6:00:AM",
        "crime": "ANTI-CARNAPPING ACT (R.A. 6539) MC",
        "location": "Barangay 185, Kalookan City, Ncr District 3 (Northern), NCR",
        "region": "130000000",
        "province": "137500000",
        "modus": "Swpu (Stolen While Parked)",
        "crimetype": "366",
        "station": "Police Station 01 Caloocan City",
        "moduscode": "mc86",
        "date_com": "2017-07-26",
        "datechar": "7/26/2017"
    },
    {
        "lng": "121.071",
        "lat": "14.7506",
        "date": "2017-07-27",
        "customdate": "Thu - Jul 27, 2017",
        "time": "00:20:00",
        "customtime": "12:20:AM",
        "crime": "ANTI-CARNAPPING ACT (R.A. 6539) MC",
        "location": "Barangay 179, Kalookan City, Ncr District 3 (Northern), NCR",
        "region": "130000000",
        "province": "137500000",
        "modus": "Forcibly Taken",
        "crimetype": "366",
        "station": "Police Station 01 Caloocan City",
        "moduscode": "mc87",
        "date_com": "2017-07-27",
        "datechar": "7/27/2017"
    },
    {
        "lng": "120.96",
        "lat": "14.6542",
        "date": "2017-08-01",
        "customdate": "Tue - Aug 1, 2017",
        "time": "06:00:00",
        "customtime": "6:00:AM",
        "crime": "ANTI-CARNAPPING ACT (R.A. 6539) MC",
        "location": "Longos, Malabon City, Ncr District 3 (Northern), NCR",
        "region": "130000000",
        "province": "137500000",
        "modus": "Swpu (Stolen While Parked)",
        "crimetype": "366",
        "station": "Police Station 02 Malabon City",
        "moduscode": "mc86",
        "date_com": "2017-08-01",
        "datechar": "08/01/2017"
    },
    {
        "lng": "121.079",
        "lat": "14.7608",
        "date": "2017-08-01",
        "customdate": "Tue - Aug 1, 2017",
        "time": "05:45:00",
        "customtime": "5:45:AM",
        "crime": "ANTI-CARNAPPING ACT (R.A. 6539) MC",
        "location": "Barangay 180, Kalookan City, Ncr District 3 (Northern), NCR",
        "region": "130000000",
        "province": "137500000",
        "modus": "Swpu (Stolen While Parked)",
        "crimetype": "366",
        "station": "Police Station 01 Caloocan City",
        "moduscode": "mc86",
        "date_com": "2017-08-01",
        "datechar": "08/01/2017"
    },
    {
        "lng": "120.984",
        "lat": "14.6413",
        "date": "2017-08-04",
        "customdate": "Fri - Aug 4, 2017",
        "time": "12:00:00",
        "customtime": "12:00:PM",
        "crime": "ANTI-CARNAPPING ACT (R.A. 6539) MC",
        "location": "Barangay 120, Kalookan City, Ncr District 3 (Northern), NCR",
        "region": "130000000",
        "province": "137500000",
        "modus": "Swpu (Stolen While Parked)",
        "crimetype": "366",
        "station": "Police Station 01 Caloocan City",
        "moduscode": "mc86",
        "date_com": "2017-08-04",
        "datechar": "08/04/2017"
    },
    {
        "lng": "120.983",
        "lat": "14.6561",
        "date": "2017-08-05",
        "customdate": "Sat - Aug 5, 2017",
        "time": "18:30:00",
        "customtime": "6:30:PM",
        "crime": "ANTI-CARNAPPING ACT (R.A. 6539) MC",
        "location": "Barangay 86, Kalookan City, Ncr District 3 (Northern), NCR",
        "region": "130000000",
        "province": "137500000",
        "modus": "Swpu (Stolen While Parked)",
        "crimetype": "366",
        "station": "Police Station 01 Caloocan City",
        "moduscode": "mc86",
        "date_com": "2017-08-05",
        "datechar": "08/05/2017"
    },
    {
        "lng": "120.978",
        "lat": "14.6518",
        "date": "2017-08-07",
        "customdate": "Mon - Aug 7, 2017",
        "time": "00:30:00",
        "customtime": "12:30:AM",
        "crime": "ANTI-CARNAPPING ACT (R.A. 6539) MC",
        "location": "Barangay 60, Kalookan City, Ncr District 3 (Northern), NCR",
        "region": "130000000",
        "province": "137500000",
        "modus": "Forcibly Taken",
        "crimetype": "366",
        "station": "Police Station 01 Caloocan City",
        "moduscode": "mc87",
        "date_com": "2017-08-07",
        "datechar": "08/07/2017"
    },
    {
        "lng": "121.022",
        "lat": "14.6864",
        "date": "2017-08-07",
        "customdate": "Mon - Aug 7, 2017",
        "time": "10:00:00",
        "customtime": "10:00:AM",
        "crime": "ANTI-CARNAPPING ACT (R.A. 6539) MC",
        "location": "Barangay 164, Kalookan City, Ncr District 3 (Northern), NCR",
        "region": "130000000",
        "province": "137500000",
        "modus": "Swpu (Stolen While Parked)",
        "crimetype": "366",
        "station": "Police Station 01 Caloocan City",
        "moduscode": "mc86",
        "date_com": "2017-08-07",
        "datechar": "08/07/2017"
    },
    {
        "lng": "121.043",
        "lat": "14.7671",
        "date": "2017-08-07",
        "customdate": "Mon - Aug 7, 2017",
        "time": "02:00:00",
        "customtime": "2:00:AM",
        "crime": "ANTI-CARNAPPING ACT (R.A. 6539) MC",
        "location": "Barangay 175, Kalookan City, Ncr District 3 (Northern), NCR",
        "region": "130000000",
        "province": "137500000",
        "modus": "Swpu (Stolen While Parked)",
        "crimetype": "366",
        "station": "Police Station 01 Caloocan City",
        "moduscode": "mc86",
        "date_com": "2017-08-07",
        "datechar": "08/07/2017"
    },
    {
        "lng": "120.995",
        "lat": "14.6861",
        "date": "2017-08-07",
        "customdate": "Mon - Aug 7, 2017",
        "time": "08:00:00",
        "customtime": "8:00:AM",
        "crime": "ANTI-CARNAPPING ACT (R.A. 6539) MV",
        "location": "Hen. T. De Leon, Valenzuela City, Ncr District 3 (Northern), NCR",
        "region": "130000000",
        "province": "137500000",
        "modus": "Ftr (Failed to Return)",
        "crimetype": "27",
        "station": "Police Station 04 Valenzuela City",
        "moduscode": "mc77",
        "date_com": "2017-08-07",
        "datechar": "08/07/2017"
    },
    {
        "lng": "120.995",
        "lat": "14.6861",
        "date": "2017-08-07",
        "customdate": "Mon - Aug 7, 2017",
        "time": "08:00:00",
        "customtime": "8:00:AM",
        "crime": "ANTI-CARNAPPING ACT (R.A. 6539) MV",
        "location": "Hen. T. De Leon, Valenzuela City, Ncr District 3 (Northern), NCR",
        "region": "130000000",
        "province": "137500000",
        "modus": "Qualified Theft",
        "crimetype": "27",
        "station": "Police Station 04 Valenzuela City",
        "moduscode": "mc66",
        "date_com": "2017-08-07",
        "datechar": "08/07/2017"
    },
    {
        "lng": "120.964",
        "lat": "14.6781",
        "date": "2017-08-09",
        "customdate": "Wed - Aug 9, 2017",
        "time": "08:00:00",
        "customtime": "8:00:AM",
        "crime": "ANTI-CARNAPPING ACT (R.A. 6539) MC",
        "location": "Maysilo, Malabon City, Ncr District 3 (Northern), NCR",
        "region": "130000000",
        "province": "137500000",
        "modus": "Swpu (Stolen While Parked)",
        "crimetype": "366",
        "station": "Police Station 02 Malabon City",
        "moduscode": "mc86",
        "date_com": "2017-08-09",
        "datechar": "08/09/2017"
    },
    {
        "lng": "120.966",
        "lat": "14.6676",
        "date": "2017-08-11",
        "customdate": "Fri - Aug 11, 2017",
        "time": "15:45:00",
        "customtime": "3:45:PM",
        "crime": "ANTI-CARNAPPING ACT (R.A. 6539) MC",
        "location": "Tinajeros, Malabon City, Ncr District 3 (Northern), NCR",
        "region": "130000000",
        "province": "137500000",
        "modus": "Swpu (Stolen While Parked)",
        "crimetype": "366",
        "station": "Police Station 02 Malabon City",
        "moduscode": "mc86",
        "date_com": "2017-08-11",
        "datechar": "08/11/2017"
    },
    {
        "lng": "120.99",
        "lat": "14.6652",
        "date": "2017-08-15",
        "customdate": "Tue - Aug 15, 2017",
        "time": "16:00:00",
        "customtime": "4:00:PM",
        "crime": "ANTI-CARNAPPING ACT (R.A. 6539) MV",
        "location": "Potrero, Malabon City, Ncr District 3 (Northern), NCR",
        "region": "130000000",
        "province": "137500000",
        "modus": "Ftr (Failed to Return)",
        "crimetype": "27",
        "station": "Police Station 02 Malabon City",
        "moduscode": "mc77",
        "date_com": "2017-08-15",
        "datechar": "08/15/2017"
    },
    {
        "lng": "121.067",
        "lat": "14.7659",
        "date": "2017-08-16",
        "customdate": "Wed - Aug 16, 2017",
        "time": "10:30:00",
        "customtime": "10:30:AM",
        "crime": "ANTI-CARNAPPING ACT (R.A. 6539) MC",
        "location": "Barangay 186, Kalookan City, Ncr District 3 (Northern), NCR",
        "region": "130000000",
        "province": "137500000",
        "modus": "Swpu (Stolen While Parked)",
        "crimetype": "366",
        "station": "Police Station 01 Caloocan City",
        "moduscode": "mc86",
        "date_com": "2017-08-16",
        "datechar": "08/16/2017"
    },
    {
        "lng": "121.045",
        "lat": "14.7752",
        "date": "2017-08-20",
        "customdate": "Sun - Aug 20, 2017",
        "time": "16:50:00",
        "customtime": "4:50:PM",
        "crime": "ANTI-CARNAPPING ACT (R.A. 6539) MC",
        "location": "Barangay 176, Kalookan City, Ncr District 3 (Northern), NCR",
        "region": "130000000",
        "province": "137500000",
        "modus": "Swpu (Stolen While Parked)",
        "crimetype": "366",
        "station": "Police Station 01 Caloocan City",
        "moduscode": "mc86",
        "date_com": "2017-08-20",
        "datechar": "08/20/2017"
    },
    {
        "lng": "120.973",
        "lat": "14.6957",
        "date": "2017-08-20",
        "customdate": "Sun - Aug 20, 2017",
        "time": "01:50:00",
        "customtime": "1:50:AM",
        "crime": "ANTI-CARNAPPING ACT (R.A. 6539) MC",
        "location": "Maysan, Valenzuela City, Ncr District 3 (Northern), NCR",
        "region": "130000000",
        "province": "137500000",
        "modus": "Swpu (Stolen While Parked)",
        "crimetype": "366",
        "station": "Police Station 04 Valenzuela City",
        "moduscode": "mc86",
        "date_com": "2017-08-20",
        "datechar": "08/20/2017"
    },
    {
        "lng": "121.055",
        "lat": "14.7745",
        "date": "2017-08-21",
        "customdate": "Mon - Aug 21, 2017",
        "time": "13:50:00",
        "customtime": "1:50:PM",
        "crime": "ANTI-CARNAPPING ACT (R.A. 6539) MC",
        "location": "Barangay 188, Kalookan City, Ncr District 3 (Northern), NCR",
        "region": "130000000",
        "province": "137500000",
        "modus": "Swpu (Stolen While Parked)",
        "crimetype": "366",
        "station": "Police Station 01 Caloocan City",
        "moduscode": "mc86",
        "date_com": "2017-08-21",
        "datechar": "08/21/2017"
    },
    {
        "lng": "121.057",
        "lat": "14.7638",
        "date": "2017-08-26",
        "customdate": "Sat - Aug 26, 2017",
        "time": "03:30:00",
        "customtime": "3:30:AM",
        "crime": "ANTI-CARNAPPING ACT (R.A. 6539) MC",
        "location": "Barangay 177, Kalookan City, Ncr District 3 (Northern), NCR",
        "region": "130000000",
        "province": "137500000",
        "modus": "Swpu (Stolen While Parked)",
        "crimetype": "366",
        "station": "Police Station 01 Caloocan City",
        "moduscode": "mc86",
        "date_com": "2017-08-26",
        "datechar": "08/26/2017"
    },
    {
        "lng": "121.011",
        "lat": "14.7512",
        "date": "2017-08-26",
        "customdate": "Sat - Aug 26, 2017",
        "time": "00:30:00",
        "customtime": "12:30:AM",
        "crime": "ANTI-CARNAPPING ACT (R.A. 6539) MC",
        "location": "Barangay 171, Kalookan City, Ncr District 3 (Northern), NCR",
        "region": "130000000",
        "province": "137500000",
        "modus": "Swpu (Stolen While Parked)",
        "crimetype": "366",
        "station": "Police Station 01 Caloocan City",
        "moduscode": "mc86",
        "date_com": "2017-08-26",
        "datechar": "08/26/2017"
    },
    {
        "lng": "120.986",
        "lat": "14.6473",
        "date": "2017-08-26",
        "customdate": "Sat - Aug 26, 2017",
        "time": "00:14:00",
        "customtime": "12:14:AM",
        "crime": "ANTI-CARNAPPING ACT (R.A. 6539) MC",
        "location": "Barangay 110, Kalookan City, Ncr District 3 (Northern), NCR",
        "region": "130000000",
        "province": "137500000",
        "modus": "Swpu (Stolen While Parked)",
        "crimetype": "366",
        "station": "Police Station 01 Caloocan City",
        "moduscode": "mc86",
        "date_com": "2017-08-26",
        "datechar": "08/26/2017"
    },
    {
        "lng": "120.974",
        "lat": "14.6509",
        "date": "2017-08-28",
        "customdate": "Mon - Aug 28, 2017",
        "time": "17:40:00",
        "customtime": "5:40:PM",
        "crime": "ANTI-CARNAPPING ACT (R.A. 6539) MC",
        "location": "Barangay 15, Kalookan City, Ncr District 3 (Northern), NCR",
        "region": "130000000",
        "province": "137500000",
        "modus": "Swpu (Stolen While Parked)",
        "crimetype": "366",
        "station": "Police Station 01 Caloocan City",
        "moduscode": "mc86",
        "date_com": "2017-08-28",
        "datechar": "08/28/2017"
    },
    {
        "lng": "120.974",
        "lat": "14.6512",
        "date": "2017-08-28",
        "customdate": "Mon - Aug 28, 2017",
        "time": "17:40:00",
        "customtime": "5:40:PM",
        "crime": "ANTI-CARNAPPING ACT (R.A. 6539) MC",
        "location": "Barangay 15, Kalookan City, Ncr District 3 (Northern), NCR",
        "region": "130000000",
        "province": "137500000",
        "modus": "Swpu (Stolen While Parked)",
        "crimetype": "366",
        "station": "Police Station 01 Caloocan City",
        "moduscode": "mc86",
        "date_com": "2017-08-28",
        "datechar": "08/28/2017"
    },
    {
        "lng": "120.953",
        "lat": "14.6603",
        "date": "2017-08-30",
        "customdate": "Wed - Aug 30, 2017",
        "time": "10:50:00",
        "customtime": "10:50:AM",
        "crime": "ANTI-CARNAPPING ACT (R.A. 6539) MC",
        "location": "San Agustin, Malabon City, Ncr District 3 (Northern), NCR",
        "region": "130000000",
        "province": "137500000",
        "modus": "Swpu (Stolen While Parked)",
        "crimetype": "366",
        "station": "Police Station 02 Malabon City",
        "moduscode": "mc86",
        "date_com": "2017-08-30",
        "datechar": "08/30/2017"
    },
    {
        "lng": "120.976",
        "lat": "14.6374",
        "date": "2017-09-01",
        "customdate": "Fri - Sep 1, 2017",
        "time": "17:00:00",
        "customtime": "5:00:PM",
        "crime": "ANTI-CARNAPPING ACT (R.A. 6539) MV",
        "location": "Barangay 35, Kalookan City, Ncr District 3 (Northern), NCR",
        "region": "130000000",
        "province": "137500000",
        "modus": "Swpu ( Stolen While Parked)",
        "crimetype": "27",
        "station": "Police Station 01 Caloocan City",
        "moduscode": "mc79",
        "date_com": "2017-09-01",
        "datechar": "09/01/2017"
    },
    {
        "lng": "120.975",
        "lat": "14.6977",
        "date": "2017-09-02",
        "customdate": "Sat - Sep 2, 2017",
        "time": "17:00:00",
        "customtime": "5:00:PM",
        "crime": "ANTI-CARNAPPING ACT (R.A. 6539) MC",
        "location": "Maysan, Valenzuela City, Ncr District 3 (Northern), NCR",
        "region": "130000000",
        "province": "137500000",
        "modus": "Swpu (Stolen While Parked)",
        "crimetype": "366",
        "station": "Police Station 04 Valenzuela City",
        "moduscode": "mc86",
        "date_com": "2017-09-02",
        "datechar": "09/02/2017"
    },
    {
        "lng": "121.014",
        "lat": "14.7324",
        "date": "2017-09-03",
        "customdate": "Sun - Sep 3, 2017",
        "time": "05:00:00",
        "customtime": "5:00:AM",
        "crime": "ANTI-CARNAPPING ACT (R.A. 6539) MC",
        "location": "Barangay 167, Kalookan City, Ncr District 3 (Northern), NCR",
        "region": "130000000",
        "province": "137500000",
        "modus": "Swpu (Stolen While Parked)",
        "crimetype": "366",
        "station": "Police Station 01 Caloocan City",
        "moduscode": "mc86",
        "date_com": "2017-09-03",
        "datechar": "09/03/2017"
    },
    {
        "lng": "120.996",
        "lat": "14.7464",
        "date": "2017-09-03",
        "customdate": "Sun - Sep 3, 2017",
        "time": "17:00:00",
        "customtime": "5:00:PM",
        "crime": "ANTI-CARNAPPING ACT (R.A. 6539) MC",
        "location": "Hen. T. De Leon, Valenzuela City, Ncr District 3 (Northern), NCR",
        "region": "130000000",
        "province": "137500000",
        "modus": "Swpu (Stolen While Parked)",
        "crimetype": "366",
        "station": "Police Station 04 Valenzuela City",
        "moduscode": "mc86",
        "date_com": "2017-09-03",
        "datechar": "09/03/2017"
    },
    {
        "lng": "120.976",
        "lat": "14.6867",
        "date": "2017-09-05",
        "customdate": "Tue - Sep 5, 2017",
        "time": "12:00:00",
        "customtime": "12:00:PM",
        "crime": "ANTI-CARNAPPING ACT (R.A. 6539) MV",
        "location": "Karuhatan, Valenzuela City, Ncr District 3 (Northern), NCR",
        "region": "130000000",
        "province": "137500000",
        "modus": "Ftr (Failed to Return)",
        "crimetype": "27",
        "station": "Police Station 04 Valenzuela City",
        "moduscode": "mc77",
        "date_com": "2017-09-05",
        "datechar": "09/05/2017"
    },
    {
        "lng": "121.009",
        "lat": "14.6923",
        "date": "2017-09-06",
        "customdate": "Wed - Sep 6, 2017",
        "time": "06:00:00",
        "customtime": "6:00:AM",
        "crime": "ANTI-CARNAPPING ACT (R.A. 6539) MC",
        "location": "Ugong, Valenzuela City, Ncr District 3 (Northern), NCR",
        "region": "130000000",
        "province": "137500000",
        "modus": "Swpu (Stolen While Parked)",
        "crimetype": "366",
        "station": "Police Station 04 Valenzuela City",
        "moduscode": "mc86",
        "date_com": "2017-09-06",
        "datechar": "09/06/2017"
    },
    {
        "lng": "120.999",
        "lat": "14.6679",
        "date": "2017-09-09",
        "customdate": "Sat - Sep 9, 2017",
        "time": "22:00:00",
        "customtime": "10:00:PM",
        "crime": "ANTI-CARNAPPING ACT (R.A. 6539) MC",
        "location": "Barangay 156, Kalookan City, Ncr District 3 (Northern), NCR",
        "region": "130000000",
        "province": "137500000",
        "modus": "Swpu (Stolen While Parked)",
        "crimetype": "366",
        "station": "Police Station 01 Caloocan City",
        "moduscode": "mc86",
        "date_com": "2017-09-09",
        "datechar": "09/09/2017"
    },
    {
        "lng": "121.01",
        "lat": "14.7347",
        "date": "2017-09-11",
        "customdate": "Mon - Sep 11, 2017",
        "time": "05:00:00",
        "customtime": "5:00:AM",
        "crime": "ANTI-CARNAPPING ACT (R.A. 6539) MC",
        "location": "Barangay 167, Kalookan City, Ncr District 3 (Northern), NCR",
        "region": "130000000",
        "province": "137500000",
        "modus": "Swpu (Stolen While Parked)",
        "crimetype": "366",
        "station": "Police Station 01 Caloocan City",
        "moduscode": "mc86",
        "date_com": "2017-09-11",
        "datechar": "09/11/2017"
    },
    {
        "lng": "120.965",
        "lat": "14.6537",
        "date": "2017-09-12",
        "customdate": "Tue - Sep 12, 2017",
        "time": "14:00:00",
        "customtime": "2:00:PM",
        "crime": "ANTI-CARNAPPING ACT (R.A. 6539) MC",
        "location": "Barangay 12, Kalookan City, Ncr District 3 (Northern), NCR",
        "region": "130000000",
        "province": "137500000",
        "modus": "Swpu (Stolen While Parked)",
        "crimetype": "366",
        "station": "Police Station 01 Caloocan City",
        "moduscode": "mc86",
        "date_com": "2017-09-12",
        "datechar": "09/12/2017"
    },
    {
        "lng": "121.039",
        "lat": "14.7554",
        "date": "2017-09-13",
        "customdate": "Wed - Sep 13, 2017",
        "time": "06:00:00",
        "customtime": "6:00:AM",
        "crime": "ANTI-CARNAPPING ACT (R.A. 6539) MC",
        "location": "Barangay 175, Kalookan City, Ncr District 3 (Northern), NCR",
        "region": "130000000",
        "province": "137500000",
        "modus": "Swpu (Stolen While Parked)",
        "crimetype": "366",
        "station": "Police Station 01 Caloocan City",
        "moduscode": "mc86",
        "date_com": "2017-09-13",
        "datechar": "09/13/2017"
    },
    {
        "lng": "121",
        "lat": "14.6764",
        "date": "2017-09-16",
        "customdate": "Sat - Sep 16, 2017",
        "time": "14:40:00",
        "customtime": "2:40:PM",
        "crime": "ANTI-CARNAPPING ACT (R.A. 6539) MC",
        "location": "Barangay 161, Kalookan City, Ncr District 3 (Northern), NCR",
        "region": "130000000",
        "province": "137500000",
        "modus": "Forcibly Taken",
        "crimetype": "366",
        "station": "Police Station 01 Caloocan City",
        "moduscode": "mc87",
        "date_com": "2017-09-16",
        "datechar": "09/16/2017"
    },
    {
        "lng": "120.99",
        "lat": "14.6637",
        "date": "2017-09-17",
        "customdate": "Sun - Sep 17, 2017",
        "time": "04:00:00",
        "customtime": "4:00:AM",
        "crime": "ANTI-CARNAPPING ACT (R.A. 6539) MC",
        "location": "Barangay 132, Kalookan City, Ncr District 3 (Northern), NCR",
        "region": "130000000",
        "province": "137500000",
        "modus": "Swpu (Stolen While Parked)",
        "crimetype": "366",
        "station": "Police Station 01 Caloocan City",
        "moduscode": "mc86",
        "date_com": "2017-09-17",
        "datechar": "09/17/2017"
    },
    {
        "lng": "120.959",
        "lat": "14.6538",
        "date": "2017-09-18",
        "customdate": "Mon - Sep 18, 2017",
        "time": "17:00:00",
        "customtime": "5:00:PM",
        "crime": "ANTI-CARNAPPING ACT (R.A. 6539) MC",
        "location": "Longos, Malabon City, Ncr District 3 (Northern), NCR",
        "region": "130000000",
        "province": "137500000",
        "modus": "Swpu (Stolen While Parked)",
        "crimetype": "366",
        "station": "Police Station 02 Malabon City",
        "moduscode": "mc86",
        "date_com": "2017-09-18",
        "datechar": "09/18/2017"
    },
    {
        "lng": "120.987",
        "lat": "14.6472",
        "date": "2017-09-19",
        "customdate": "Tue - Sep 19, 2017",
        "time": "01:27:00",
        "customtime": "1:27:AM",
        "crime": "ANTI-CARNAPPING ACT (R.A. 6539) MC",
        "location": "Barangay 112, Kalookan City, Ncr District 3 (Northern), NCR",
        "region": "130000000",
        "province": "137500000",
        "modus": "Swpu (Stolen While Parked)",
        "crimetype": "366",
        "station": "Police Station 01 Caloocan City",
        "moduscode": "mc86",
        "date_com": "2017-09-19",
        "datechar": "09/19/2017"
    },
    {
        "lng": "120.968",
        "lat": "14.6994",
        "date": "2017-09-22",
        "customdate": "Fri - Sep 22, 2017",
        "time": "23:45:00",
        "customtime": "11:45:PM",
        "crime": "ANTI-CARNAPPING ACT (R.A. 6539) MC",
        "location": "Malinta, Valenzuela City, Ncr District 3 (Northern), NCR",
        "region": "130000000",
        "province": "137500000",
        "modus": "Swpu (Stolen While Parked)",
        "crimetype": "366",
        "station": "Police Station 04 Valenzuela City",
        "moduscode": "mc86",
        "date_com": "2017-09-22",
        "datechar": "09/22/2017"
    },
    {
        "lng": "120.982",
        "lat": "14.6691",
        "date": "2017-09-30",
        "customdate": "Sat - Sep 30, 2017",
        "time": "07:45:00",
        "customtime": "7:45:AM",
        "crime": "ANTI-CARNAPPING ACT (R.A. 6539) MC",
        "location": "Potrero, Malabon City, Ncr District 3 (Northern), NCR",
        "region": "130000000",
        "province": "137500000",
        "modus": "Swpu (Stolen While Parked)",
        "crimetype": "366",
        "station": "Police Station 02 Malabon City",
        "moduscode": "mc86",
        "date_com": "2017-09-30",
        "datechar": "09/30/2017"
    },
    {
        "lng": "120.975",
        "lat": "14.6477",
        "date": "2017-09-30",
        "customdate": "Sat - Sep 30, 2017",
        "time": "09:00:00",
        "customtime": "9:00:AM",
        "crime": "ANTI-CARNAPPING ACT (R.A. 6539) MC",
        "location": "Barangay 15, Kalookan City, Ncr District 3 (Northern), NCR",
        "region": "130000000",
        "province": "137500000",
        "modus": "Swpu (Stolen While Parked)",
        "crimetype": "366",
        "station": "Police Station 01 Caloocan City",
        "moduscode": "mc86",
        "date_com": "2017-09-30",
        "datechar": "09/30/2017"
    },
    {
        "lng": "120.975",
        "lat": "14.6976",
        "date": "2017-10-01",
        "customdate": "Sun - Oct 1, 2017",
        "time": "00:30:00",
        "customtime": "12:30:AM",
        "crime": "ANTI-CARNAPPING ACT (R.A. 6539) MC",
        "location": "Maysan, Valenzuela City, Ncr District 3 (Northern), NCR",
        "region": "130000000",
        "province": "137500000",
        "modus": "Forcibly Taken",
        "crimetype": "366",
        "station": "Police Station 04 Valenzuela City",
        "moduscode": "mc87",
        "date_com": "2017-10-01",
        "datechar": "10/01/2017"
    },
    {
        "lng": "121.075",
        "lat": "14.7694",
        "date": "2017-10-07",
        "customdate": "Sat - Oct 7, 2017",
        "time": "17:30:00",
        "customtime": "5:30:PM",
        "crime": "ANTI-CARNAPPING ACT (R.A. 6539) MC",
        "location": "Barangay 188, Kalookan City, Ncr District 3 (Northern), NCR",
        "region": "130000000",
        "province": "137500000",
        "modus": "Swpu (Stolen While Parked)",
        "crimetype": "366",
        "station": "Police Station 01 Caloocan City",
        "moduscode": "mc86",
        "date_com": "2017-10-07",
        "datechar": "10/07/2017"
    },
    {
        "lng": "121.043",
        "lat": "14.7755",
        "date": "2017-10-07",
        "customdate": "Sat - Oct 7, 2017",
        "time": "11:00:00",
        "customtime": "11:00:AM",
        "crime": "ANTI-CARNAPPING ACT (R.A. 6539) MC",
        "location": "Barangay 176, Kalookan City, Ncr District 3 (Northern), NCR",
        "region": "130000000",
        "province": "137500000",
        "modus": "Swpu (Stolen While Parked)",
        "crimetype": "366",
        "station": "Police Station 01 Caloocan City",
        "moduscode": "mc86",
        "date_com": "2017-10-07",
        "datechar": "10/07/2017"
    },
    {
        "lng": "121.004",
        "lat": "14.6754",
        "date": "2017-10-08",
        "customdate": "Sun - Oct 8, 2017",
