[
    {
        "lng": "120.998",
        "lat": "14.6576",
        "date": "2016-12-29",
        "customdate": "Thu - Dec 29, 2016",
        "time": "14:30:00",
        "customtime": "2:30:PM",
        "crime": "THEFT",
        "location": "Barangay 139, Kalookan City, Ncr District 3 (Northern), NCR",
        "region": "130000000",
        "province": "137500000",
        "modus": "Bukas -Kotse",
        "crimetype": "10",
        "station": "Police Station 01 Caloocan City",
        "moduscode": "mc17",
        "date_com": "2016-12-29",
        "datechar": "12/29/2016"
    },
    {
        "lng": "120.968",
        "lat": "14.6633",
        "date": "2016-12-30",
        "customdate": "Fri - Dec 30, 2016",
        "time": "09:30:00",
        "customtime": "9:30:AM",
        "crime": "THEFT",
        "location": "Tugatog, Malabon City, Ncr District 3 (Northern), NCR",
        "region": "130000000",
        "province": "137500000",
        "modus": "Plain Theft",
        "crimetype": "10",
        "station": "Police Station 02 Malabon City",
        "moduscode": "mc28",
        "date_com": "2016-12-30",
        "datechar": "12/30/2016"
    },
    {
        "lng": "121.774",
        "lat": "12.8797",
        "date": "2017-01-01",
        "customdate": "Sun - Jan 1, 2017",
        "time": "20:00:00",
        "customtime": "8:00:PM",
        "crime": "THEFT",
        "location": "North Bay Blvd., North, Navotas, Ncr District 3 (Northern), NCR",
        "region": "130000000",
        "province": "137500000",
        "modus": "Salisi",
        "crimetype": "10",
        "station": "Police Station 03 Navotas",
        "moduscode": "mc12",
        "date_com": "2017-01-01",
        "datechar": "1/1/2017"
    },
    {
        "lng": "120.952",
        "lat": "14.6474",
        "date": "2017-01-02",
        "customdate": "Mon - Jan 2, 2017",
        "time": "01:30:00",
        "customtime": "1:30:AM",
        "crime": "THEFT",
        "location": "North Bay Blvd., North, Navotas, Ncr District 3 (Northern), NCR",
        "region": "130000000",
        "province": "137500000",
        "modus": "Salisi",
        "crimetype": "10",
        "station": "Police Station 03 Navotas",
        "moduscode": "mc12",
        "date_com": "2017-01-02",
        "datechar": "1/2/2017"
    },
    {
        "lng": "120.968",
        "lat": "14.6938",
        "date": "2017-01-02",
        "customdate": "Mon - Jan 2, 2017",
        "time": "10:00:00",
        "customtime": "10:00:AM",
        "crime": "THEFT",
        "location": "Maysan, Valenzuela City, Ncr District 3 (Northern), NCR",
        "region": "130000000",
        "province": "137500000",
        "modus": "Qualified Theft",
        "crimetype": "10",
        "station": "Police Station 04 Valenzuela City",
        "moduscode": "mc66",
        "date_com": "2017-01-02",
        "datechar": "1/2/2017"
    },
    {
        "lng": "120.996",
        "lat": "14.6578",
        "date": "2017-01-02",
        "customdate": "Mon - Jan 2, 2017",
        "time": "07:00:00",
        "customtime": "7:00:AM",
        "crime": "THEFT",
        "location": "Barangay 136, Kalookan City, Ncr District 3 (Northern), NCR",
        "region": "130000000",
        "province": "137500000",
        "modus": "Qualified Theft",
        "crimetype": "10",
        "station": "Police Station 01 Caloocan City",
        "moduscode": "mc66",
        "date_com": "2017-01-02",
        "datechar": "1/2/2017"
    },
    {
        "lng": "120.996",
        "lat": "14.6571",
        "date": "2017-01-03",
        "customdate": "Tue - Jan 3, 2017",
        "time": "20:30:00",
        "customtime": "8:30:PM",
        "crime": "THEFT",
        "location": "Barangay 94, Kalookan City, Ncr District 3 (Northern), NCR",
        "region": "130000000",
        "province": "137500000",
        "modus": "Basag Salamin",
        "crimetype": "10",
        "station": "Police Station 01 Caloocan City",
        "moduscode": "mc18",
        "date_com": "2017-01-03",
        "datechar": "1/3/2017"
    },
    {
        "lng": "120.994",
        "lat": "14.6507",
        "date": "2017-01-03",
        "customdate": "Tue - Jan 3, 2017",
        "time": "15:43:00",
        "customtime": "3:43:PM",
        "crime": "THEFT",
        "location": "Barangay 101, Kalookan City, Ncr District 3 (Northern), NCR",
        "region": "130000000",
        "province": "137500000",
        "modus": "Qualified Theft",
        "crimetype": "10",
        "station": "Police Station 01 Caloocan City",
        "moduscode": "mc66",
        "date_com": "2017-01-03",
        "datechar": "1/3/2017"
    },
    {
        "lng": "120.955",
        "lat": "14.6427",
        "date": "2017-01-04",
        "customdate": "Wed - Jan 4, 2017",
        "time": "17:00:00",
        "customtime": "5:00:PM",
        "crime": "THEFT",
        "location": "North Bay Blvd., South, Navotas, Ncr District 3 (Northern), NCR",
        "region": "130000000",
        "province": "137500000",
        "modus": "Salisi",
        "crimetype": "10",
        "station": "Police Station 03 Navotas",
        "moduscode": "mc12",
        "date_com": "2017-01-04",
        "datechar": "1/4/2017"
    },
    {
        "lng": "120.958",
        "lat": "14.716",
        "date": "2017-01-06",
        "customdate": "Fri - Jan 6, 2017",
        "time": "03:00:00",
        "customtime": "3:00:AM",
        "crime": "THEFT",
        "location": "Malanday, Valenzuela City, Ncr District 3 (Northern), NCR",
        "region": "130000000",
        "province": "137500000",
        "modus": "Qualified Theft",
        "crimetype": "10",
        "station": "Police Station 04 Valenzuela City",
        "moduscode": "mc66",
        "date_com": "2017-01-06",
        "datechar": "1/6/2017"
    },
    {
        "lng": "121.043",
        "lat": "14.7564",
        "date": "2017-01-06",
        "customdate": "Fri - Jan 6, 2017",
        "time": "18:27:00",
        "customtime": "6:27:PM",
        "crime": "THEFT",
        "location": "Barangay 175, Kalookan City, Ncr District 3 (Northern), NCR",
        "region": "130000000",
        "province": "137500000",
        "modus": "Shoplifting",
        "crimetype": "10",
        "station": "Police Station 01 Caloocan City",
        "moduscode": "mc72",
        "date_com": "2017-01-06",
        "datechar": "1/6/2017"
    },
    {
        "lng": "120.984",
        "lat": "14.6728",
        "date": "2017-01-06",
        "customdate": "Fri - Jan 6, 2017",
        "time": "13:05:00",
        "customtime": "1:05:PM",
        "crime": "THEFT",
        "location": "Marulas, Valenzuela City, Ncr District 3 (Northern), NCR",
        "region": "130000000",
        "province": "137500000",
        "modus": "Shoplifting",
        "crimetype": "10",
        "station": "Police Station 04 Valenzuela City",
        "moduscode": "mc72",
        "date_com": "2017-01-06",
        "datechar": "1/6/2017"
    },
    {
        "lng": "120.999",
        "lat": "14.6577",
        "date": "2017-01-06",
        "customdate": "Fri - Jan 6, 2017",
        "time": "22:08:00",
        "customtime": "10:08:PM",
        "crime": "THEFT",
        "location": "Barangay 139, Kalookan City, Ncr District 3 (Northern), NCR",
        "region": "130000000",
        "province": "137500000",
        "modus": "Plain Theft",
        "crimetype": "10",
        "station": "Police Station 01 Caloocan City",
        "moduscode": "mc28",
        "date_com": "2017-01-06",
        "datechar": "1/6/2017"
    },
    {
        "lng": "121.077",
        "lat": "14.7707",
        "date": "2017-01-07",
        "customdate": "Sat - Jan 7, 2017",
        "time": "02:30:00",
        "customtime": "2:30:AM",
        "crime": "THEFT",
        "location": "Barangay 185, Kalookan City, Ncr District 3 (Northern), NCR",
        "region": "130000000",
        "province": "137500000",
        "modus": "Salisi",
        "crimetype": "10",
        "station": "Police Station 01 Caloocan City",
        "moduscode": "mc12",
        "date_com": "2017-01-07",
        "datechar": "1/7/2017"
    },
    {
        "lng": "120.984",
        "lat": "14.6484",
        "date": "2017-01-07",
        "customdate": "Sat - Jan 7, 2017",
        "time": "15:14:00",
        "customtime": "3:14:PM",
        "crime": "THEFT",
        "location": "Barangay 108, Kalookan City, Ncr District 3 (Northern), NCR",
        "region": "130000000",
        "province": "137500000",
        "modus": "Basag Salamin",
        "crimetype": "10",
        "station": "Police Station 01 Caloocan City",
        "moduscode": "mc18",
        "date_com": "2017-01-07",
        "datechar": "1/7/2017"
    },
    {
        "lng": "120.978",
        "lat": "14.6995",
        "date": "2017-01-07",
        "customdate": "Sat - Jan 7, 2017",
        "time": "14:00:00",
        "customtime": "2:00:PM",
        "crime": "THEFT",
        "location": "Maysan, Valenzuela City, Ncr District 3 (Northern), NCR",
        "region": "130000000",
        "province": "137500000",
        "modus": "Qualified Theft",
        "crimetype": "10",
        "station": "Police Station 04 Valenzuela City",
        "moduscode": "mc66",
        "date_com": "2017-01-07",
        "datechar": "1/7/2017"
    },
    {
        "lng": "120.984",
        "lat": "14.6501",
        "date": "2017-01-07",
        "customdate": "Sat - Jan 7, 2017",
        "time": "23:30:00",
        "customtime": "11:30:PM",
        "crime": "THEFT",
        "location": "Barangay 61, Kalookan City, Ncr District 3 (Northern), NCR",
        "region": "130000000",
        "province": "137500000",
        "modus": "Basag Salamin",
        "crimetype": "10",
        "station": "Police Station 01 Caloocan City",
        "moduscode": "mc18",
        "date_com": "2017-01-07",
        "datechar": "1/7/2017"
    },
    {
        "lng": "120.967",
        "lat": "14.667",
        "date": "2017-01-08",
        "customdate": "Sun - Jan 8, 2017",
        "time": "09:30:00",
        "customtime": "9:30:AM",
        "crime": "THEFT",
        "location": "Acacia, Malabon City, Ncr District 3 (Northern), NCR",
        "region": "130000000",
        "province": "137500000",
        "modus": "Plain Theft",
        "crimetype": "10",
        "station": "Police Station 02 Malabon City",
        "moduscode": "mc28",
        "date_com": "2017-01-08",
        "datechar": "1/8/2017"
    }, 
    {
        "lng": "120.957",
        "lat": "14.6401",
        "date": "2017-01-09",
        "customdate": "Mon - Jan 9, 2017",
        "time": "22:55:00",
        "customtime": "10:55:PM",
        "crime": "THEFT",
        "location": "North Bay Blvd., South, Navotas, Ncr District 3 (Northern), NCR",
        "region": "130000000",
        "province": "137500000",
        "modus": "Qualified Theft",
        "crimetype": "10",
        "station": "Police Station 03 Navotas",
        "moduscode": "mc66",
        "date_com": "2017-01-09",
        "datechar": "1/9/2017"
    },
    {
        "lng": "120.989",
        "lat": "14.6848",
        "date": "2017-01-09",
        "customdate": "Mon - Jan 9, 2017",
        "time": "15:00:00",
        "customtime": "3:00:PM",
        "crime": "THEFT",
        "location": "Hen. T. De Leon, Valenzuela City, Ncr District 3 (Northern), NCR",
        "region": "130000000",
        "province": "137500000",
        "modus": "Salisi",
        "crimetype": "10",
        "station": "Police Station 04 Valenzuela City",
        "moduscode": "mc12",
        "date_com": "2017-01-09",
        "datechar": "1/9/2017"
    },
    {
        "lng": "120.984",
        "lat": "14.6648",
        "date": "2017-01-09",
        "customdate": "Mon - Jan 9, 2017",
        "time": "16:00:00",
        "customtime": "4:00:PM",
        "crime": "THEFT",
        "location": "Potrero, Malabon City, Ncr District 3 (Northern), NCR",
        "region": "130000000",
        "province": "137500000",
        "modus": "Plain Theft",
        "crimetype": "10",
        "station": "Police Station 02 Malabon City",
        "moduscode": "mc28",
        "date_com": "2017-01-09",
        "datechar": "1/9/2017"
    },
    {
        "lng": "120.966",
        "lat": "14.6677",
        "date": "2017-01-10",
        "customdate": "Tue - Jan 10, 2017",
        "time": "15:30:00",
        "customtime": "3:30:PM",
        "crime": "THEFT",
        "location": "Baritan, Malabon City, Ncr District 3 (Northern), NCR",
        "region": "130000000",
        "province": "137500000",
        "modus": "Salisi",
        "crimetype": "10",
        "station": "Police Station 02 Malabon City",
        "moduscode": "mc12",
        "date_com": "2017-01-10",
        "datechar": "1/10/2017"
    },
    {
        "lng": "120.983",
        "lat": "14.6571",
        "date": "2017-01-10",
        "customdate": "Tue - Jan 10, 2017",
        "time": "14:31:00",
        "customtime": "2:31:PM",
        "crime": "THEFT",
        "location": "Barangay 76, Kalookan City, Ncr District 3 (Northern), NCR",
        "region": "130000000",
        "province": "137500000",
        "modus": "Plain Theft",
        "crimetype": "10",
        "station": "Police Station 01 Caloocan City",
        "moduscode": "mc28",
        "date_com": "2017-01-10",
        "datechar": "1/10/2017"
    },
    {
        "lng": "120.984",
        "lat": "14.6583",
        "date": "2017-01-10",
        "customdate": "Tue - Jan 10, 2017",
        "time": "18:15:00",
        "customtime": "6:15:PM",
        "crime": "THEFT",
        "location": "Barangay 78, Kalookan City, Ncr District 3 (Northern), NCR",
        "region": "130000000",
        "province": "137500000",
        "modus": "Qualified Theft",
        "crimetype": "10",
        "station": "Police Station 01 Caloocan City",
        "moduscode": "mc66",
        "date_com": "2017-01-10",
        "datechar": "1/10/2017"
    },  
    {
        "lng": "120.995",
        "lat": "14.6908",
        "date": "2017-01-11",
        "customdate": "Wed - Jan 11, 2017",
        "time": "14:00:00",
        "customtime": "2:00:PM",
        "crime": "THEFT",
        "location": "Hen. T. De Leon, Valenzuela City, Ncr District 3 (Northern), NCR",
        "region": "130000000",
        "province": "137500000",
        "modus": "Salisi",
        "crimetype": "10",
        "station": "Police Station 04 Valenzuela City",
        "moduscode": "mc12",
        "date_com": "2017-01-11",
        "datechar": "1/11/2017"
    },
    {
        "lng": "120.961",
        "lat": "14.7209",
        "date": "2017-01-12",
        "customdate": "Thu - Jan 12, 2017",
        "time": "01:35:00",
        "customtime": "1:35:AM",
        "crime": "THEFT",
        "location": "Malanday, Valenzuela City, Ncr District 3 (Northern), NCR",
        "region": "130000000",
        "province": "137500000",
        "modus": "Salisi",
        "crimetype": "10",
        "station": "Police Station 04 Valenzuela City",
        "moduscode": "mc12",
        "date_com": "2017-01-12",
        "datechar": "1/12/2017"
    },
    {
        "lng": "120.952",
        "lat": "14.6526",
        "date": "2017-01-12",
        "customdate": "Thu - Jan 12, 2017",
        "time": "23:40:00",
        "customtime": "11:40:PM",
        "crime": "THEFT",
        "location": "Bagumbayan North, Navotas, Ncr District 3 (Northern), NCR",
        "region": "130000000",
        "province": "137500000",
        "modus": "Salisi (Establishment)",
        "crimetype": "10",
        "station": "Police Station 03 Navotas",
        "moduscode": "mc68",
        "date_com": "2017-01-12",
        "datechar": "1/12/2017"
    },
    {
        "lng": "120.964",
        "lat": "14.6489",
        "date": "2017-01-12",
        "customdate": "Thu - Jan 12, 2017",
        "time": "13:30:00",
        "customtime": "1:30:PM",
        "crime": "THEFT",
        "location": "Longos, Malabon City, Ncr District 3 (Northern), NCR",
        "region": "130000000",
        "province": "137500000",
        "modus": "Salisi",
        "crimetype": "10",
        "station": "Police Station 02 Malabon City",
        "moduscode": "mc12",
        "date_com": "2017-01-12",
        "datechar": "1/12/2017"
    },
    {
        "lng": "121.02",
        "lat": "14.7394",
        "date": "2017-01-12",
        "customdate": "Thu - Jan 12, 2017",
        "time": "20:00:00",
        "customtime": "8:00:PM",
        "crime": "THEFT",
        "location": "Barangay 168, Kalookan City, Ncr District 3 (Northern), NCR",
        "region": "130000000",
        "province": "137500000",
        "modus": "Salisi (Akyat Bahay)",
        "crimetype": "10",
        "station": "Police Station 01 Caloocan City",
        "moduscode": "mc67",
        "date_com": "2017-01-12",
        "datechar": "1/12/2017"
    },
    {
        "lng": "120.956",
        "lat": "14.6422",
        "date": "2017-01-13",
        "customdate": "Fri - Jan 13, 2017",
        "time": "16:45:00",
        "customtime": "4:45:PM",
        "crime": "THEFT",
        "location": "North Bay Blvd., South, Navotas, Ncr District 3 (Northern), NCR",
        "region": "130000000",
        "province": "137500000",
        "modus": "Salisi",
        "crimetype": "10",
        "station": "Police Station 03 Navotas",
        "moduscode": "mc12",
        "date_com": "2017-01-13",
        "datechar": "1/13/2017"
    },
    {
        "lng": "120.976",
        "lat": "14.685",
        "date": "2017-01-13",
        "customdate": "Fri - Jan 13, 2017",
        "time": "20:00:00",
        "customtime": "8:00:PM",
        "crime": "THEFT",
        "location": "Karuhatan, Valenzuela City, Ncr District 3 (Northern), NCR",
        "region": "130000000",
        "province": "137500000",
        "modus": "Salisi",
        "crimetype": "10",
        "station": "Police Station 04 Valenzuela City",
        "moduscode": "mc12",
        "date_com": "2017-01-13",
        "datechar": "1/13/2017"
    },
    {
        "lng": "120.954",
        "lat": "14.6453",
        "date": "2017-01-13",
        "customdate": "Fri - Jan 13, 2017",
        "time": "23:30:00",
        "customtime": "11:30:PM",
        "crime": "THEFT",
        "location": "North Bay Blvd., South, Navotas, Ncr District 3 (Northern), NCR",
        "region": "130000000",
        "province": "137500000",
        "modus": "Salisi (Akyat Bahay)",
        "crimetype": "10",
        "station": "Police Station 03 Navotas",
        "moduscode": "mc67",
        "date_com": "2017-01-13",
        "datechar": "1/13/2017"
    },
    {
        "lng": "121.001",
        "lat": "14.7013",
        "date": "2017-01-14",
        "customdate": "Sat - Jan 14, 2017",
        "time": "16:00:00",
        "customtime": "4:00:PM",
        "crime": "THEFT",
        "location": "Mapulang Lupa, Valenzuela City, Ncr District 3 (Northern), NCR",
        "region": "130000000",
        "province": "137500000",
        "modus": "Qualified Theft",
        "crimetype": "10",
        "station": "Police Station 04 Valenzuela City",
        "moduscode": "mc66",
        "date_com": "2017-01-14",
        "datechar": "1/14/2017"
    },  
    {
        "lng": "120.968",
        "lat": "14.6931",
        "date": "2017-01-14",
        "customdate": "Sat - Jan 14, 2017",
        "time": "02:30:00",
        "customtime": "2:30:AM",
        "crime": "THEFT",
        "location": "Malinta, Valenzuela City, Ncr District 3 (Northern), NCR",
        "region": "130000000",
        "province": "137500000",
        "modus": "Salisi",
        "crimetype": "10",
        "station": "Police Station 04 Valenzuela City",
        "moduscode": "mc12",
        "date_com": "2017-01-14",
        "datechar": "1/14/2017"
    },
    {
        "lng": "121.072",
        "lat": "14.7483",
        "date": "2017-01-14",
        "customdate": "Sat - Jan 14, 2017",
        "time": "21:00:00",
        "customtime": "9:00:PM",
        "crime": "THEFT",
        "location": "Barangay 179, Kalookan City, Ncr District 3 (Northern), NCR",
        "region": "130000000",
        "province": "137500000",
        "modus": "Salisi (Others)",
        "crimetype": "10",
        "station": "Police Station 01 Caloocan City",
        "moduscode": "mc69",
        "date_com": "2017-01-14",
        "datechar": "1/14/2017"
    },
    {
        "lng": "120.972",
        "lat": "14.6848",
        "date": "2017-01-15",
        "customdate": "Sun - Jan 15, 2017",
        "time": "22:45:00",
        "customtime": "10:45:PM",
        "crime": "THEFT",
        "location": "Dalandanan, Valenzuela City, Ncr District 3 (Northern), NCR",
        "region": "130000000",
        "province": "137500000",
        "modus": "Basag Salamin",
        "crimetype": "10",
        "station": "Police Station 04 Valenzuela City",
        "moduscode": "mc18",
        "date_com": "2017-01-15",
        "datechar": "1/15/2017"
    },
    {
        "lng": "120.98",
        "lat": "14.714",
        "date": "2017-01-16",
        "customdate": "Mon - Jan 16, 2017",
        "time": "09:30:00",
        "customtime": "9:30:AM",
        "crime": "THEFT",
        "location": "Viente Reales, Valenzuela City, Ncr District 3 (Northern), NCR",
        "region": "130000000",
        "province": "137500000",
        "modus": "Salisi",
        "crimetype": "10",
        "station": "Police Station 04 Valenzuela City",
        "moduscode": "mc12",
        "date_com": "2017-01-16",
        "datechar": "1/16/2017"
    },
    {
        "lng": "120.994",
        "lat": "14.6636",
        "date": "2017-01-16",
        "customdate": "Mon - Jan 16, 2017",
        "time": "09:30:00",
        "customtime": "9:30:AM",
        "crime": "THEFT",
        "location": "Barangay 140, Kalookan City, Ncr District 3 (Northern), NCR",
        "region": "130000000",
        "province": "137500000",
        "modus": "Plain Theft",
        "crimetype": "10",
        "station": "Police Station 01 Caloocan City",
        "moduscode": "mc28",
        "date_com": "2017-01-16",
        "datechar": "1/16/2017"
    },   
    {
        "lng": "120.977",
        "lat": "14.6389",
        "date": "2017-01-16",
        "customdate": "Mon - Jan 16, 2017",
        "time": "04:00:00",
        "customtime": "4:00:AM",
        "crime": "THEFT",
        "location": "Barangay 32, Kalookan City, Ncr District 3 (Northern), NCR",
        "region": "130000000",
        "province": "137500000",
        "modus": "Salisi (Akyat Bahay)",
        "crimetype": "10",
        "station": "Police Station 01 Caloocan City",
        "moduscode": "mc67",
        "date_com": "2017-01-16",
        "datechar": "1/16/2017"
    },
    {
        "lng": "120.985",
        "lat": "14.6561",
        "date": "2017-01-16",
        "customdate": "Mon - Jan 16, 2017",
        "time": "13:00:00",
        "customtime": "1:00:PM",
        "crime": "THEFT",
        "location": "Barangay 87, Kalookan City, Ncr District 3 (Northern), NCR",
        "region": "130000000",
        "province": "137500000",
        "modus": "Qualified Theft",
        "crimetype": "10",
        "station": "Police Station 01 Caloocan City",
        "moduscode": "mc66",
        "date_com": "2017-01-16",
        "datechar": "1/16/2017"
    },
    {
        "lng": "120.948",
        "lat": "14.6579",
        "date": "2017-01-17",
        "customdate": "Tue - Jan 17, 2017",
        "time": "18:00:00",
        "customtime": "6:00:PM",
        "crime": "THEFT",
        "location": "Sipac-Almacen, Navotas, Ncr District 3 (Northern), NCR",
        "region": "130000000",
        "province": "137500000",
        "modus": "Qualified Theft",
        "crimetype": "10",
        "station": "Police Station 03 Navotas",
        "moduscode": "mc66",
        "date_com": "2017-01-17",
        "datechar": "1/17/2017"
    },
    {
        "lng": "121.052",
        "lat": "14.7617",
        "date": "2017-01-17",
        "customdate": "Tue - Jan 17, 2017",
        "time": "01:00:00",
        "customtime": "1:00:AM",
        "crime": "THEFT",
        "location": "Barangay 177, Kalookan City, Ncr District 3 (Northern), NCR",
        "region": "130000000",
        "province": "137500000",
        "modus": "Salisi",
        "crimetype": "10",
        "station": "Police Station 01 Caloocan City",
        "moduscode": "mc12",
        "date_com": "2017-01-17",
        "datechar": "1/17/2017"
    },
    {
        "lng": "120.983",
        "lat": "14.6554",
        "date": "2017-01-17",
        "customdate": "Tue - Jan 17, 2017",
        "time": "19:30:00",
        "customtime": "7:30:PM",
        "crime": "THEFT",
        "location": "Barangay 76, Kalookan City, Ncr District 3 (Northern), NCR",
        "region": "130000000",
        "province": "137500000",
        "modus": "Pick-Pocketing",
        "crimetype": "10",
        "station": "Police Station 01 Caloocan City",
        "moduscode": "mc13",
        "date_com": "2017-01-17",
        "datechar": "1/17/2017"
    },
    {
        "lng": "120.96",
        "lat": "14.6543",
        "date": "2017-01-17",
        "customdate": "Tue - Jan 17, 2017",
        "time": "11:30:00",
        "customtime": "11:30:AM",
        "crime": "THEFT",
        "location": "Longos, Malabon City, Ncr District 3 (Northern), NCR",
        "region": "130000000",
        "province": "137500000",
        "modus": "Salisi",
        "crimetype": "10",
        "station": "Police Station 02 Malabon City",
        "moduscode": "mc12",
        "date_com": "2017-01-17",
        "datechar": "1/17/2017"
    },
    {
        "lng": "120.976",
        "lat": "14.6852",
        "date": "2017-01-18",
        "customdate": "Wed - Jan 18, 2017",
        "time": "18:00:00",
        "customtime": "6:00:PM",
        "crime": "THEFT",
        "location": "Karuhatan, Valenzuela City, Ncr District 3 (Northern), NCR",
        "region": "130000000",
        "province": "137500000",
        "modus": "Shoplifting",
        "crimetype": "10",
        "station": "Police Station 04 Valenzuela City",
        "moduscode": "mc72",
        "date_com": "2017-01-18",
        "datechar": "1/18/2017"
    },
    {
        "lng": "120.988",
        "lat": "14.6817",
        "date": "2017-01-18",
        "customdate": "Wed - Jan 18, 2017",
        "time": "04:00:00",
        "customtime": "4:00:AM",
        "crime": "THEFT",
        "location": "Hen. T. De Leon, Valenzuela City, Ncr District 3 (Northern), NCR",
        "region": "130000000",
        "province": "137500000",
        "modus": "Basag Salamin",
        "crimetype": "10",
        "station": "Police Station 04 Valenzuela City",
        "moduscode": "mc18",
        "date_com": "2017-01-18",
        "datechar": "1/18/2017"
    },
    {
        "lng": "120.983",
        "lat": "14.6728",
        "date": "2017-01-19",
        "customdate": "Thu - Jan 19, 2017",
        "time": "14:00:00",
        "customtime": "2:00:PM",
        "crime": "THEFT",
        "location": "Marulas, Valenzuela City, Ncr District 3 (Northern), NCR",
        "region": "130000000",
        "province": "137500000",
        "modus": "Salisi",
        "crimetype": "10",
        "station": "Police Station 04 Valenzuela City",
        "moduscode": "mc12",
        "date_com": "2017-01-19",
        "datechar": "1/19/2017"
    },
    {
        "lng": "120.979",
        "lat": "14.6673",
        "date": "2017-01-19",
        "customdate": "Thu - Jan 19, 2017",
        "time": "14:17:00",
        "customtime": "2:17:PM",
        "crime": "THEFT",
        "location": "Potrero, Malabon City, Ncr District 3 (Northern), NCR",
        "region": "130000000",
        "province": "137500000",
        "modus": "Salisi (Others)",
        "crimetype": "10",
        "station": "Police Station 02 Malabon City",
        "moduscode": "mc69",
        "date_com": "2017-01-19",
        "datechar": "1/19/2017"
    },
    {
        "lng": "121.01",
        "lat": "14.6925",
        "date": "2017-01-20",
        "customdate": "Fri - Jan 20, 2017",
        "time": "15:30:00",
        "customtime": "3:30:PM",
        "crime": "THEFT",
        "location": "Ugong, Valenzuela City, Ncr District 3 (Northern), NCR",
        "region": "130000000",
        "province": "137500000",
        "modus": "Plain Theft",
        "crimetype": "10",
        "station": "Police Station 04 Valenzuela City",
        "moduscode": "mc28",
        "date_com": "2017-01-20",
        "datechar": "1/20/2017"
    },
    {
        "lng": "120.997",
        "lat": "14.6874",
        "date": "2017-01-21",
        "customdate": "Sat - Jan 21, 2017",
        "time": "17:21:00",
        "customtime": "5:21:PM",
        "crime": "THEFT",
        "location": "Hen. T. De Leon, Valenzuela City, Ncr District 3 (Northern), NCR",
        "region": "130000000",
        "province": "137500000",
        "modus": "Shoplifting",
        "crimetype": "10",
        "station": "Police Station 04 Valenzuela City",
        "moduscode": "mc72",
        "date_com": "2017-01-21",
        "datechar": "1/21/2017"
    },
    {
        "lng": "120.989",
        "lat": "14.6855",
        "date": "2017-01-21",
        "customdate": "Sat - Jan 21, 2017",
        "time": "20:30:00",
        "customtime": "8:30:PM",
        "crime": "THEFT",
        "location": "Hen. T. De Leon, Valenzuela City, Ncr District 3 (Northern), NCR",
        "region": "130000000",
        "province": "137500000",
        "modus": "Shoplifting",
        "crimetype": "10",
        "station": "Police Station 04 Valenzuela City",
        "moduscode": "mc72",
        "date_com": "2017-01-21",
        "datechar": "1/21/2017"
    },
    {
        "lng": "120.962",
        "lat": "14.6778",
        "date": "2017-01-22",
        "customdate": "Sun - Jan 22, 2017",
        "time": "01:35:00",
        "customtime": "1:35:AM",
        "crime": "THEFT",
        "location": "Maysilo, Malabon City, Ncr District 3 (Northern), NCR",
        "region": "130000000",
        "province": "137500000",
        "modus": "Plain Theft",
        "crimetype": "10",
        "station": "Police Station 02 Malabon City",
        "moduscode": "mc28",
        "date_com": "2017-01-22",
        "datechar": "1/22/2017"
    },
    {
        "lng": "120.964",
        "lat": "14.6946",
        "date": "2017-01-22",
        "customdate": "Sun - Jan 22, 2017",
        "time": "18:30:00",
        "customtime": "6:30:PM",
        "crime": "THEFT",
        "location": "Malinta, Valenzuela City, Ncr District 3 (Northern), NCR",
        "region": "130000000",
        "province": "137500000",
        "modus": "Basag Salamin",
        "crimetype": "10",
        "station": "Police Station 04 Valenzuela City",
        "moduscode": "mc18",
        "date_com": "2017-01-22",
        "datechar": "1/22/2017"
    },
    {
        "lng": "120.982",
        "lat": "14.6561",
        "date": "2017-01-22",
        "customdate": "Sun - Jan 22, 2017",
        "time": "20:08:00",
        "customtime": "8:08:PM",
        "crime": "THEFT",
        "location": "Barangay 76, Kalookan City, Ncr District 3 (Northern), NCR",
        "region": "130000000",
        "province": "137500000",
        "modus": "Qualified Theft",
        "crimetype": "10",
        "station": "Police Station 01 Caloocan City",
        "moduscode": "mc66",
        "date_com": "2017-01-22",
        "datechar": "1/22/2017"
    },
    {
        "lng": "120.971",
        "lat": "14.6701",
        "date": "2017-01-23",
        "customdate": "Mon - Jan 23, 2017",
        "time": "16:00:00",
        "customtime": "4:00:PM",
        "crime": "THEFT",
        "location": "Acacia, Malabon City, Ncr District 3 (Northern), NCR",
        "region": "130000000",
        "province": "137500000",
        "modus": "Qualified Theft",
        "crimetype": "10",
        "station": "Police Station 02 Malabon City",
        "moduscode": "mc66",
        "date_com": "2017-01-23",
        "datechar": "1/23/2017"
    },
    {
        "lng": "120.985",
        "lat": "14.6574",
        "date": "2017-01-24",
        "customdate": "Tue - Jan 24, 2017",
        "time": "10:00:00",
        "customtime": "10:00:AM",
        "crime": "THEFT",
        "location": "Barangay 87, Kalookan City, Ncr District 3 (Northern), NCR",
        "region": "130000000",
        "province": "137500000",
        "modus": "Salisi",
        "crimetype": "10",
        "station": "Police Station 01 Caloocan City",
        "moduscode": "mc12",
        "date_com": "2017-01-24",
        "datechar": "1/24/2017"
    },
    {
        "lng": "120.948",
        "lat": "14.6568",
        "date": "2017-01-25",
        "customdate": "Wed - Jan 25, 2017",
        "time": "00:50:00",
        "customtime": "12:50:AM",
        "crime": "THEFT",
        "location": "Sipac-Almacen, Navotas, Ncr District 3 (Northern), NCR",
        "region": "130000000",
        "province": "137500000",
        "modus": "Qualified Theft",
        "crimetype": "10",
        "station": "Police Station 03 Navotas",
        "moduscode": "mc66",
        "date_com": "2017-01-25",
        "datechar": "1/25/2017"
    },
    {
        "lng": "120.953",
        "lat": "14.6503",
        "date": "2017-01-25",
        "customdate": "Wed - Jan 25, 2017",
        "time": "03:30:00",
        "customtime": "3:30:AM",
        "crime": "THEFT",
        "location": "Bangculasi, Navotas, Ncr District 3 (Northern), NCR",
        "region": "130000000",
        "province": "137500000",
        "modus": "Salisi",
        "crimetype": "10",
        "station": "Police Station 03 Navotas",
        "moduscode": "mc12",
        "date_com": "2017-01-25",
        "datechar": "1/25/2017"
    },
    {
        "lng": "120.961",
        "lat": "14.6877",
        "date": "2017-01-26",
        "customdate": "Thu - Jan 26, 2017",
        "time": "14:45:00",
        "customtime": "2:45:PM",
        "crime": "THEFT",
        "location": "Malinta, Valenzuela City, Ncr District 3 (Northern), NCR",
        "region": "130000000",
        "province": "137500000",
        "modus": "Salisi",
        "crimetype": "10",
        "station": "Police Station 04 Valenzuela City",
        "moduscode": "mc12",
        "date_com": "2017-01-26",
        "datechar": "1/26/2017"
    },
    {
        "lng": "120.983",
        "lat": "14.6566",
        "date": "2017-01-26",
        "customdate": "Thu - Jan 26, 2017",
        "time": "21:00:00",
        "customtime": "9:00:PM",
        "crime": "THEFT",
        "location": "Barangay 76, Kalookan City, Ncr District 3 (Northern), NCR",
        "region": "130000000",
        "province": "137500000",
        "modus": "Shoplifting",
        "crimetype": "10",
        "station": "Police Station 01 Caloocan City",
        "moduscode": "mc72",
        "date_com": "2017-01-26",
        "datechar": "1/26/2017"
    },
    {
        "lng": "120.997",
        "lat": "14.7345",
        "date": "2017-01-27",
        "customdate": "Fri - Jan 27, 2017",
        "time": "09:00:00",
        "customtime": "9:00:AM",
        "crime": "THEFT",
        "location": "Punturin, Valenzuela City, Ncr District 3 (Northern), NCR",
        "region": "130000000",
        "province": "137500000",
        "modus": "Salisi",
        "crimetype": "10",
        "station": "Police Station 04 Valenzuela City",
        "moduscode": "mc12",
        "date_com": "2017-01-27",
        "datechar": "1/27/2017"
    },
    {
        "lng": "120.954",
        "lat": "14.657",
        "date": "2017-01-27",
        "customdate": "Fri - Jan 27, 2017",
        "time": "17:30:00",
        "customtime": "5:30:PM",
        "crime": "THEFT",
        "location": "Tañong (Pob.), Malabon City, Ncr District 3 (Northern), NCR",
        "region": "130000000",
        "province": "137500000",
        "modus": "Salisi",
        "crimetype": "10",
        "station": "Police Station 02 Malabon City",
        "moduscode": "mc12",
        "date_com": "2017-01-27",
        "datechar": "1/27/2017"
    },
    {
        "lng": "120.983",
        "lat": "14.6571",
        "date": "2017-01-28",
        "customdate": "Sat - Jan 28, 2017",
        "time": "08:30:00",
        "customtime": "8:30:AM",
        "crime": "THEFT",
        "location": "Barangay 76, Kalookan City, Ncr District 3 (Northern), NCR",
        "region": "130000000",
        "province": "137500000",
        "modus": "Pick-Pocketing",
        "crimetype": "10",
        "station": "Police Station 01 Caloocan City",
        "moduscode": "mc13",
        "date_com": "2017-01-28",
        "datechar": "1/28/2017"
    },
    {
        "lng": "120.983",
        "lat": "14.6738",
        "date": "2017-01-28",
        "customdate": "Sat - Jan 28, 2017",
        "time": "19:10:00",
        "customtime": "7:10:PM",
        "crime": "THEFT",
        "location": "Marulas, Valenzuela City, Ncr District 3 (Northern), NCR",
        "region": "130000000",
        "province": "137500000",
        "modus": "Salisi",
        "crimetype": "10",
        "station": "Police Station 04 Valenzuela City",
        "moduscode": "mc12",
        "date_com": "2017-01-28",
        "datechar": "1/28/2017"
    },
    {
        "lng": "121.039",
        "lat": "14.7646",
        "date": "2017-01-28",
        "customdate": "Sat - Jan 28, 2017",
        "time": "13:00:00",
        "customtime": "1:00:PM",
        "crime": "THEFT",
        "location": "Barangay 175, Kalookan City, Ncr District 3 (Northern), NCR",
        "region": "130000000",
        "province": "137500000",
        "modus": "Salisi (Cellphone)",
        "crimetype": "10",
        "station": "Police Station 01 Caloocan City",
        "moduscode": "mc18",
        "date_com": "2017-01-28",
        "datechar": "1/28/2017"
    },
    {
        "lng": "120.966",
        "lat": "14.6464",
        "date": "2017-01-29",
        "customdate": "Sun - Jan 29, 2017",
        "time": "04:00:00",
        "customtime": "4:00:AM",
        "crime": "THEFT",
        "location": "Barangay 22, Kalookan City, Ncr District 3 (Northern), NCR",
        "region": "130000000",
        "province": "137500000",
        "modus": "Qualified Theft",
        "crimetype": "10",
        "station": "Police Station 01 Caloocan City",
        "moduscode": "mc66",
        "date_com": "2017-01-29",
        "datechar": "1/29/2017"
    },
    {
        "lng": "120.946",
        "lat": "14.6602",
        "date": "2017-01-30",
        "customdate": "Mon - Jan 30, 2017",
        "time": "08:00:00",
        "customtime": "8:00:AM",
        "crime": "THEFT",
        "location": "Sipac-Almacen, Navotas, Ncr District 3 (Northern), NCR",
        "region": "130000000",
        "province": "137500000",
        "modus": "Salisi",
        "crimetype": "10",
        "station": "Police Station 03 Navotas",
        "moduscode": "mc12",
        "date_com": "2017-01-30",
        "datechar": "1/30/2017"
    },
    {
        "lng": "121.027",
        "lat": "14.7475",
        "date": "2017-01-30",
        "customdate": "Mon - Jan 30, 2017",
        "time": "08:00:00",
        "customtime": "8:00:AM",
        "crime": "THEFT",
        "location": "Barangay 168, Kalookan City, Ncr District 3 (Northern), NCR",
        "region": "130000000",
        "province": "137500000",
        "modus": "Qualified Theft",
        "crimetype": "10",
        "station": "Police Station 01 Caloocan City",
        "moduscode": "mc66",
        "date_com": "2017-01-30",
        "datechar": "1/30/2017"
    },
    {
        "lng": "121",
        "lat": "14.6877",
        "date": "2017-02-01",
        "customdate": "Wed - Feb 1, 2017",
        "time": "11:05:00",
        "customtime": "11:05:AM",
        "crime": "THEFT",
        "location": "Hen. T. De Leon, Valenzuela City, Ncr District 3 (Northern), NCR",
        "region": "130000000",
        "province": "137500000",
        "modus": "Qualified Theft",
        "crimetype": "10",
        "station": "Police Station 04 Valenzuela City",
        "moduscode": "mc66",
        "date_com": "2017-02-01",
        "datechar": "2/1/2017"
    },
    {
        "lng": "121.039",
        "lat": "14.7661",
        "date": "2017-02-01",
        "customdate": "Wed - Feb 1, 2017",
        "time": "13:20:00",
        "customtime": "1:20:PM",
        "crime": "THEFT",
        "location": "Barangay 175, Kalookan City, Ncr District 3 (Northern), NCR",
        "region": "130000000",
        "province": "137500000",
        "modus": "Salisi",
        "crimetype": "10",
        "station": "Police Station 01 Caloocan City",
        "moduscode": "mc12",
        "date_com": "2017-02-01",
        "datechar": "2/1/2017"
    },
    {
        "lng": "120.983",
        "lat": "14.6677",
        "date": "2017-02-02",
        "customdate": "Thu - Feb 2, 2017",
        "time": "01:40:00",
        "customtime": "1:40:AM",
        "crime": "THEFT",
        "location": "Potrero, Malabon City, Ncr District 3 (Northern), NCR",
        "region": "130000000",
        "province": "137500000",
        "modus": "Plain Theft",
        "crimetype": "10",
        "station": "Police Station 02 Malabon City",
        "moduscode": "mc28",
        "date_com": "2017-02-02",
        "datechar": "2/2/2017"
    },
    {
        "lng": "121.014",
        "lat": "14.7052",
        "date": "2017-02-02",
        "customdate": "Thu - Feb 2, 2017",
        "time": "16:30:00",
        "customtime": "4:30:PM",
        "crime": "THEFT",
        "location": "Mapulang Lupa, Valenzuela City, Ncr District 3 (Northern), NCR",
        "region": "130000000",
        "province": "137500000",
        "modus": "Qualified Theft",
        "crimetype": "10",
        "station": "Police Station 04 Valenzuela City",
        "moduscode": "mc66",
        "date_com": "2017-02-02",
        "datechar": "2/2/2017"
    },
    {
        "lng": "121.01",
        "lat": "14.7542",
        "date": "2017-02-02",
        "customdate": "Thu - Feb 2, 2017",
        "time": "11:00:00",
        "customtime": "11:00:AM",
        "crime": "THEFT",
        "location": "Barangay 171, Kalookan City, Ncr District 3 (Northern), NCR",
        "region": "130000000",
        "province": "137500000",
        "modus": "Salisi",
        "crimetype": "10",
        "station": "Police Station 01 Caloocan City",
        "moduscode": "mc12",
        "date_com": "2017-02-02",
        "datechar": "2/2/2017"
    },
    {
        "lng": "120.967",
        "lat": "14.65",
        "date": "2017-02-02",
        "customdate": "Thu - Feb 2, 2017",
        "time": "18:00:00",
        "customtime": "6:00:PM",
        "crime": "THEFT",
        "location": "Barangay 14, Kalookan City, Ncr District 3 (Northern), NCR",
        "region": "130000000",
        "province": "137500000",
        "modus": "Plain Theft",
        "crimetype": "10",
        "station": "Police Station 01 Caloocan City",
        "moduscode": "mc28",
        "date_com": "2017-02-02",
        "datechar": "2/2/2017"
    },  
    {
        "lng": "121.016",
        "lat": "14.7035",
        "date": "2017-02-03",
        "customdate": "Fri - Feb 3, 2017",
        "time": "17:00:00",
        "customtime": "5:00:PM",
        "crime": "THEFT",
        "location": "Ugong, Valenzuela City, Ncr District 3 (Northern), NCR",
        "region": "130000000",
        "province": "137500000",
        "modus": "Qualified Theft",
        "crimetype": "10",
        "station": "Police Station 04 Valenzuela City",
        "moduscode": "mc66",
        "date_com": "2017-02-03",
        "datechar": "2/3/2017"
    },
    {
        "lng": "121.019",
        "lat": "14.7204",
        "date": "2017-02-04",
        "customdate": "Sat - Feb 4, 2017",
        "time": "03:30:00",
        "customtime": "3:30:AM",
        "crime": "THEFT",
        "location": "Barangay 166, Kalookan City, Ncr District 3 (Northern), NCR",
        "region": "130000000",
        "province": "137500000",
        "modus": "Salisi",
        "crimetype": "10",
        "station": "Police Station 01 Caloocan City",
        "moduscode": "mc12",
        "date_com": "2017-02-04",
        "datechar": "2/4/2017"
    },
    {
        "lng": "120.984",
        "lat": "14.6535",
        "date": "2017-02-04",
        "customdate": "Sat - Feb 4, 2017",
        "time": "07:30:00",
        "customtime": "7:30:AM",
        "crime": "THEFT",
        "location": "Barangay 90, Kalookan City, Ncr District 3 (Northern), NCR",
        "region": "130000000",
        "province": "137500000",
        "modus": "Plain Theft",
        "crimetype": "10",
        "station": "Police Station 01 Caloocan City",
        "moduscode": "mc28",
        "date_com": "2017-02-04",
        "datechar": "2/4/2017"
    },
    {
        "lng": "120.985",
        "lat": "14.6574",
        "date": "2017-02-04",
        "customdate": "Sat - Feb 4, 2017",
        "time": "19:00:00",
        "customtime": "7:00:PM",
        "crime": "THEFT",
        "location": "Barangay 81, Kalookan City, Ncr District 3 (Northern), NCR",
        "region": "130000000",
        "province": "137500000",
        "modus": "Pick-Pocketing",
        "crimetype": "10",
        "station": "Police Station 01 Caloocan City",
        "moduscode": "mc13",
        "date_com": "2017-02-04",
        "datechar": "2/4/2017"
    },
    {
        "lng": "120.993",
        "lat": "14.6911",
        "date": "2017-02-05",
        "customdate": "Sun - Feb 5, 2017",
        "time": "09:30:00",
        "customtime": "9:30:AM",
        "crime": "THEFT",
        "location": "Hen. T. De Leon, Valenzuela City, Ncr District 3 (Northern), NCR",
        "region": "130000000",
        "province": "137500000",
        "modus": "Qualified Theft",
        "crimetype": "10",
        "station": "Police Station 04 Valenzuela City",
        "moduscode": "mc66",
        "date_com": "2017-02-05",
        "datechar": "2/5/2017"
    },
    {
        "lng": "120.968",
        "lat": "14.6947",
        "date": "2017-02-06",
        "customdate": "Mon - Feb 6, 2017",
        "time": "07:37:00",
        "customtime": "7:37:AM",
        "crime": "THEFT",
        "location": "Malanday, Valenzuela City, Ncr District 3 (Northern), NCR",
        "region": "130000000",
        "province": "137500000",
        "modus": "Qualified Theft",
        "crimetype": "10",
        "station": "Police Station 04 Valenzuela City",
        "moduscode": "mc66",
        "date_com": "2017-02-06",
        "datechar": "2/6/2017"
    },   
    {
        "lng": "120.961",
        "lat": "14.6579",
        "date": "2017-02-08",
        "customdate": "Wed - Feb 8, 2017",
        "time": "19:15:00",
        "customtime": "7:15:PM",
        "crime": "THEFT",
        "location": "Longos, Malabon City, Ncr District 3 (Northern), NCR",
        "region": "130000000",
        "province": "137500000",
        "modus": "Shoplifting",
        "crimetype": "10",
        "station": "Police Station 02 Malabon City",
        "moduscode": "mc72",
        "date_com": "2017-02-08",
        "datechar": "2/8/2017"
    },
    {
        "lng": "120.967",
        "lat": "14.6507",
        "date": "2017-02-08",
        "customdate": "Wed - Feb 8, 2017",
        "time": "08:45:00",
        "customtime": "8:45:AM",
        "crime": "THEFT",
        "location": "Barangay 14, Kalookan City, Ncr District 3 (Northern), NCR",
        "region": "130000000",
        "province": "137500000",
        "modus": "Qualified Theft",
        "crimetype": "10",
        "station": "Police Station 01 Caloocan City",
        "moduscode": "mc66",
        "date_com": "2017-02-08",
        "datechar": "2/8/2017"
    },
    {
        "lng": "120.988",
        "lat": "14.7135",
        "date": "2017-02-08",
        "customdate": "Wed - Feb 8, 2017",
        "time": "10:00:00",
        "customtime": "10:00:AM",
        "crime": "THEFT",
        "location": "Canumay, Valenzuela City, Ncr District 3 (Northern), NCR",
        "region": "130000000",
        "province": "137500000",
        "modus": "Qualified Theft",
        "crimetype": "10",
        "station": "Police Station 04 Valenzuela City",
        "moduscode": "mc66",
        "date_com": "2017-02-08",
        "datechar": "2/8/2017"
    },
    {
        "lng": "121.081",
        "lat": "14.7695",
        "date": "2017-02-09",
        "customdate": "Thu - Feb 9, 2017",
        "time": "11:30:00",
        "customtime": "11:30:AM",
        "crime": "THEFT",
        "location": "Barangay 184, Kalookan City, Ncr District 3 (Northern), NCR",
        "region": "130000000",
        "province": "137500000",
        "modus": "Plain Theft",
        "crimetype": "10",
        "station": "Police Station 01 Caloocan City",
        "moduscode": "mc28",
        "date_com": "2017-02-09",
        "datechar": "2/9/2017"
    },
    {
        "lng": "120.967",
        "lat": "14.6693",
        "date": "2017-02-10",
        "customdate": "Fri - Feb 10, 2017",
        "time": "11:15:00",
        "customtime": "11:15:AM",
        "crime": "THEFT",
        "location": "Tinajeros, Malabon City, Ncr District 3 (Northern), NCR",
        "region": "130000000",
        "province": "137500000",
        "modus": "Shoplifting",
        "crimetype": "10",
        "station": "Police Station 02 Malabon City",
        "moduscode": "mc72",
        "date_com": "2017-02-10",
        "datechar": "2/10/2017"
    },
    {
        "lng": "120.984",
        "lat": "14.6544",
        "date": "2017-02-10",
        "customdate": "Fri - Feb 10, 2017",
        "time": "18:30:00",
        "customtime": "6:30:PM",
        "crime": "THEFT",
        "location": "Barangay 88, Kalookan City, Ncr District 3 (Northern), NCR",
        "region": "130000000",
        "province": "137500000",
        "modus": "Plain Theft",
        "crimetype": "10",
        "station": "Police Station 01 Caloocan City",
        "moduscode": "mc28",
        "date_com": "2017-02-10",
        "datechar": "2/10/2017"
    },
    {
        "lng": "120.961",
        "lat": "14.6578",
        "date": "2017-02-12",
        "customdate": "Sun - Feb 12, 2017",
        "time": "17:30:00",
        "customtime": "5:30:PM",
        "crime": "THEFT",
        "location": "Longos, Malabon City, Ncr District 3 (Northern), NCR",
        "region": "130000000",
        "province": "137500000",
        "modus": "Shoplifting",
        "crimetype": "10",
        "station": "Police Station 02 Malabon City",
        "moduscode": "mc72",
        "date_com": "2017-02-12",
        "datechar": "2/12/2017"
    },
    {
        "lng": "121.043",
        "lat": "14.7556",
        "date": "2017-02-12",
        "customdate": "Sun - Feb 12, 2017",
        "time": "13:00:00",
        "customtime": "1:00:PM",
        "crime": "THEFT",
        "location": "Barangay 172, Kalookan City, Ncr District 3 (Northern), NCR",
        "region": "130000000",
        "province": "137500000",
        "modus": "Shoplifting",
        "crimetype": "10",
        "station": "Police Station 01 Caloocan City",
        "moduscode": "mc72",
        "date_com": "2017-02-12",
        "datechar": "2/12/2017"
    },
    {
        "lng": "120.984",
        "lat": "14.6561",
        "date": "2017-02-12",
        "customdate": "Sun - Feb 12, 2017",
        "time": "22:50:00",
        "customtime": "10:50:PM",
        "crime": "THEFT",
        "location": "Barangay 76, Kalookan City, Ncr District 3 (Northern), NCR",
        "region": "130000000",
        "province": "137500000",
        "modus": "Pick-Pocketing",
        "crimetype": "10",
        "station": "Police Station 01 Caloocan City",
        "moduscode": "mc13",
        "date_com": "2017-02-12",
        "datechar": "2/12/2017"
    },
    {
        "lng": "120.986",
        "lat": "14.6569",
        "date": "2017-02-12",
        "customdate": "Sun - Feb 12, 2017",
        "time": "20:00:00",
        "customtime": "8:00:PM",
        "crime": "THEFT",
        "location": "Barangay 86, Kalookan City, Ncr District 3 (Northern), NCR",
        "region": "130000000",
        "province": "137500000",
        "modus": "Salisi",
        "crimetype": "10",
        "station": "Police Station 01 Caloocan City",
        "moduscode": "mc12",
        "date_com": "2017-02-12",
        "datechar": "2/12/2017"
    },
    {
        "lng": "120.974",
        "lat": "14.6577",
        "date": "2017-02-12",
        "customdate": "Sun - Feb 12, 2017",
        "time": "13:00:00",
        "customtime": "1:00:PM",
        "crime": "THEFT",
        "location": "Barangay 80, Kalookan City, Ncr District 3 (Northern), NCR",
        "region": "130000000",
        "province": "137500000",
        "modus": "Salisi",
        "crimetype": "10",
        "station": "Police Station 01 Caloocan City",
        "moduscode": "mc12",
        "date_com": "2017-02-12",
        "datechar": "2/12/2017"
    },
    {
        "lng": "120.985",
        "lat": "14.6432",
        "date": "2017-02-13",
        "customdate": "Mon - Feb 13, 2017",
        "time": "11:00:00",
        "customtime": "11:00:AM",
        "crime": "THEFT",
        "location": "Barangay 117, Kalookan City, Ncr District 3 (Northern), NCR",
        "region": "130000000",
        "province": "137500000",
        "modus": "Salisi",
        "crimetype": "10",
        "station": "Police Station 01 Caloocan City",
        "moduscode": "mc12",
        "date_com": "2017-02-13",
        "datechar": "2/13/2017"
    },
    {
        "lng": "120.939",
        "lat": "14.6835",
        "date": "2017-02-13",
        "customdate": "Mon - Feb 13, 2017",
        "time": "15:00:00",
        "customtime": "3:00:PM",
        "crime": "THEFT",
        "location": "Hulong Duhat, Malabon City, Ncr District 3 (Northern), NCR",
        "region": "130000000",
        "province": "137500000",
        "modus": "Plain Theft",
        "crimetype": "10",
        "station": "Police Station 02 Malabon City",
        "moduscode": "mc28",
        "date_com": "2017-02-13",
        "datechar": "2/13/2017"
    },
    {
        "lng": "120.975",
        "lat": "14.6411",
        "date": "2017-02-13",
        "customdate": "Mon - Feb 13, 2017",
        "time": "21:30:00",
        "customtime": "9:30:PM",
        "crime": "THEFT",
        "location": "Barangay 28, Kalookan City, Ncr District 3 (Northern), NCR",
        "region": "130000000",
        "province": "137500000",
        "modus": "Qualified Theft",
        "crimetype": "10",
        "station": "Police Station 01 Caloocan City",
        "moduscode": "mc66",
        "date_com": "2017-02-13",
        "datechar": "2/13/2017"
    },
    {
        "lng": "120.992",
        "lat": "14.6587",
        "date": "2017-02-13",
        "customdate": "Mon - Feb 13, 2017",
        "time": "15:00:00",
        "customtime": "3:00:PM",
        "crime": "THEFT",
        "location": "Barangay 134, Kalookan City, Ncr District 3 (Northern), NCR",
        "region": "130000000",
        "province": "137500000",
        "modus": "Qualified Theft",
        "crimetype": "10",
        "station": "Police Station 01 Caloocan City",
        "moduscode": "mc66",
        "date_com": "2017-02-13",
        "datechar": "2/13/2017"
    },
    {
        "lng": "120.957",
        "lat": "14.6776",
        "date": "2017-02-14",
        "customdate": "Tue - Feb 14, 2017",
        "time": "14:08:00",
        "customtime": "2:08:PM",
        "crime": "THEFT",
        "location": "Maysilo, Malabon City, Ncr District 3 (Northern), NCR",
        "region": "130000000",
        "province": "137500000",
        "modus": "Qualified Theft",
        "crimetype": "10",
        "station": "Police Station 02 Malabon City",
        "moduscode": "mc66",
        "date_com": "2017-02-14",
        "datechar": "2/14/2017"
    },
    {
        "lng": "121.085",
        "lat": "14.7666",
        "date": "2017-02-14",
        "customdate": "Tue - Feb 14, 2017",
        "time": "22:30:00",
        "customtime": "10:30:PM",
        "crime": "THEFT",
        "location": "Barangay 181, Kalookan City, Ncr District 3 (Northern), NCR",
        "region": "130000000",
        "province": "137500000",
        "modus": "Pick-Pocketing",
        "crimetype": "10",
        "station": "Police Station 01 Caloocan City",
        "moduscode": "mc13",
        "date_com": "2017-02-14",
        "datechar": "2/14/2017"
    },
    {
        "lng": "120.988",
        "lat": "14.6726",
        "date": "2017-02-15",
        "customdate": "Wed - Feb 15, 2017",
        "time": "15:30:00",
        "customtime": "3:30:PM",
        "crime": "THEFT",
        "location": "Marulas, Valenzuela City, Ncr District 3 (Northern), NCR",
        "region": "130000000",
        "province": "137500000",
        "modus": "Salisi",
        "crimetype": "10",
        "station": "Police Station 04 Valenzuela City",
        "moduscode": "mc12",
        "date_com": "2017-02-15",
        "datechar": "2/15/2017"
    },
    {
        "lng": "120.988",
        "lat": "14.6726",
        "date": "2017-02-15",
        "customdate": "Wed - Feb 15, 2017",
        "time": "15:30:00",
        "customtime": "3:30:PM",
        "crime": "THEFT",
        "location": "Marulas, Valenzuela City, Ncr District 3 (Northern), NCR",
        "region": "130000000",
        "province": "137500000",
        "modus": "Mauling",
        "crimetype": "10",
        "station": "Police Station 04 Valenzuela City",
        "moduscode": "mc92",
        "date_com": "2017-02-15",
        "datechar": "2/15/2017"
    },
    {
        "lng": "120.985",
        "lat": "14.6431",
        "date": "2017-02-15",
        "customdate": "Wed - Feb 15, 2017",
        "time": "14:00:00",
        "customtime": "2:00:PM",
        "crime": "THEFT",
        "location": "Barangay 117, Kalookan City, Ncr District 3 (Northern), NCR",
        "region": "130000000",
        "province": "137500000",
        "modus": "Plain Theft",
        "crimetype": "10",
        "station": "Police Station 01 Caloocan City",
        "moduscode": "mc28",
        "date_com": "2017-02-15",
        "datechar": "2/15/2017"
    },
    {
        "lng": "120.959",
        "lat": "14.6425",
        "date": "2017-02-16",
        "customdate": "Thu - Feb 16, 2017",
        "time": "17:00:00",
        "customtime": "5:00:PM",
        "crime": "THEFT",
        "location": "North Bay Blvd., South, Navotas, Ncr District 3 (Northern), NCR",
        "region": "130000000",
        "province": "137500000",
        "modus": "Salisi",
        "crimetype": "10",
        "station": "Police Station 03 Navotas",
        "moduscode": "mc12",
        "date_com": "2017-02-16",
        "datechar": "2/16/2017"
    },
    {
        "lng": "120.993",
        "lat": "14.6506",
        "date": "2017-02-17",
        "customdate": "Fri - Feb 17, 2017",
        "time": "08:00:00",
        "customtime": "8:00:AM",
        "crime": "THEFT",
        "location": "Barangay 101, Kalookan City, Ncr District 3 (Northern), NCR",
        "region": "130000000",
        "province": "137500000",
        "modus": "Petnapping",
        "crimetype": "10",
        "station": "Police Station 01 Caloocan City",
        "moduscode": "mc65",
        "date_com": "2017-02-17",
        "datechar": "2/17/2017"
    },
    {
        "lng": "120.953",
        "lat": "14.6545",
        "date": "2017-02-18",
        "customdate": "Sat - Feb 18, 2017",
        "time": "11:00:00",
        "customtime": "11:00:AM",
        "crime": "THEFT",
        "location": "Tañong (Pob.), Malabon City, Ncr District 3 (Northern), NCR",
        "region": "130000000",
        "province": "137500000",
        "modus": "Plain Theft",
        "crimetype": "10",
        "station": "Police Station 02 Malabon City",
        "moduscode": "mc28",
        "date_com": "2017-02-18",
        "datechar": "2/18/2017"
    },
    {
        "lng": "120.94",
        "lat": "14.6678",
        "date": "2017-02-18",
        "customdate": "Sat - Feb 18, 2017",
        "time": "11:00:00",
        "customtime": "11:00:AM",
        "crime": "THEFT",
        "location": "Daanghari, Navotas, Ncr District 3 (Northern), NCR",
        "region": "130000000",
        "province": "137500000",
        "modus": "Salisi",
        "crimetype": "10",
        "station": "Police Station 03 Navotas",
        "moduscode": "mc12",
        "date_com": "2017-02-18",
        "datechar": "2/18/2017"
    },
    {
        "lng": "121.043",
        "lat": "14.7563",
        "date": "2017-02-18",
        "customdate": "Sat - Feb 18, 2017",
        "time": "18:50:00",
        "customtime": "6:50:PM",
        "crime": "THEFT",
        "location": "Barangay 175, Kalookan City, Ncr District 3 (Northern), NCR",
        "region": "130000000",
        "province": "137500000",
        "modus": "Shoplifting",
        "crimetype": "10",
        "station": "Police Station 01 Caloocan City",
        "moduscode": "mc72",
        "date_com": "2017-02-18",
        "datechar": "2/18/2017"
    },
    {
        "lng": "120.961",
        "lat": "14.6804",
        "date": "2017-02-18",
        "customdate": "Sat - Feb 18, 2017",
        "time": "15:00:00",
        "customtime": "3:00:PM",
        "crime": "THEFT",
        "location": "Maysilo, Malabon City, Ncr District 3 (Northern), NCR",
        "region": "130000000",
        "province": "137500000",
        "modus": "Qualified Theft",
        "crimetype": "10",
        "station": "Police Station 02 Malabon City",
        "moduscode": "mc66",
        "date_com": "2017-02-18",
        "datechar": "2/18/2017"
    },
    {
        "lng": "121.036",
        "lat": "14.7475",
        "date": "2017-02-20",
        "customdate": "Mon - Feb 20, 2017",
        "time": "02:30:00",
        "customtime": "2:30:AM",
        "crime": "THEFT",
        "location": "Barangay 173, Kalookan City, Ncr District 3 (Northern), NCR",
        "region": "130000000",
        "province": "137500000",
        "modus": "Salisi",
        "crimetype": "10",
        "station": "Police Station 01 Caloocan City",
        "moduscode": "mc12",
        "date_com": "2017-02-20",
        "datechar": "2/20/2017"
    },
    {
        "lng": "120.984",
        "lat": "14.6544",
        "date": "2017-02-20",
        "customdate": "Mon - Feb 20, 2017",
        "time": "21:20:00",
        "customtime": "9:20:PM",
        "crime": "THEFT",
        "location": "Barangay 88, Kalookan City, Ncr District 3 (Northern), NCR",
        "region": "130000000",
        "province": "137500000",
        "modus": "Plain Theft",
        "crimetype": "10",
        "station": "Police Station 01 Caloocan City",
        "moduscode": "mc28",
        "date_com": "2017-02-20",
        "datechar": "2/20/2017"
    },
    {
        "lng": "121.002",
        "lat": "14.7079",
        "date": "2017-02-21",
        "customdate": "Tue - Feb 21, 2017",
        "time": "05:15:00",
        "customtime": "5:15:AM",
        "crime": "THEFT",
        "location": "Paso De Blas, Valenzuela City, Ncr District 3 (Northern), NCR",
        "region": "130000000",
        "province": "137500000",
        "modus": "Salisi",
        "crimetype": "10",
        "station": "Police Station 04 Valenzuela City",
        "moduscode": "mc12",
        "date_com": "2017-02-21",
        "datechar": "2/21/2017"
    },
    {
        "lng": "120.936",
        "lat": "14.6795",
        "date": "2017-02-21",
        "customdate": "Tue - Feb 21, 2017",
        "time": "03:00:00",
        "customtime": "3:00:AM",
        "crime": "THEFT",
        "location": "Tanza, Navotas, Ncr District 3 (Northern), NCR",
        "region": "130000000",
        "province": "137500000",
        "modus": "Salisi (Akyat Bahay)",
        "crimetype": "10",
        "station": "Police Station 03 Navotas",
        "moduscode": "mc67",
        "date_com": "2017-02-21",
        "datechar": "2/21/2017"
    },
    {
        "lng": "120.987",
        "lat": "14.7022",
        "date": "2017-02-21",
        "customdate": "Tue - Feb 21, 2017",
        "time": "11:30:00",
        "customtime": "11:30:AM",
        "crime": "THEFT",
        "location": "Hen. T. De Leon, Valenzuela City, Ncr District 3 (Northern), NCR",
        "region": "130000000",
        "province": "137500000",
        "modus": "Salisi",
        "crimetype": "10",
        "station": "Police Station 04 Valenzuela City",
        "moduscode": "mc12",
        "date_com": "2017-02-21",
        "datechar": "2/21/2017"
    },
    {
        "lng": "120.981",
        "lat": "14.6534",
        "date": "2017-02-21",
        "customdate": "Tue - Feb 21, 2017",
        "time": "03:13:00",
        "customtime": "3:13:AM",
        "crime": "THEFT",
        "location": "Barangay 67, Kalookan City, Ncr District 3 (Northern), NCR",
        "region": "130000000",
        "province": "137500000",
        "modus": "Parts and Accessories of Motor Vehicle",
        "crimetype": "10",
        "station": "Police Station 01 Caloocan City",
        "moduscode": "mc14",
        "date_com": "2017-02-21",
        "datechar": "2/21/2017"
    },
    {
        "lng": "120.994",
        "lat": "14.6568",
        "date": "2017-02-22",
        "customdate": "Wed - Feb 22, 2017",
        "time": "11:00:00",
        "customtime": "11:00:AM",
        "crime": "THEFT",
        "location": "Barangay 87, Kalookan City, Ncr District 3 (Northern), NCR",
        "region": "130000000",
        "province": "137500000",
        "modus": "Qualified Theft",
        "crimetype": "10",
        "station": "Police Station 01 Caloocan City",
        "moduscode": "mc66",
        "date_com": "2017-02-22",
        "datechar": "2/22/2017"
    },
    {
        "lng": "120.945",
        "lat": "14.6741",
        "date": "2017-02-23",
        "customdate": "Thu - Feb 23, 2017",
        "time": "08:45:00",
        "customtime": "8:45:AM",
        "crime": "THEFT",
        "location": "Bayan-Bayanan, Malabon City, Ncr District 3 (Northern), NCR",
        "region": "130000000",
        "province": "137500000",
        "modus": "Salisi",
        "crimetype": "10",
        "station": "Police Station 02 Malabon City",
        "moduscode": "mc12",
        "date_com": "2017-02-23",
        "datechar": "2/23/2017"
    },
    {
        "lng": "120.994",
        "lat": "14.6548",
        "date": "2017-02-24",
        "customdate": "Fri - Feb 24, 2017",
        "time": "11:35:00",
        "customtime": "11:35:AM",
        "crime": "THEFT",
        "location": "Barangay 96, Kalookan City, Ncr District 3 (Northern), NCR",
        "region": "130000000",
        "province": "137500000",
        "modus": "Salisi",
        "crimetype": "10",
        "station": "Police Station 01 Caloocan City",
        "moduscode": "mc12",
        "date_com": "2017-02-24",
        "datechar": "2/24/2017"
    },
    {
        "lng": "120.959",
        "lat": "14.6526",
        "date": "2017-02-25",
        "customdate": "Sat - Feb 25, 2017",
        "time": "03:00:00",
        "customtime": "3:00:AM",
        "crime": "THEFT",
        "location": "Longos, Malabon City, Ncr District 3 (Northern), NCR",
        "region": "130000000",
        "province": "137500000",
        "modus": "Basag Salamin",
        "crimetype": "10",
        "station": "Police Station 02 Malabon City",
        "moduscode": "mc18",
        "date_com": "2017-02-25",
        "datechar": "2/25/2017"
    },
    {
        "lng": "121.04",
        "lat": "14.7435",
        "date": "2017-02-26",
        "customdate": "Sun - Feb 26, 2017",
        "time": "17:00:00",
        "customtime": "5:00:PM",
        "crime": "THEFT",
        "location": "Barangay 172, Kalookan City, Ncr District 3 (Northern), NCR",
        "region": "130000000",
        "province": "137500000",
        "modus": "Applied as Helper",
        "crimetype": "10",
        "station": "Police Station 01 Caloocan City",
        "moduscode": "mc59",
        "date_com": "2017-02-26",
        "datechar": "2/26/2017"
    },
    {
        "lng": "121.043",
        "lat": "14.7744",
        "date": "2017-02-27",
        "customdate": "Mon - Feb 27, 2017",
        "time": "21:30:00",
        "customtime": "9:30:PM",
        "crime": "THEFT",
        "location": "Barangay 176, Kalookan City, Ncr District 3 (Northern), NCR",
        "region": "130000000",
        "province": "137500000",
        "modus": "Plain Theft",
        "crimetype": "10",
        "station": "Police Station 01 Caloocan City",
        "moduscode": "mc28",
        "date_com": "2017-02-27",
        "datechar": "2/27/2017"
    },
    {
        "lng": "120.976",
        "lat": "14.6359",
        "date": "2017-02-27",
        "customdate": "Mon - Feb 27, 2017",
        "time": "01:00:00",
        "customtime": "1:00:AM",
        "crime": "THEFT",
        "location": "Barangay 33, Kalookan City, Ncr District 3 (Northern), NCR",
        "region": "130000000",
        "province": "137500000",
        "modus": "Salisi",
        "crimetype": "10",
        "station": "Police Station 01 Caloocan City",
        "moduscode": "mc12",
        "date_com": "2017-02-27",
        "datechar": "2/27/2017"
    },
    {
        "lng": "120.983",
        "lat": "14.657",
        "date": "2017-02-27",
        "customdate": "Mon - Feb 27, 2017",
        "time": "19:45:00",
        "customtime": "7:45:PM",
        "crime": "THEFT",
        "location": "Barangay 76, Kalookan City, Ncr District 3 (Northern), NCR",
        "region": "130000000",
        "province": "137500000",
        "modus": "Pick-Pocketing",
        "crimetype": "10",
        "station": "Police Station 01 Caloocan City",
        "moduscode": "mc13",
        "date_com": "2017-02-27",
        "datechar": "2/27/2017"
    },
    {
        "lng": "120.986",
        "lat": "14.6564",
        "date": "2017-02-28",
        "customdate": "Tue - Feb 28, 2017",
        "time": "02:45:00",
        "customtime": "2:45:AM",
        "crime": "THEFT",
        "location": "Barangay 81, Kalookan City, Ncr District 3 (Northern), NCR",
        "region": "130000000",
        "province": "137500000",
        "modus": "Salisi",
        "crimetype": "10",
        "station": "Police Station 01 Caloocan City",
        "moduscode": "mc12",
        "date_com": "2017-02-28",
        "datechar": "2/28/2017"
    },
    {
        "lng": "121.054",
        "lat": "14.7563",
        "date": "2017-02-28",
        "customdate": "Tue - Feb 28, 2017",
        "time": "18:00:00",
        "customtime": "6:00:PM",
        "crime": "THEFT",
        "location": "Barangay 178, Kalookan City, Ncr District 3 (Northern), NCR",
        "region": "130000000",
        "province": "137500000",
        "modus": "Qualified Theft",
        "crimetype": "10",
        "station": "Police Station 01 Caloocan City",
        "moduscode": "mc66",
        "date_com": "2017-02-28",
        "datechar": "2/28/2017"
    },
    {
        "lng": "121.055",
        "lat": "14.7715",
        "date": "2017-03-01",
        "customdate": "Wed - Mar 1, 2017",
        "time": "04:00:00",
        "customtime": "4:00:AM",
        "crime": "THEFT",
        "location": "Barangay 176, Kalookan City, Ncr District 3 (Northern), NCR",
        "region": "130000000",
        "province": "137500000",
        "modus": "Salisi (Akyat Bahay)",
        "crimetype": "10",
        "station": "Police Station 01 Caloocan City",
        "moduscode": "mc67",
        "date_com": "2017-03-01",
        "datechar": "3/1/2017"
    },
    {
        "lng": "120.966",
        "lat": "14.6684",
        "date": "2017-03-01",
        "customdate": "Wed - Mar 1, 2017",
        "time": "20:30:00",
        "customtime": "8:30:PM",
        "crime": "THEFT",
        "location": "Tinajeros, Malabon City, Ncr District 3 (Northern), NCR",
        "region": "130000000",
        "province": "137500000",
        "modus": "Shoplifting",
        "crimetype": "10",
        "station": "Police Station 02 Malabon City",
        "moduscode": "mc72",
        "date_com": "2017-03-01",
        "datechar": "3/1/2017"
    },
    {
        "lng": "120.952",
        "lat": "14.6475",
        "date": "2017-03-01",
        "customdate": "Wed - Mar 1, 2017",
        "time": "16:35:00",
        "customtime": "4:35:PM",
        "crime": "THEFT",
        "location": "North Bay Blvd., North, Navotas, Ncr District 3 (Northern), NCR",
        "region": "130000000",
        "province": "137500000",
        "modus": "Salisi",
        "crimetype": "10",
        "station": "Police Station 03 Navotas",
        "moduscode": "mc12",
        "date_com": "2017-03-01",
        "datechar": "3/1/2017"
    },
    {
        "lng": "120.947",
        "lat": "14.6583",
        "date": "2017-03-02",
        "customdate": "Thu - Mar 2, 2017",
        "time": "17:20:00",
        "customtime": "5:20:PM",
        "crime": "THEFT",
        "location": "Sipac-Almacen, Navotas, Ncr District 3 (Northern), NCR",
        "region": "130000000",
        "province": "137500000",
        "modus": "Shoplifting",
        "crimetype": "10",
        "station": "Police Station 03 Navotas",
        "moduscode": "mc72",
        "date_com": "2017-03-02",
        "datechar": "3/2/2017"
    },
    {
        "lng": "120.957",
        "lat": "14.6518",
        "date": "2017-03-02",
        "customdate": "Thu - Mar 2, 2017",
        "time": "10:05:00",
        "customtime": "10:05:AM",
        "crime": "THEFT",
        "location": "Longos, Malabon City, Ncr District 3 (Northern), NCR",
        "region": "130000000",
        "province": "137500000",
        "modus": "Qualified Theft",
        "crimetype": "10",
        "station": "Police Station 02 Malabon City",
        "moduscode": "mc66",
        "date_com": "2017-03-02",
        "datechar": "3/2/2017"
    },
    {
        "lng": "120.963",
        "lat": "14.6786",
        "date": "2017-03-02",
        "customdate": "Thu - Mar 2, 2017",
        "time": "03:20:00",
        "customtime": "3:20:AM",
        "crime": "THEFT",
        "location": "Santolan, Malabon City, Ncr District 3 (Northern), NCR",
        "region": "130000000",
        "province": "137500000",
        "modus": "Salisi",
        "crimetype": "10",
        "station": "Police Station 02 Malabon City",
        "moduscode": "mc12",
        "date_com": "2017-03-02",
        "datechar": "3/2/2017"
    },
    {
        "lng": "120.987",
        "lat": "14.6548",
        "date": "2017-03-03",
        "customdate": "Fri - Mar 3, 2017",
        "time": "05:00:00",
        "customtime": "5:00:AM",
        "crime": "THEFT",
        "location": "Barangay 88, Kalookan City, Ncr District 3 (Northern), NCR",
        "region": "130000000",
        "province": "137500000",
        "modus": "Plain Theft",
        "crimetype": "10",
        "station": "Police Station 01 Caloocan City",
        "moduscode": "mc28",
        "date_com": "2017-03-03",
        "datechar": "3/3/2017"
    },
    {
        "lng": "121.017",
        "lat": "14.7308",
        "date": "2017-03-03",
        "customdate": "Fri - Mar 3, 2017",
        "time": "00:00:00",
        "customtime": "12:00:AM",
        "crime": "THEFT",
        "location": "Barangay 167, Kalookan City, Ncr District 3 (Northern), NCR",
        "region": "130000000",
        "province": "137500000",
        "modus": "Salisi",
        "crimetype": "10",
        "station": "Police Station 01 Caloocan City",
        "moduscode": "mc12",
        "date_com": "2017-03-03",
        "datechar": "3/3/2017"
    },
    {
        "lng": "120.966",
        "lat": "14.6377",
        "date": "2017-03-03",
        "customdate": "Fri - Mar 3, 2017",
        "time": "20:00:00",
        "customtime": "8:00:PM",
        "crime": "THEFT",
        "location": "San Rafael Village, Navotas, Ncr District 3 (Northern), NCR",
        "region": "130000000",
        "province": "137500000",
        "modus": "Qualified Theft",
        "crimetype": "10",
        "station": "Police Station 03 Navotas",
        "moduscode": "mc66",
        "date_com": "2017-03-03",
        "datechar": "3/3/2017"
    },
    {
        "lng": "120.997",
        "lat": "14.656",
        "date": "2017-03-03",
        "customdate": "Fri - Mar 3, 2017",
        "time": "12:00:00",
        "customtime": "12:00:PM",
        "crime": "THEFT",
        "location": "Barangay 95, Kalookan City, Ncr District 3 (Northern), NCR",
        "region": "130000000",
        "province": "137500000",
        "modus": "Salisi",
        "crimetype": "10",
        "station": "Police Station 01 Caloocan City",
        "moduscode": "mc12",
        "date_com": "2017-03-03",
        "datechar": "3/3/2017"
    },
    {
        "lng": "120.972",
        "lat": "14.6512",
        "date": "2017-03-04",
        "customdate": "Sat - Mar 4, 2017",
        "time": "03:53:00",
        "customtime": "3:53:AM",
        "crime": "THEFT",
        "location": "Barangay 16, Kalookan City, Ncr District 3 (Northern), NCR",
        "region": "130000000",
        "province": "137500000",
        "modus": "Salisi (Others)",
        "crimetype": "10",
        "station": "Police Station 01 Caloocan City",
        "moduscode": "mc69",
        "date_com": "2017-03-04",
        "datechar": "3/4/2017"
    },
    {
        "lng": "120.939",
        "lat": "14.6709",
        "date": "2017-03-04",
        "customdate": "Sat - Mar 4, 2017",
        "time": "20:00:00",
        "customtime": "8:00:PM",
        "crime": "THEFT",
        "location": "San Roque, Navotas, Ncr District 3 (Northern), NCR",
        "region": "130000000",
        "province": "137500000",
        "modus": "Qualified Theft",
        "crimetype": "10",
        "station": "Police Station 03 Navotas",
        "moduscode": "mc66",
        "date_com": "2017-03-04",
        "datechar": "3/4/2017"
    },
    {
        "lng": "120.952",
        "lat": "14.6465",
        "date": "2017-03-04",
        "customdate": "Sat - Mar 4, 2017",
        "time": "22:00:00",
        "customtime": "10:00:PM",
        "crime": "THEFT",
        "location": "North Bay Blvd., North, Navotas, Ncr District 3 (Northern), NCR",
        "region": "130000000",
        "province": "137500000",
        "modus": "Salisi",
        "crimetype": "10",
        "station": "Police Station 03 Navotas",
        "moduscode": "mc12",
        "date_com": "2017-03-04",
        "datechar": "3/4/2017"
    },
    {
        "lng": "121.004",
        "lat": "14.6975",
        "date": "2017-03-07",
        "customdate": "Tue - Mar 7, 2017",
        "time": "09:00:00",
        "customtime": "9:00:AM",
        "crime": "THEFT",
        "location": "Mapulang Lupa, Valenzuela City, Ncr District 3 (Northern), NCR",
        "region": "130000000",
        "province": "137500000",
        "modus": "Qualified Theft",
        "crimetype": "10",
        "station": "Police Station 04 Valenzuela City",
        "moduscode": "mc66",
        "date_com": "2017-03-07",
        "datechar": "3/7/2017"
    },
    {
        "lng": "120.997",
        "lat": "14.6579",
        "date": "2017-03-07",
        "customdate": "Tue - Mar 7, 2017",
        "time": "15:30:00",
        "customtime": "3:30:PM",
        "crime": "THEFT",
        "location": "Barangay 138, Kalookan City, Ncr District 3 (Northern), NCR",
        "region": "130000000",
        "province": "137500000",
        "modus": "Cable/Electric Meter",
        "crimetype": "10",
        "station": "Police Station 01 Caloocan City",
        "moduscode": "mc61",
        "date_com": "2017-03-07",
        "datechar": "3/7/2017"
    },
    {
        "lng": "120.949",
        "lat": "14.6527",
        "date": "2017-03-08",
        "customdate": "Wed - Mar 8, 2017",
        "time": "19:35:00",
        "customtime": "7:35:PM",
        "crime": "THEFT",
        "location": "Bagumbayan North, Navotas, Ncr District 3 (Northern), NCR",
        "region": "130000000",
        "province": "137500000",
        "modus": "Salisi (Others)",
        "crimetype": "10",
        "station": "Police Station 03 Navotas",
        "moduscode": "mc69",
        "date_com": "2017-03-08",
        "datechar": "3/8/2017"
    },
    {
        "lng": "121.04",
        "lat": "14.7736",
        "date": "2017-03-09",
        "customdate": "Thu - Mar 9, 2017",
        "time": "20:30:00",
        "customtime": "8:30:PM",
        "crime": "THEFT",
        "location": "Barangay 176, Kalookan City, Ncr District 3 (Northern), NCR",
        "region": "130000000",
        "province": "137500000",
        "modus": "Qualified Theft",
        "crimetype": "10",
        "station": "Police Station 01 Caloocan City",
        "moduscode": "mc66",
        "date_com": "2017-03-09",
        "datechar": "3/9/2017"
    },
    {
        "lng": "120.994",
        "lat": "14.652",
        "date": "2017-03-09",
        "customdate": "Thu - Mar 9, 2017",
        "time": "08:00:00",
        "customtime": "8:00:AM",
        "crime": "THEFT",
        "location": "Barangay 97, Kalookan City, Ncr District 3 (Northern), NCR",
        "region": "130000000",
        "province": "137500000",
        "modus": "Salisi",
        "crimetype": "10",
        "station": "Police Station 01 Caloocan City",
        "moduscode": "mc12",
        "date_com": "2017-03-09",
        "datechar": "3/9/2017"
    },
    {
        "lng": "121.049",
        "lat": "14.7695",
        "date": "2017-03-10",
        "customdate": "Fri - Mar 10, 2017",
        "time": "00:35:00",
        "customtime": "12:35:AM",
        "crime": "THEFT",
        "location": "Barangay 176, Kalookan City, Ncr District 3 (Northern), NCR",
        "region": "130000000",
        "province": "137500000",
        "modus": "Qualified Theft",
        "crimetype": "10",
        "station": "Police Station 01 Caloocan City",
        "moduscode": "mc66",
        "date_com": "2017-03-10",
        "datechar": "3/10/2017"
    },
    {
        "lng": "120.973",
        "lat": "14.707",
        "date": "2017-03-10",
        "customdate": "Fri - Mar 10, 2017",
        "time": "02:30:00",
        "customtime": "2:30:AM",
        "crime": "THEFT",
        "location": "Viente Reales, Valenzuela City, Ncr District 3 (Northern), NCR",
        "region": "130000000",
        "province": "137500000",
        "modus": "Plain Theft",
        "crimetype": "10",
        "station": "Police Station 04 Valenzuela City",
        "moduscode": "mc28",
        "date_com": "2017-03-10",
        "datechar": "3/10/2017"
    },
    {
        "lng": "120.984",
        "lat": "14.6555",
        "date": "2017-03-12",
        "customdate": "Sun - Mar 12, 2017",
        "time": "13:00:00",
        "customtime": "1:00:PM",
        "crime": "THEFT",
        "location": "Barangay 76, Kalookan City, Ncr District 3 (Northern), NCR",
        "region": "130000000",
        "province": "137500000",
        "modus": "Pick-Pocketing",
        "crimetype": "10",
        "station": "Police Station 01 Caloocan City",
        "moduscode": "mc13",
        "date_com": "2017-03-12",
        "datechar": "3/12/2017"
    },
    {
        "lng": "121.035",
        "lat": "14.7498",
        "date": "2017-03-12",
        "customdate": "Sun - Mar 12, 2017",
        "time": "06:45:00",
        "customtime": "6:45:AM",
        "crime": "THEFT",
        "location": "Barangay 173, Kalookan City, Ncr District 3 (Northern), NCR",
        "region": "130000000",
        "province": "137500000",
        "modus": "Vehicle Parts Theft",
        "crimetype": "10",
        "station": "Police Station 01 Caloocan City",
        "moduscode": "mc75",
        "date_com": "2017-03-12",
        "datechar": "3/12/2017"
    },
    {
        "lng": "121.038",
        "lat": "14.7645",
        "date": "2017-03-13",
        "customdate": "Mon - Mar 13, 2017",
        "time": "20:50:00",
        "customtime": "8:50:PM",
        "crime": "THEFT",
        "location": "Barangay 175, Kalookan City, Ncr District 3 (Northern), NCR",
        "region": "130000000",
        "province": "137500000",
        "modus": "Shoplifting",
        "crimetype": "10",
        "station": "Police Station 01 Caloocan City",
        "moduscode": "mc72",
        "date_com": "2017-03-13",
        "datechar": "3/13/2017"
    },
    {
        "lng": "121.04",
        "lat": "14.7643",
        "date": "2017-03-13",
        "customdate": "Mon - Mar 13, 2017",
        "time": "16:00:00",
        "customtime": "4:00:PM",
        "crime": "THEFT",
        "location": "Barangay 175, Kalookan City, Ncr District 3 (Northern), NCR",
        "region": "130000000",
        "province": "137500000",
        "modus": "Shoplifting",
        "crimetype": "10",
        "station": "Police Station 01 Caloocan City",
        "moduscode": "mc72",
        "date_com": "2017-03-13",
        "datechar": "3/13/2017"
    },
    {
        "lng": "120.955",
        "lat": "14.6433",
        "date": "2017-03-13",
        "customdate": "Mon - Mar 13, 2017",
        "time": "13:15:00",
        "customtime": "1:15:PM",
        "crime": "THEFT",
        "location": "North Bay Blvd., South, Navotas, Ncr District 3 (Northern), NCR",
        "region": "130000000",
        "province": "137500000",
        "modus": "Salisi",
        "crimetype": "10",
        "station": "Police Station 03 Navotas",
        "moduscode": "mc12",
        "date_com": "2017-03-13",
        "datechar": "3/13/2017"
    },
    {
        "lng": "120.98",
        "lat": "14.6819",
        "date": "2017-03-14",
        "customdate": "Tue - Mar 14, 2017",
        "time": "12:00:00",
        "customtime": "12:00:PM",
        "crime": "THEFT",
        "location": "Marulas, Valenzuela City, Ncr District 3 (Northern), NCR",
        "region": "130000000",
        "province": "137500000",
        "modus": "Shoplifting",
        "crimetype": "10",
        "station": "Police Station 04 Valenzuela City",
        "moduscode": "mc72",
        "date_com": "2017-03-14",
        "datechar": "3/14/2017"
    },
    {
        "lng": "121.002",
        "lat": "14.6884",
        "date": "2017-03-14",
        "customdate": "Tue - Mar 14, 2017",
        "time": "18:20:00",
        "customtime": "6:20:PM",
        "crime": "THEFT",
        "location": "Ugong, Valenzuela City, Ncr District 3 (Northern), NCR",
        "region": "130000000",
        "province": "137500000",
        "modus": "Plain Theft",
        "crimetype": "10",
        "station": "Police Station 04 Valenzuela City",
        "moduscode": "mc28",
        "date_com": "2017-03-14",
        "datechar": "3/14/2017"
    },
    {
        "lng": "120.986",
        "lat": "14.6751",
        "date": "2017-03-14",
        "customdate": "Tue - Mar 14, 2017",
        "time": "13:00:00",
        "customtime": "1:00:PM",
        "crime": "THEFT",
        "location": "Marulas, Valenzuela City, Ncr District 3 (Northern), NCR",
        "region": "130000000",
        "province": "137500000",
        "modus": "Qualified Theft",
        "crimetype": "10",
        "station": "Police Station 04 Valenzuela City",
        "moduscode": "mc66",
        "date_com": "2017-03-14",
        "datechar": "3/14/2017"
    },
    {
        "lng": "120.983",
        "lat": "14.6559",
        "date": "2017-03-15",
        "customdate": "Wed - Mar 15, 2017",
        "time": "04:30:00",
        "customtime": "4:30:AM",
        "crime": "THEFT",
        "location": "Barangay 72, Kalookan City, Ncr District 3 (Northern), NCR",
        "region": "130000000",
        "province": "137500000",
        "modus": "Salisi (Establishment)",
        "crimetype": "10",
        "station": "Police Station 01 Caloocan City",
        "moduscode": "mc68",
        "date_com": "2017-03-15",
        "datechar": "3/15/2017"
    },
    {
        "lng": "120.971",
        "lat": "14.6591",
        "date": "2017-03-15",
        "customdate": "Wed - Mar 15, 2017",
        "time": "15:25:00",
        "customtime": "3:25:PM",
        "crime": "THEFT",
        "location": "Barangay 3, Kalookan City, Ncr District 3 (Northern), NCR",
        "region": "130000000",
        "province": "137500000",
        "modus": "Shoplifting",
        "crimetype": "10",
        "station": "Police Station 01 Caloocan City",
        "moduscode": "mc72",
        "date_com": "2017-03-15",
        "datechar": "3/15/2017"
    },
    {
        "lng": "121.045",
        "lat": "14.7504",
        "date": "2017-03-15",
        "customdate": "Wed - Mar 15, 2017",
        "time": "03:30:00",
        "customtime": "3:30:AM",
        "crime": "THEFT",
        "location": "Barangay 177, Kalookan City, Ncr District 3 (Northern), NCR",
        "region": "130000000",
        "province": "137500000",
        "modus": "Salisi (Akyat Bahay)",
        "crimetype": "10",
        "station": "Police Station 01 Caloocan City",
        "moduscode": "mc67",
        "date_com": "2017-03-15",
        "datechar": "3/15/2017"
    },
    {
        "lng": "120.966",
        "lat": "14.6924",
        "date": "2017-03-15",
        "customdate": "Wed - Mar 15, 2017",
        "time": "11:40:00",
        "customtime": "11:40:AM",
        "crime": "THEFT",
        "location": "Malinta, Valenzuela City, Ncr District 3 (Northern), NCR",
        "region": "130000000",
        "province": "137500000",
        "modus": "Salisi (Cellphone)",
        "crimetype": "10",
        "station": "Police Station 04 Valenzuela City",
        "moduscode": "mc18",
        "date_com": "2017-03-15",
        "datechar": "3/15/2017"
    },
    {
        "lng": "120.97",
        "lat": "14.6936",
        "date": "2017-03-15",
        "customdate": "Wed - Mar 15, 2017",
        "time": "08:00:00",
        "customtime": "8:00:AM",
        "crime": "THEFT",
        "location": "Malinta, Valenzuela City, Ncr District 3 (Northern), NCR",
        "region": "130000000",
        "province": "137500000",
        "modus": "Salisi",
        "crimetype": "10",
        "station": "Police Station 04 Valenzuela City",
        "moduscode": "mc12",
        "date_com": "2017-03-15",
        "datechar": "3/15/2017"
    },
    {
        "lng": "120.961",
        "lat": "14.6715",
        "date": "2017-03-16",
        "customdate": "Thu - Mar 16, 2017",
        "time": "02:30:00",
        "customtime": "2:30:AM",
        "crime": "THEFT",
        "location": "Catmon, Malabon City, Ncr District 3 (Northern), NCR",
        "region": "130000000",
        "province": "137500000",
        "modus": "Plain Theft",
        "crimetype": "10",
        "station": "Police Station 02 Malabon City",
        "moduscode": "mc28",
        "date_com": "2017-03-16",
        "datechar": "3/16/2017"
    },
    {
        "lng": "120.95",
        "lat": "14.6607",
        "date": "2017-03-16",
        "customdate": "Thu - Mar 16, 2017",
        "time": "21:00:00",
        "customtime": "9:00:PM",
        "crime": "THEFT",
        "location": "San Agustin, Malabon City, Ncr District 3 (Northern), NCR",
        "region": "130000000",
        "province": "137500000",
        "modus": "Plain Theft",
        "crimetype": "10",
        "station": "Police Station 02 Malabon City",
        "moduscode": "mc28",
        "date_com": "2017-03-16",
        "datechar": "3/16/2017"
    },
    {
        "lng": "120.991",
        "lat": "14.707",
        "date": "2017-03-16",
        "customdate": "Thu - Mar 16, 2017",
        "time": "05:00:00",
        "customtime": "5:00:AM",
        "crime": "THEFT",
        "location": "Paso De Blas, Valenzuela City, Ncr District 3 (Northern), NCR",
        "region": "130000000",
        "province": "137500000",
        "modus": "Qualified Theft",
        "crimetype": "10",
        "station": "Police Station 04 Valenzuela City",
        "moduscode": "mc66",
        "date_com": "2017-03-16",
        "datechar": "3/16/2017"
    },
    {
        "lng": "120.951",
        "lat": "14.6599",
        "date": "2017-03-17",
        "customdate": "Fri - Mar 17, 2017",
        "time": "02:00:00",
        "customtime": "2:00:AM",
        "crime": "THEFT",
        "location": "San Agustin, Malabon City, Ncr District 3 (Northern), NCR",
        "region": "130000000",
        "province": "137500000",
        "modus": "Plain Theft",
        "crimetype": "10",
        "station": "Police Station 02 Malabon City",
        "moduscode": "mc28",
        "date_com": "2017-03-17",
        "datechar": "3/17/2017"
    },
    {
        "lng": "120.971",
        "lat": "14.693",
        "date": "2017-03-18",
        "customdate": "Sat - Mar 18, 2017",
        "time": "09:00:00",
        "customtime": "9:00:AM",
        "crime": "THEFT",
        "location": "Malinta, Valenzuela City, Ncr District 3 (Northern), NCR",
        "region": "130000000",
        "province": "137500000",
        "modus": "Qualified Theft",
        "crimetype": "10",
        "station": "Police Station 04 Valenzuela City",
        "moduscode": "mc66",
        "date_com": "2017-03-18",
        "datechar": "3/18/2017"
    },
    {
        "lng": "120.993",
        "lat": "14.7277",
        "date": "2017-03-18",
        "customdate": "Sat - Mar 18, 2017",
        "time": "23:39:00",
        "customtime": "11:39:PM",
        "crime": "THEFT",
        "location": "Lawang Bato, Valenzuela City, Ncr District 3 (Northern), NCR",
        "region": "130000000",
        "province": "137500000",
        "modus": "Salisi",
        "crimetype": "10",
        "station": "Police Station 04 Valenzuela City",
        "moduscode": "mc12",
        "date_com": "2017-03-18",
        "datechar": "3/18/2017"
    },
    {
        "lng": "120.99",
        "lat": "14.7368",
        "date": "2017-03-19",
        "customdate": "Sun - Mar 19, 2017",
        "time": "22:00:00",
        "customtime": "10:00:PM",
        "crime": "THEFT",
        "location": "Punturin, Valenzuela City, Ncr District 3 (Northern), NCR",
        "region": "130000000",
        "province": "137500000",
        "modus": "Qualified Theft",
        "crimetype": "10",
        "station": "Police Station 04 Valenzuela City",
        "moduscode": "mc66",
        "date_com": "2017-03-19",
        "datechar": "3/19/2017"
    },
    {
        "lng": "121.021",
        "lat": "14.6939",
        "date": "2017-03-20",
        "customdate": "Mon - Mar 20, 2017",
        "time": "01:00:00",
        "customtime": "1:00:AM",
        "crime": "THEFT",
        "location": "Ugong, Valenzuela City, Ncr District 3 (Northern), NCR",
        "region": "130000000",
        "province": "137500000",
        "modus": "Salisi (Others)",
        "crimetype": "10",
        "station": "Police Station 04 Valenzuela City",
        "moduscode": "mc69",
        "date_com": "2017-03-20",
        "datechar": "3/20/2017"
    },
    {
        "lng": "120.963",
        "lat": "14.6575",
        "date": "2017-03-20",
        "customdate": "Mon - Mar 20, 2017",
        "time": "04:15:00",
        "customtime": "4:15:AM",
        "crime": "THEFT",
        "location": "Barangay 14, Kalookan City, Ncr District 3 (Northern), NCR",
        "region": "130000000",
        "province": "137500000",
        "modus": "Salisi",
        "crimetype": "10",
        "station": "Police Station 01 Caloocan City",
        "moduscode": "mc12",
        "date_com": "2017-03-20",
        "datechar": "3/20/2017"
    },
    {
        "lng": "120.996",
        "lat": "14.7",
        "date": "2017-03-21",
        "customdate": "Tue - Mar 21, 2017",
        "time": "07:20:00",
        "customtime": "7:20:AM",
        "crime": "THEFT",
        "location": "Parada, Valenzuela City, Ncr District 3 (Northern), NCR",
        "region": "130000000",
        "province": "137500000",
        "modus": "Basag Salamin",
        "crimetype": "10",
        "station": "Police Station 04 Valenzuela City",
        "moduscode": "mc18",
        "date_com": "2017-03-21",
        "datechar": "3/21/2017"
    },
    {
        "lng": "120.981",
        "lat": "14.6888",
        "date": "2017-03-22",
        "customdate": "Wed - Mar 22, 2017",
        "time": "19:30:00",
        "customtime": "7:30:PM",
        "crime": "THEFT",
        "location": "Karuhatan, Valenzuela City, Ncr District 3 (Northern), NCR",
        "region": "130000000",
        "province": "137500000",
        "modus": "Bag Snatching",
        "crimetype": "10",
        "station": "Police Station 04 Valenzuela City",
        "moduscode": "mc10",
        "date_com": "2017-03-22",
        "datechar": "3/22/2017"
    },
    {
        "lng": "120.984",
        "lat": "14.6516",
        "date": "2017-03-22",
        "customdate": "Wed - Mar 22, 2017",
        "time": "20:00:00",
        "customtime": "8:00:PM",
        "crime": "THEFT",
        "location": "Barangay 68, Kalookan City, Ncr District 3 (Northern), NCR",
        "region": "130000000",
        "province": "137500000",
        "modus": "Pick-Pocketing",
        "crimetype": "10",
        "station": "Police Station 01 Caloocan City",
        "moduscode": "mc13",
        "date_com": "2017-03-22",
        "datechar": "3/22/2017"
    },
    {
        "lng": "121.021",
        "lat": "14.6956",
        "date": "2017-03-23",
        "customdate": "Thu - Mar 23, 2017",
        "time": "08:30:00",
        "customtime": "8:30:AM",
        "crime": "THEFT",
        "location": "Ugong, Valenzuela City, Ncr District 3 (Northern), NCR",
        "region": "130000000",
        "province": "137500000",
        "modus": "Plain Theft",
        "crimetype": "10",
        "station": "Police Station 04 Valenzuela City",
        "moduscode": "mc28",
        "date_com": "2017-03-23",
        "datechar": "3/23/2017"
    },
    {
        "lng": "121.009",
        "lat": "14.7213",
        "date": "2017-03-24",
        "customdate": "Fri - Mar 24, 2017",
        "time": "10:00:00",
        "customtime": "10:00:AM",
        "crime": "THEFT",
        "location": "Barangay 166, Kalookan City, Ncr District 3 (Northern), NCR",
        "region": "130000000",
        "province": "137500000",
        "modus": "Qualified Theft",
        "crimetype": "10",
        "station": "Police Station 01 Caloocan City",
        "moduscode": "mc66",
        "date_com": "2017-03-24",
        "datechar": "3/24/2017"
    },
    {
        "lng": "120.975",
        "lat": "14.6378",
        "date": "2017-03-24",
        "customdate": "Fri - Mar 24, 2017",
        "time": "13:45:00",
        "customtime": "1:45:PM",
        "crime": "THEFT",
        "location": "Barangay 34, Kalookan City, Ncr District 3 (Northern), NCR",
        "region": "130000000",
        "province": "137500000",
        "modus": "Shoplifting",
        "crimetype": "10",
        "station": "Police Station 01 Caloocan City",
        "moduscode": "mc72",
        "date_com": "2017-03-24",
        "datechar": "3/24/2017"
    },
    {
        "lng": "120.982",
        "lat": "14.6739",
        "date": "2017-03-24",
        "customdate": "Fri - Mar 24, 2017",
        "time": "19:00:00",
        "customtime": "7:00:PM",
        "crime": "THEFT",
        "location": "Marulas, Valenzuela City, Ncr District 3 (Northern), NCR",
        "region": "130000000",
        "province": "137500000",
        "modus": "Qualified Theft",
        "crimetype": "10",
        "station": "Police Station 04 Valenzuela City",
        "moduscode": "mc66",
        "date_com": "2017-03-24",
        "datechar": "3/24/2017"
    },
    {
        "lng": "120.979",
        "lat": "14.6785",
        "date": "2017-03-24",
        "customdate": "Fri - Mar 24, 2017",
        "time": "22:00:00",
        "customtime": "10:00:PM",
        "crime": "THEFT",
        "location": "Marulas, Valenzuela City, Ncr District 3 (Northern), NCR",
        "region": "130000000",
        "province": "137500000",
        "modus": "Pick-Pocketing",
        "crimetype": "10",
        "station": "Police Station 04 Valenzuela City",
        "moduscode": "mc13",
        "date_com": "2017-03-24",
        "datechar": "3/24/2017"
    },
    {
        "lng": "120.957",
        "lat": "14.6502",
        "date": "2017-03-25",
        "customdate": "Sat - Mar 25, 2017",
        "time": "05:15:00",
        "customtime": "5:15:AM",
        "crime": "THEFT",
        "location": "North Bay Blvd., South, Navotas, Ncr District 3 (Northern), NCR",
